text	label
Any way to get SharePoint to STOP converting attachment file names to all lower case on inbound emails?	sharepoint
SharePoint exception documentation	sharepoint
Programatically logging to the Sharepoint ULS	sharepoint
Sharepoint: How to set the permission to edit WSS user profile	sharepoint
SharePoint OOTB Workflow Problem	sharepoint
Developing for Sharepoint 2003 using Visual Studio 2008?	sharepoint
SharePoint - Connection String dialog box during FeatureActivated event	sharepoint
MOSS Web Solution Package breaks when moved	sharepoint
Placing a Sharepoint Site under version control	sharepoint
Configuring MOSS and Reporting Services on a Domain Controller	sharepoint
SharePoint survey question ordering	sharepoint
SharePoint AValiablity	sharepoint
SharePoint searching external database	sharepoint
DateTime Hex Format	sharepoint
Deploy a resource file to App_GlobalResource folder on activation	sharepoint
MOSS 2007: SPListItem.GetFormattedValue for DateTime fields has a bug?	sharepoint
Order documents by most popular in sharepoint content query webpart	sharepoint
CAML query to add a ListItem in Sharepoint	sharepoint
SharePoint Web Service Credentials	sharepoint
display an image pulled from sharepoint using xslt	sharepoint
How do I check if a Sharepoint Document Library has the Require Approval flag set, using the Sharepoint API ?	sharepoint
"Why would clicking ""View All Site Content"" generate an error?"	sharepoint
SharePoint Designer Workflow: Unruly 'Collect User Data' Action	sharepoint
Getting the NT-ID of a user in SharePoint	sharepoint
SharePoint - simplest feature config to register a server control?	sharepoint
How to detect the item restore on a ItemAdded() event on SharePoint	sharepoint
CustomAction not appearing in ListView web part for SPList that does not inherit permissions	sharepoint
Sharepoint Web Services Tutorial	sharepoint
PortalSiteMapProvider causing excessive SPRequest objects	sharepoint
Anyone used CSS blueprint with Sharepoint sites	sharepoint
"Sharepoint: Best way to display lists of non-Sharepoint content with ""compatible"" UI?"	sharepoint
Can a SharePoint list item have it's Targeted Audience calculated or otherwise automatically specified?	sharepoint
Override SPList.WriteSecurity behaviour?	sharepoint
How to SSL enable SharePoint	sharepoint
Sharepoint direcory list	sharepoint
Sharepoint: How to find out whether an realtive URL is available or already used by a site	sharepoint
SharePoint List Pre-Population	sharepoint
Best way to migrate site content into a new SharePoint site	sharepoint
SharePoint Table of Contents Web Part and export/import	sharepoint
What are some good resources on integrating web apps with SharePoint?	sharepoint
how to localise a sharepoint site for different languages	sharepoint
Hiding some user profiles temporary from search	sharepoint
Display SharePoint lookup field on publishing website	sharepoint
Sharepoint OnWorkflowItemChanged before/after properties lists	sharepoint
SharePoint List Scalability	sharepoint
SharePoint: How to determine a site's site directory	sharepoint
How to deploy Sharepoint publishing site with multiple sites	sharepoint
SharePoint List That Pulls From Other Lists	sharepoint
Storing Feature Configuration within Sharepoint	sharepoint
Getting all the webpages of a SPWeb and subwebs that have a field with a value in Sharepoint?	sharepoint
how to deploy web.config modifications in a Sharepoint web application?	sharepoint
Sharepoint stripping HTTP Headers	sharepoint
Is it possible to have a custom webpart listen to default SharePoint search box?	sharepoint
Update Files in Sharepoint Document Library	sharepoint
How do I read/write Person metadata from a Word doc stored in SharePoint using VBA or VSTO?	sharepoint
How should I use this SetSPN command when installing SharePoint	sharepoint
Tracking permissions in SharePoint	sharepoint
WSS 2.0 - Creating SPSite with a user token	sharepoint
Edit .doc in Word via custom Document Library DispForm.aspx	sharepoint
SharePoint (MOSS 2007) remove user	sharepoint
How can you work out the ID of a users MySite	sharepoint
SharePoint web services: test if file exists	sharepoint
SharePoint Deployment Failure Using VS2008 Command Line	sharepoint
Creating a sub site in SharePoint takes a very long time	sharepoint
Sharepoint: how can i find all the pages that host a particular web part?	sharepoint
Clean document roles in a Doc Library	sharepoint
Packaging multiple features into a single WSP solution file	sharepoint
SharePoint Permission Levels in Production for Developers	sharepoint
Transfer files with versioning using SharePoint and SOAP	sharepoint
Create a new field and update a content type (and all implementations)	sharepoint
SharePoint problem using a Feature with AllUsersWebPart node	sharepoint
"Sharepoint Workflow: How do I get the ""BeforeProperties"" in a WorkflowItemChanged event handler"	sharepoint
Extending Sharepoint XSL template	sharepoint
"""The selected files was not found"" on an InfoPath form in Sharepoint"	sharepoint
Sharepoint SSL Web.Config access issue.	sharepoint
SharePoint custom context menu in custom list appears on folders and not just files	sharepoint
How do I call a Sharepoint Webservice from a c# client using Kerberos authentication ?	sharepoint
Sharepoint task list doesn't send email on item creation	sharepoint
Getting properies from SharePointWebControls	sharepoint
SPCrossListQuery fails to bring back results	sharepoint
Page Layout does not appear in the page layouts list	sharepoint
Howto get SharePoint version using object model	sharepoint
How is SharePoint perceived in your Organisation?	sharepoint
Why does my Out of the Box SharePoint Navigation look like it is leaking memory	sharepoint
Microsoft Sharepoint	sharepoint
MOSS 2007 Crawl	sharepoint
Howto: enable anonymous surveys in sharepoint	sharepoint
Running away from SharePoint	sharepoint
"Creating a workflow task generates an ""Invalid field name"" error"	sharepoint
Displaying code snippets in Sharepoint wiki	sharepoint
best of sharepoint	sharepoint
Sharepoint ItemStyle.xsl for CQWP using images from a content type	sharepoint
SPListItem.Properties DateTime Fields are in weird Hex format	sharepoint
Do I have to use InfoPath forms for every task within a SharePoint workflow?	sharepoint
Customize the Sharepoint add list column page	sharepoint
Deployed Web Part not showing up in 'Web Part Gallery: New Web Parts'	sharepoint
Handling event when approving a document.	sharepoint
Setting document library permissions in WSS 2.0	sharepoint
Adding presence indicator to a custom web part	sharepoint
xslt hyperlink, seperate the url and descption	sharepoint
Sharepoint/WSS: helping writing xpath conditional expression	sharepoint
Sharepoint List redirect with new id	sharepoint
Sharepoint StateMachine : Handling multiple responses to multiple created tasks	sharepoint
Customizing pages view in Sharepoint	sharepoint
Accessing SPWorkflowStatus from an SPListItem	sharepoint
Open Source SharePoint?	sharepoint
Required Fields in Share Point data collection not throwing errors	sharepoint
CAML query to locate specific SPFolder nested in document library tree	sharepoint
Viewstate error on SharePoint custom site page with SPGridView	sharepoint
Sharepoint Search Property Weighting	sharepoint
Workflow Auto Cleanup timer job does not run	sharepoint
Sharepoint Blog: lost join between categories and post when convert WebPart to XSLT	sharepoint
Updating WebPart Properties using RunWithElevatedPrivileges in MOSS 2007	sharepoint
SharePoint and workflows	sharepoint
sharepoint web services in subwebs	sharepoint
User Profile Import - more than on Search Base	sharepoint
Upload document to specific folder in a SharePoint Document library using WebClient	sharepoint
Sharepoint 2007 maintenance and staging	sharepoint
SharePoint SPSite Disposing	sharepoint
How to move documents and list items in Windows SharePoint Services?	sharepoint
Inconsistent display behavior for Quick Launch menu in MOSS 2007	sharepoint
BusinessDataList Web Part Edit view using code.	sharepoint
User Experiences for  Visual Studio 2008 extensions for SharePoint v1.3 CTP	sharepoint
SharePoint SPListItemCollection ReorderItems	sharepoint
How to access the uiserID of the user who initiated a workflow	sharepoint
SharePoint: What is the max size of the multi line text field? Can I set it?	sharepoint
CMS for SharePoint	sharepoint
Is Sharepoin Server mandatory for Excel Services or Excel Web Access	sharepoint
"SharePoint: ""Failed to extract the cab file in the solution"""	sharepoint
Removing contents of PlaceHolderPageTitleInTitleArea	sharepoint
Logging in as another user in sharepoint	sharepoint
How to find default crawling account for all shared service providers in MOSS	sharepoint
How to Publish a SharePoint site on the internet	sharepoint
How to open a link from one web app to another already authenticated?	sharepoint
Sharepoint User Favorite Documents	sharepoint
SharePoint: Temporary switching PageLayout of PublishingPage in HttpModule fails	sharepoint
Can I programaticaly replace one webpart with another in Sharepoint?	sharepoint
How can I fill in a Sharepoint List edit form offline using Windows Mobile 5.0 Quickly?	sharepoint
Get Max Date Using CAML Query From alist	sharepoint
Complex form design in Sharepoint	sharepoint
Sharepoint webpart and overiding the css style	sharepoint
Wrapping text inside a bound field in SPGridView	sharepoint
Get the pages of a multipage meeting workspace	sharepoint
Change the default list aspx pages in SharePoint	sharepoint
Using fields from a 'lookup-ed' sharepoint list	sharepoint
Test deployment for Sharepoint by multiple developers on a single server	sharepoint
Performance data analysis in SharePoint	sharepoint
How to update SharePoint Content Type?	sharepoint
"How to force SharePoint tasks to be editable by ""Assigned To"" only?"	sharepoint
Must Have SharePoint dev tools	sharepoint
Custom SharePoint List View - can I put it in a feature (WSP)?	sharepoint
Sync SharePoint Sets with File System?	sharepoint
SharePoint: Why does a content deployment job customize all my master pages?	sharepoint
SharePoint Event when Permissions of ListItems have been changed ?	sharepoint
How should SharePoint developers work with the graphics designer on their projects?	sharepoint
SPWorkflowTaskProperties.ExtendedProperties aren’t populating the fields in my task	sharepoint
LazyInitializationException in Spring	spring
An RMIPRoxyFactoryBean factory in Spring?	spring
Spring - Annotation Based Controller - RequestMapping based on query string	spring
ACL architechture for a Software As a service in Sprgin 3.0	spring
File based Spring Security	spring
on submit action	spring
Spring Application Context available inside the constructor	spring
setting a property in a spring bean outside the spring bean definintion.	spring
Spring + Hibernate Dynamic Mapping	spring
Compiling jasperreports automatically on change	spring
com iplanet AsException when trying to instantiate spring bean outside container	spring
Spring- How to use Springs Dependancy Injection to write a Standalone Java Applicaiton	spring
"Spring Security OpenID - Unable to Process claimed identity ""null"""	spring
Getting LazyInitializationException when trying to integrate Hibernate and SpringMVC for a web app	spring
TransactionProxyFactoryBean when switching from configuration-based Service beans to annotation based service beans	spring
Slow to start after upgraded to Spring 3	spring
Making sure a Spring Bean is properly initialised	spring
How to modify beans defined in a spring container	spring
EntityManager merge/persist problem	spring
Custom spring scopes ?	spring
Getting the caller to a Spring AOP Proxy	spring
How do I get spring to inject my EntityManager?	spring
Spring + Tiles2 + Freemarker - integrate via Freemarker Servlet or via Spring's FreeMarkerViewResolver?	spring
multiple security:custom-authentication-provider	spring
Is it possible to configure a Spring session scoped bean with attributes from the session?	spring
Real life business case for using spring method replacement?	spring
Spring 3.0M4 and passing objects as parameters to POST	spring
How configure a RESTful controller in Spring 3 with annotations?	spring
Single DispatcherServlet with Multiple Controllers	spring
Spring to understand properties in YAML	spring
ConstraintViolationException VS DataIntegrityViolationException	spring
Is Spring hard compaired to Ruby on Rails?	spring
Can I dynamically load additional Spring configuration files into an existing WebApplicationContext?	spring
In a mvc application, where will the DI take place?	spring
Spring & Hibernate SessionFactory - recovery from a down server	spring
Server side MVC +Client side MVC	spring
@Autowired and TransactionProxyFactoryBean?	spring
call valang validator in MultiActionController ModelAndView method... possible? how?	spring
Is there a good reference for how Grails was architected with Spring?	spring
org.springframework.transaction.annotation.Transactional vs javax.jdo.annotations.Transactional	spring
Spring configuration file cannot parse elements defined in my own schema	spring
Spring 3 simple extentionless url mappings with annotation-based mapping - impossible?	spring
How to batch delete using bulkUpdate	spring
DAO, Spring, Hibernate, Jboss	spring
How can I cancel a long-running query using Spring and JDBCTemplate?	spring
Translate Spring XML configuration to Java config	spring
EntityManager injection with JPA	spring
Spring 3.0 set and get session attribute	spring
Circular Dependency and Spring-powered Event Queue	spring
How to Inject Spring  ReloadableResourceBundleMessageSource	spring
Spring-modules caching not working... silently.	spring
Anybody using Qi4J	spring
Is there a static way to get the HttpServletRequest of the current request	spring
Problem with Spring @Configuration class	spring
view is not rendered when returning ModelAndView	spring
Spring WebContent Resources - Access outside ServletContext	spring
Spring RuntimeBeanReference	spring
Roles/Priviledges in a Spring/Hibernate application	spring
<on-start> Expression	spring
Spring using JNDI with Tomcat... why do I need a META-INF/context.xml in my project	spring
Is there a transaction management for DAO in Spring framework?	spring
In spring, what code is used to inject the value for the @PersistenceContext annotated variables?	spring
What would be the Spring way of using TCP connections?	spring
different using @Transactional and spring template ?	spring
Integrating Spring + Hibernate + Sql server with unicode support	spring
error handling with spring + servlet spec	spring
Spring-MVC is adding on an extra .jsp extention to the URL a user enters	spring
Spring XML inner bean question	spring
how does a spring framework works?	spring
Downloading spring 3.0 with dependencies?	spring
Eclipse Spring Builder set properties with Groovy beans	spring
Spring Security UserDetails Best Practice	spring
Naming convention for Spring application context XML	spring
Spring: How to programmatically define FactoryBean	spring
Spring validation errors not displayed	spring
How to implement pagination is spring mvc 3	spring
Unit Testing Hibernate's Optimistic Locking (within Spring)	spring
spring vs ejb. can spring replace ejb?	spring
Running spring program inside application server	spring
Cannot get bean from flowScope	spring
g:set blocks out my code	spring
global properties in spring	spring
Spring Security 3.0 and Active Directory LDAP: DOMAIN\user login	spring
spring: set property of one bean by reading the property of another bean?	spring
Is It Possible To Spring Autowire the same Instance of a protoype scoped class in two places	spring
How to define Spring datasource in controller ?	spring
Best way to force Spring shutdown from a bean?	spring
Problem migrating Spring Web App from tomcat 5.5 to tomcat 6.0	spring
IllegalArgumentException for dataSource in Spring application	spring
Spring, db and property file configuration.	spring
In Java/Spring, how do you setup the hashmap to append the query string?	spring
How to inject spring beans into a jsp 2.0 SimpleTag ?	spring
Spring JDBC connection pool and InputStream results	spring
Location of view.properties in my proyect spring mvc jasperreports	spring
Spring dependency injection in construcor with annotations	spring
Pointcut not working with Spring AOP	spring
Spring @Transactional Annotation Best Practice	spring
What causes a Spring 1.2 NullPointerException when creating prepared statement?	spring
problem in Spring session scope bean with AOP	spring
Spring: Is there a simple non-web tutorial?	spring
Registering a shutdown hook in Spring 2.5	spring
Spring Security basics	spring
Spring MVC Custom Authentication	spring
How can I access the ApplicationContext from within a JAX-WS web service?	spring
How does Spring for Python compare with Spring for Java	spring
sitemesh and spring MVC decorator pattern problems	spring
JPA Multiple Persisrtence Unit [bug]	spring
multiple session factories, one connection?	spring
How to inject dependencies into HttpSessionListener, using Spring?	spring
How to throw an informative exception from AccessDecisionManager that uses voters	spring
do i need to worry about concurancy with tomcat spring beans	spring
spring roo backup command lost my files	spring
How to use spring to resolve dependencies of an object created manually?	spring
spring portlet MVC and request params	spring
spring batch insert using hibernateTemplate, JdbcTemplate	spring
DefaultMessageListenerContainer not working with Websphere MQ	spring
Spring + Hibernate - multiple databases	spring
Caching with Spring Framework	spring
Database connection management in Spring	spring
Spring and hibernate.cfg.xml	spring
integrating springMVC and extjs	spring
Database-sessions in Spring	spring
Get Spring Security intercept urls from database or properties	spring
How to create a custom EL expression handling regime for jBPM	spring
Dependency Injection mechanism	spring
Null Inner Bean with Spring IoC	spring
How can I determine what roles are required to access a URL with Spring Security?	spring
Java Project Configuration	spring
SPRING: What is AOP, Dependency Injection and Inversion Of Control in Simple English	spring
lazyinializationexception with transactional annotation in messageconvert	spring
Is the following utility class thread-safe?	spring
No Runnable methods Error From Base Test class	spring
Spring Web Flow  Error MEssages	spring
Spring context files organization and best practices	spring
Problem with Autowiring & No unique bean	spring
Ant target for compile-time code instrumentation with Spring aspects	spring
Ready configurations for Spring + Hibernate	spring
Spring Framework Events	spring
Spring DI, Domain Model & best practices	spring
Estimating a Spring/Hibernate project.	spring
Spring Transaction Management Test	spring
@Secured()      is there any statement show on log...?	spring
What is the problem with not using Spring	spring
Spring Webflow Best Practice	spring
Add Principal/authority dynamically for anonymous user	spring
Java Execution Context Class Explain	spring
Logging user agent info on login with Spring Security	spring
Multiple servers checking and writing flag in database	spring
Spring and view resolvers	spring
Which maven modules to include for spring 3.0?	spring
How to create the file browser in view for spring roo?	spring
Trouble stopping Tomcat due to apparent threading issue..	spring
Spring and the anemic domain model	spring
Spring 2.2.5 and Xfire 1.2.6 - NoSuchMethodError: <init>	spring
Sharing Spring Security Configuration Between Applications	spring
extending spring form tag library attributes	spring
Spring DefaultMessageListenerContainer, ActiveMQ and message redelivery	spring
Why does Spring's @Configurable sometimes work and sometimes not?	spring
SOAP and Spring	spring
Spring Security Encypt MD5	spring
Autostart spring app	spring
Getting server name in ContextLoaderListener	spring
Add SoapHeader to org.springframework.ws.WebServiceMessage	spring
Different views with Spring's SimpleFormController	spring
Access properties file programatically with Spring?	spring
Spring-AOP	spring
Different i18n in spring according to url	spring
Spring Annotation-based controllers not working if it is inside jar file	spring
Extending spring's default component factory	spring
Where to store database passwords in a spring application or use JNDI?	spring
How to create CommonsMultipartFile object given only a file.	spring
Narrowing problem with Spring MVC annotation-based controller and @RequestMapping	spring
Which hibernate adapter should I use to handle Lazy Initialization in BlazeDS / Spring integration projects with Flex?	spring
duplicate spring configruations being loaded?	spring
Usage question: Spring AOP vs. AspectJ weaving	spring
Spring servlet mapping - no css or jsp!	spring
How to nest Spring JMS MessageConverters	spring
How to use Spring to inject an object in a setter that doesnt follow the Java bean specification ?	spring
Exposing multiple objects with RMI in Spring	spring
How do I get the value of the jdbc.batch_size property at runtime for a Web application using Spring MVC and Hibernate?	spring
Can't delete recycling bin when code from svn is in it	svn
"Recovering from an unfortunate ""svn copy"""	svn
Try to svn checkout, but get: svn: '.' is already a working copy for a different URL	svn
Best tools for code reviews	svn
How do I use the new SVN merge-tracking?	svn
include externals in subversion diff	svn
How can I change the commiter of an old revision in SVN	svn
Is there any way to throttle the network bandwidth that an svn checkout does?	svn
How do I know which files in a directory arn't in my SVN repository?	svn
How to tell SVN to ignore files for all team members	svn
Relative Path in Subversion external configuration	svn
Subversion for iSeries	svn
Recover files from old Subversion backup	svn
Subversion: How to merge only specific revisions into trunk?	svn
How to maintain a locally modified copy of an external svn repository	svn
Branching from deleted path in svn	svn
Best way to migrate from VSS to Subversion?	svn
Why does TortoiseSVN (1.5.3) try to merge 1-Head when I pull from trunk?	svn
Alternative to binaries in Subversion	svn
How do I correct a Subversion project where I omitted trunk?	svn
Create a tag upon every build of the application?	svn
Which version control tool is best sutiable to handle reflective or cyclic mergeing? SVN, Git?	svn
Where can I find the file VisualSVNServerHooks.exe	svn
Script to backup svn repository to network share	svn
Visual SVNServer with Trac	svn
tortise svn icons not showing up under windows 7	svn
Unlocking a SVN working copy which has unversioned resources	svn
Can svn:externals be used while ignoring externals for that URL?	svn
SVN - How to set all files to same revision number and date.	svn
How to quickly search a subversion repository?	svn
Code Promotion: Build or Binary?	svn
Is there a tool to read a subversion repository via .net?	svn
"""Phantom"" directories in an SVN repository"	svn
SVN\Tortoise painfully slow	svn
partial commits with subversion	svn
Confusing Subversion Status !M	svn
Subversion not merging changes into renamed files?	svn
Are merges in subversion more difficult than in Team Foundation System?	svn
How to use Subversion for non-compiled language?	svn
Standard diff format in SVN	svn
Is it safe to commit more files as a pre-commit hook	svn
How do I connect to a remote svn server?	svn
What is the optimal way to organize shared .net assemblies in SVN?	svn
What is the best way to make files live using subversion on a production server?	svn
How to set up a not-local svn-server?	svn
TortoiseSVN compatibility mode	svn
svn ignore without deleting files?	svn
SVN: Track merges	svn
SVN - Not a working copy error	svn
Subversion ignore classes directory after its been added (and linked to src directory)	svn
In Subversion can I be a user other than my login name?	svn
Using Revision Control  for home development	svn
Subversion Berkeley DB broken, recovery failed.	svn
Can someone explain source (versioning) control to me?	svn
Best setup for code promotion and feature branching in Subversion?	svn
"What is a working copy and what does ""switching"" do for me in Tortoise SVN?"	svn
How do you arrange several proyects in a single SVN server?	svn
How do you move a file in SVN?	svn
How to reset svn-properties according to new SVN config?	svn
Undo SVN delete ./* --force	svn
SVN analysis tool	svn
Disabling the constant upgrade messages from subversion clients...	svn
Easy way to embed svn revision number in page in PHP?	svn
Subversion question: How can I use post-commit hooks to copy committed files to a web directory?	svn
Get log details for a specific revision number in a post-commit hook with SharpSVN?	svn
Configuring Subversion to use system users/passwords	svn
if i have Windows, Mac, and Linux, what is the easiest way to set up SVN server?	svn
What  is the best practice regarding Source code managment ?	svn
"How do I undo ""svn switch"" on a subdirectory?"	svn
Using svnversion with svn:keywords	svn
SVN branching and merging in a rapidly changing feature environment with a high-turnover	svn
Upgrading to SVN 1.5	svn
How do I list all repositories with the SVNParentPath directive on Apache+SVN?	svn
How to do a bulk svn mv in Unix	svn
SVN workflow, LAMP	svn
Best way to track and enforce peer reviews before commit	svn
SVN and Visual Foxpro Databases	svn
How do I branch an individual file in SVN?	svn
With svn how do I add a log message to trunk when creating a tag?	svn
Better Merge Tool for Subversion	svn
Sending SVN commits to an RSS feed	svn
Subversion: error on checkout - Mac OS 10.5	svn
Best way to let third-parties work on your site	svn
Is there a tool that can display a SVN repository visually ( i.e. pretty charts )?	svn
SVN Doubt - VMWARE Image / Install / Hosted which would you pick?	svn
using subversion with a really really big site	svn
