text	label
Magento: What is the best way to extend Magento to add a class that is called on every page load	magento
Not able to check if user is logged in magento system in footer.phtml file on some pages	magento
Why is this class re-initialized every time?	matlab
Gaussian filter in Matlab	matlab
how to shear image in matlab without using built in function?	matlab
Converting binary to decimal without using loop	matlab
Alternate method to kron	matlab
Stumped trying to implement Save/Load object functionality in a MATLAB UI	matlab
Capitalize / Capitalise first letter of every word in a string in Matlab?	matlab
How to use a cross validation test with Matlab?	matlab
Matlab symbolic toolbox: What's wrong with my code?	matlab
matlab v.s. simulink in digital image processing?	matlab
Matlab Simulation: Point (symbol) Moving from start point to end point and back	matlab
matlab code for the horizontal mean filter	matlab
Handling large amount of structures in MATLAB	matlab
Constants in MATLAB	matlab
Is it possible for a MATLAB script to behave differently depending on the OS it is being executed on?	matlab
How to clear the console in Matlab	matlab
matlab image processing 3d	matlab
MATLAB for kids?	matlab
Curves in matlab	matlab
How do I change the Unit:Characters in Matlab?	matlab
Annotating Charts in Matlab	matlab
MATLAB functions in C++	matlab
MATLAB class array	matlab
How to plot large data vectors accurately at all zoom levels in real time?	matlab
How to graythresh a indexed image in matlab?	matlab
How to show x and y axes in Matlab graph?	matlab
accelerating Wheel - psychtoolbox in matlab	matlab
Is there a foreach in Matlab?  If so, how does it behave if the underlying data changes?	matlab
calculate array element persistence algorithm	matlab
Solving Algebraic Equations Programatically	matlab
Calculating the maximum distance between elements of vector in Matlab	matlab
how to divide an image in blocks in matlab	matlab
How do I roll out a Matlab app for others to use?	matlab
MATLAB pdist function	matlab
Matlab: How to get the current mouse position on a click by using callbacks	matlab
i want to use some Matlab functions via .dlls and use them in C#, pls Conduct which way i can doing that!?	matlab
matlab quickie: test if text file is empty	matlab
MATLAB: convert vector to cell array	matlab
What's this setting of MATLAB for(which is causing lots of troubles for lots of people)?	matlab
matlab - creating a single dimensional array from two dimensional parts	matlab
How can I tell if a rectangular matrix has duplicate rows in Matlab?	matlab
an axis is not showing up in Matlab	matlab
Generalized Gaussian Noise generator in matlab	matlab
Packaging of MATLAB code	matlab
How do I choose computer hardware which best optimizes the performance of MATLAB?	matlab
Variable length MATLAB arguments read from variable	matlab
Generating a list of dependencies in Matlab	matlab
Import & modify data in Matlab	matlab
Call c++ code from MATLAB	matlab
How to retrieve the background color of an arbitary image using MATLAB?	matlab
How do I emulate 'include' behaviour in Matlab?	matlab
How to preallocate an array of  class in MATLAB?	matlab
Best Matlab toolbox that implements Support Vector Regression?	matlab
memory not freed in matlab?	matlab
how to see the code fo a matlab mex file	matlab
how would i pick one node randomly from n no. of nodes,i have n random no. of nodes with x and y co-ordinates .(IN MATLAB)	matlab
Too many input arguments Matlab	matlab
getting variable values into a text string | MATLAB	matlab
"Matlab: ""Too many Input Arguments"" when not passing any!"	matlab
How to deal with the warnings when importing BNT tools in MATLAB?	matlab
How to make Matlab xUnit work on Matlab R2008b (7.7)?	matlab
image processing toolbox in matlab	matlab
??? Error using ==> dlmread at 55 Filename must be a string.	matlab
In MATLAB, what ASCII characters are allowed to be in a function name?	matlab
How to make a Simple FIR Filter using Matlab?	matlab
how to divide a spectogram into a certain number of ranges using mel filter banks using matlab???	matlab
How to generate a function of two variables in matlab without using any loop?	matlab
MATLAB image corner coordinates & referncing to cell arrays	matlab
What is MATLAB? Does it generate executables?	matlab
Compiling MatLab 2009b applications to Windows Executables	matlab
Combining Structures	matlab
Tab-completion of filenames	matlab
Fastest way to import CSV files in MATLAB	matlab
In need of a good MATLAB class tutorial	matlab
Statistics toolbox in Matlab	matlab
How do you handle resources in Matlab in an exception safe manner?	matlab
"Prevent ""MATLAB"" folder in My Documents"	matlab
Extended maxima transform in Matlab	matlab
Matlab: Magnetic fields calculated with biot-savarts-law	matlab
matlab error using m power	matlab
How to concatenate two strings in MATLAB?	matlab
how can I find the parameters of matrix-equation in matlab?	matlab
Loopless  function calls on vector/matrix members in Matlab/Octave	matlab
How do I abort a MATLAB m-file function from C/C++?	matlab
plotting matworks logo and heartshape	matlab
What's the Matlab equivalent of NULL, when it's calling COM/ActiveX methods?	matlab
"exchange axis of an ""ezplot"""	matlab
Compact matlab matrix indexing notation	matlab
Thread safety of Matlab engine API	matlab
MATLAB - printing graph with different output names	matlab
How to convert m-files to dlls?	matlab
"MATLAB ""C"" DLL Errors"	matlab
Packages in MatLab for a beginner?	matlab
Matlab - add a plot to a hist	matlab
Am I using histc wrong, or it this matlab's fault?	matlab
What are the 3 dimensions of a RHB image in MatLab?	matlab
How to change Matlab program for solving equation with finite element method?	matlab
matlab:find the 4th vertice of a parallelogram	matlab
How to get name of an enumeration in MATLAB	matlab
MATLAB: what's the most elegant way to delete known element in matrix?	matlab
Is there a better way to declare an empty, typed matrix in MATLAB?	matlab
How do I label two vectors in Matlab?	matlab
Brackets at the start of input in matlab ?? [ x , y ] = ....	matlab
Binning in matlab	matlab
determine whether matlab license is server- or user-based	matlab
Maximum expression string length in regexp (MATLAB)	matlab
Problems with Matlab javabuilder and memory	matlab
Differences between matlab and comsol script?	matlab
Shading an area boundered by a curve	matlab
Whay was writtem matlab in C instead of Fortran?	matlab
Importing matlab functions in matlab	matlab
What does the JVM in MATLAB Compiler Runtime (MCR) do?	matlab
modem.oqpskmod for BER	matlab
Dimension Reduction	matlab
Is it possible in matlab to explicitly format the output numbers ?	matlab
tformfwd and tforminv - what's the difference?	matlab
What's the difference between {} and [] in MATLAB?	matlab
How to select which Matlab version to start from shell or Matlab startup?	matlab
How can I find the absolute maximum or minimum of a multi-dimensional matrix in Matlab?	matlab
Python to MATLAB: exporting list of strings using scipy.io	matlab
Iterating through struct fieldnames in MATLAB.	matlab
matlab oop: too slow to be useful ?	matlab
MATLAB How to divide a matrix into equals parts?	matlab
Checking if a matlab handle is a valid one	matlab
MATLAB: split long 2D matrix into the third dimension	matlab
"Matlab: ""grouping mean"""	matlab
Does white color has a fixed value(1 IMO) in an RGB image in MATLAB?	matlab
matlab and function	matlab
MATLAB: Assign multiple colors to text in legend	matlab
Calculating displacement moved in Matlab	matlab
Get the indices of the n largest elements in a matrix	matlab
two arrays defining 2d coordinates, as array indices, in matlab/octave	matlab
TreePlot String Labeling MATLAB	matlab
how to sketch a polygon in a matrix or binary image in order to use image processing functions?	matlab
License to Distribute Matlab code	matlab
Changing axes and color of plots in Matlab	matlab
Neural network XOR backpropagation info needed.	matlab
Multiple assignment in Matlab?	matlab
Turn Matlab plot into image	matlab
debug in matlab	matlab
MATLAB Array Manipulation	matlab
MATLAB: function makes 4 recursive calls. I have a 4-core processor. Can I parallelize?	matlab
Import ITK/VTK into Matlab or Matlab into VTK/ITK environment?	matlab
Matlab: preallocate a non-numeric vector?	matlab
What's the difference between [A,B] and [A;B] in MatLab?	matlab
Finding a certain value below the maxima in Matlab	matlab
MATLAB: Drawing a line over a black and white image	matlab
MATLAB: vectorized array creation from a list of start/end indices	matlab
How to create a string array in matlab?	matlab
Problem using find function in Matlab	matlab
There is a Matlab editor/plugin/version with better code completion ?	matlab
Matlab: how to create a  cell-array in Matlab from this type of  data	matlab
Multi-Dimension any()	matlab
Connect points and compute area	matlab
MATLAB - use a string to set the title of a graph	matlab
Simulink sim of rician channel ber process	matlab
Discrete Wavelet Transformation	matlab
Run-time error '-2147352567 (80020009)'	matlab
Fudge Factor in Matlab	matlab
How to generate a unit vector pointing in a random direction with isotropic distribution of direction?	matlab
Finding an approximate local maximas with noisy data in Matlab	matlab
Batch Processing Image Files in Matlab	matlab
half-sine pulse shaping	matlab
Converting convex hull to binary mask	matlab
how to find remaining nodes in following code which are not participating in making edges with each other?	matlab
Convert cell array of cells into cell array of strings in MATLAB	matlab
Matalb: convert global coordinates to figure coordinates	matlab
Matlab multiplication of 2 vectors error	matlab
Matlab Polymorphism question	matlab
[Matlab] Saved EPS image different than plotted chart	matlab
MATLAB Builder NE (.NET Assembly) Data type question	matlab
Matlab: Filling a matrix with each column being the same	matlab
"Matlab ""out of memory"" error"	matlab
how to create a very large matrix using matlab	matlab
how to assign random energy E to every node and compare two nodes for maximum energy and also find distance between them?	matlab
Color Comparison of two images using matlab	matlab
Can I use Matrix Vision frame grabbers with Matlab?	matlab
Strange classes passed from matlab to java	matlab
Matlab Maximum Function Count Exceeded	matlab
cell and array in Matlab	matlab
Oracle Ref Cursor Vs Select into with Exception handling	oracle
Oracle APEX access	oracle
How do you know what a good index is?	oracle
Oracle SQL technique to avoid filling trans log	oracle
Why does Char(1) change to Char(3) when copying over an Oracle DBLINK?	oracle
What's the equivalent of Oracle's to_char in AS400 DB2 SQL syntax?	oracle
SQL SELECT: combining and grouping data between three tables using subqueries	oracle
Unit testing for PL/SQL	oracle
Oracle: Program not forking correctly in SELECT CASE statement on a date	oracle
How to permit update of a view's results in Oracle?	oracle
Why does Oracle 9i treat an empty string as NULL?	oracle
How can multiple rows be concatenated into one in Oracle without creating a stored procedure?	oracle
How do I display the full content of LOB column in Oracle SQL*Plus?	oracle
Simulated OLAP	oracle
Explain Plan for Query in a Stored Procedure	oracle
How to load Java Stored Procedure through JDBC into Oracle 10g?	oracle
Defining Collections with variables	oracle
Oracle Generic DB Link not working	oracle
passing a datatable as a field from Oracle to .NET	oracle
What could cause an ORA-00936 - Missing Expression with the following sql?	oracle
Java library or code sample to parse CTXCAT query syntax (for Oracle CATSEARCH)	oracle
What is the difference between Explicit and inplicit cursors in Oracle?	oracle
Oracle PL/SQL Query Order By issue	oracle
databases oracle	oracle
SQL Compare-Like tool for Oracle?	oracle
Can I run an arbitrary Oracle SQL script through ODP.NET?	oracle
Differences between two analytic queries	oracle
Database design - Should a Date be used as part of a primary key	oracle
How do I remember which way round PRIOR should go in CONNECT BY queries	oracle
Oracle SQL*Loader getting CDATA values...	oracle
How do I test if a column equals empty_clob() in Oracle?	oracle
Oracle Pl/SQL: Loop through XMLTYPE  nodes	oracle
Oracle: How to create an element in a specific namespace with XMLElement()	oracle
SELECT * breaks when adding columns in Oracle Application Express (ApEx) 3.0	oracle
Why does running this query with EXECUTE IMMEDIATE cause it to fail?	oracle
Oracle 10g PL/SQL- Select results as update column values	oracle
Best way to select the id of the matching row with the most recent timestamp	oracle
Oracle command-line tools on Linux	oracle
What are some good Oracle Db maintenance Tools.	oracle
Replace (translate) one char to many	oracle
Using Semicolons in Oracle SQL Statements	oracle
ODP.net Oracle Decimal Number precision problem when filling a dataset. Exception: Arithmetic operation resulted in an overflow	oracle
Oracle: how to UPSERT (update or insert into a table?)	oracle
Oracle materialized view tuning	oracle
ORACLE - Exporting Procedures / Packages to a file	oracle
How can I use the 'NVL' function on a result table?	oracle
How can I optimize a dynamic search query in Oracle	oracle
Assign auto-incrementing value to new column in Oracle	oracle
Hom to change default nls_date_format for oracle jdbc client	oracle
Create or replace role?	oracle
Manually inserting data in a table(s) with primary key populated with sequence	oracle
Is it safe/possible to delete code from the table dba_source in Oracle 10g?	oracle
What type of index in best for DATE type on Oracle?	oracle
How to trunc a date to seconds in Oracle	oracle
Meaning of (+) in SQL queries	oracle
Oracle error	oracle
oracle varchar to number	oracle
Oracle - OCI query timeout	oracle
Oracle Data Dump and Data Restore	oracle
Can Multiple Indexes Work Together?	oracle
Oracle Application Server; What role in an organization typically supports the middle tier?	oracle
Oracle Scheduled Jobs	oracle
Search All Fields In All Tables For A Specific Value (Oracle)	oracle
When are two columns that look the same not the same in oracle?	oracle
oracle on port 8080	oracle
Display contents of Oracle AQ SYS.AQ$_JMS_TEXT_MESSAGE	oracle
What is the default Precision and Scale for a Number in Oracle?	oracle
Oracle Text: How to sanitize user input	oracle
How can I clean up dead connections using Oracle?	oracle
TransactionTimeout with Oracle 11g	oracle
What is the fastest way to load data into a ORACLE database with .NET?	oracle
Tool for translation of Oracle PL/SQL into Postgresql PL/pgSQL	oracle
perl JOIN-like behavior in Oracle?	oracle
Oracle unique constraint with where clause	oracle
How to install system packages into oracle?	oracle
Does SQLDeveloper support executing scripts?	oracle
ORA-01031: insufficient privileges creating JMS connection to Oracle topic	oracle
Reasonable SELECT ... INTO Oracle solution for case of multiple OR no rows	oracle
Oracle Documentation Generation Tool.	oracle
How to choose and optimize oracle indexes ?	oracle
Oracle Query Tuning (Duplicate table access)	oracle
Oracle TNS names not showing when adding new connection to sqldeveloper	oracle
BPEL for data synchronization	oracle
Best practices: .NET: How to return PK against an oracle database?	oracle
Oracle table change monitor	oracle
update a field based on subtotal from another table	oracle
"How do I Suppress ""PL/SQL procedure successfully completed"" message in sqlplus?"	oracle
Do DDL statements always give you an implicit commit, or can you get an implicit rollback?	oracle
PL/SQL function to return string with regexp special chars escaped	oracle
Tools for matching name/address data	oracle
Oracle in-line method to produce CSV for relation	oracle
TKProf Output: SQL*Net message from client	oracle
'CONTINUE' keyword in Oracle 10g PL/SQL	oracle
What is the syntax for creating a timestamp(6) type field in Oracle	oracle
Oracle Transactions	oracle
Lost RPC connection to remote Agent error with Oracle connected to Informix	oracle
secure Oracle connection from java applet	oracle
Why can't I reference a user defined type field when using nested queries?	oracle
How to avoid storing passwords in the clear for tomcat's server.xml Resource definition of a DataSource?	oracle
Select count(*) from multiple tables	oracle
Oracle correlated subquery in FROM list	oracle
Possible to create Oracle Database object types inside of PL/SQL?	oracle
How do I get the 'size' of document stored in an oracle blob column in a readable form using SQL?	oracle
Oracle, deleting many records with child tables	oracle
ORA-12638: Credential retrieval failed	oracle
Oracle V-Limits (VARCHAR, VARRAY, etc)	oracle
Why does Oracle think I'm missing a right parenthesis?	oracle
Find all Foreign Key errors with Oracle SET CONSTRAINTS ALL DEFERRED	oracle
Mapping an Oracle Date to a Java object using Hibernate	oracle
Conversion tool for MS-Excel spreadsheets with macros and VB to Oracle?	oracle
User Privileges	oracle
REF CURSOR versus TABLE function in Oracle	oracle
Diagnostic output of the Oracle Query Optimizer	oracle
Oracle: What does `(+)` do in a WHERE clause?	oracle
Oracle SQL Invalid Identifier	oracle
Hinky Oracle Connection (TNSNAMES.ora Help)	oracle
Importing selective data using impdp	oracle
How to access Subversion from Oracle PL/SQL ?	oracle
Oracle INSERT giving error in C#.	oracle
Oracle .NET error - Wrong number or type of arguments	oracle
Oracle empty strings	oracle
JDBC connection to Oracle Clustered	oracle
Insufficiente privileges when creating a trigger for a table in another schema	oracle
Using an Alias in a WHERE clause	oracle
How should I store a Guid in Oracle	oracle
"""Pivoting"" a Table in SQL"	oracle
What is sql Loader...in details	oracle
Will Pro*C work with MSVC 6?	oracle
"Oracle: how to run a stored procedure ""later"""	oracle
What is the PL/SQL API difference between Oracle Express Edition (XE) and Standard Edition (SE)?	oracle
Oracle Sequences	oracle
In SQL*Plus, how do I change the prompt to show the connected user and database?	oracle
Oracle: any replacements for DBMS_OUTPUT package?	oracle
Oracle optional relationship	oracle
Oracle 9i: How can I determine, using metadata, whether or not an index is clustered?	oracle
Oracle Gotchas for An Experienced Newb	oracle
Oracle Minus - From a list of values, how do I count ONLY non reversed values.	oracle
Oracle: how to add a text node into an existing element	oracle
Oracle Analytics inside Cursor	oracle
Oracle Query Optimization	oracle
Is there a way to get types/names of an unknown db query without executing it?	oracle
Why isn't querying a JDBC-compliant database from Oracle as easy as pie?	oracle
How do you obtain the maximum possible date in Oracle?	oracle
how to change a column's attribute without affecting the values already present?	oracle
"Oracle, calling PL/SQL issues from within SQL-Plus file x.sql says my_function ""may not be a function"""	oracle
Oracle Datadiff	oracle
How to select a related group of items in Oracle SQL	oracle
ORA-28579: network error during callback from external procedure agent	oracle
Cannot Connect with TOAD but Can with Other Tools/Apps	oracle
Oracle setting per user default scheme (not altering a session)	oracle
TimeStamp in Control File	oracle
How to pass an array parameter in TOAD	oracle
How do I find the definition of a system-named constraint in Oracle?	oracle
DESCRIBE via database link?	oracle
Oracle ORA-00600	oracle
Is there integer ranges for Where Clause?	oracle
How many temporary extents is my oracle 10g session using?	oracle
Oracle NUMBER Comparisons	oracle
How to encode string in Oracle?	oracle
Oracle works better with Windows or Linux? give your answer based on your experience.	oracle
How come sqlplus not connecting?	oracle
What is the best way to escape non-format characters in Oracle's to_char?	oracle
Oracle: Global namespace qualifier for function?	oracle
Oracle: What exactly do quotation marks around the table name do?	oracle
Storing Waveforms in Oracle	oracle
How do I format my oracle queries so the columns don't wrap?	oracle
Develop on local Oracle instance	oracle
Best solution for Java web based forms connected to Oracle plus JNI?	oracle
ORA-12514 after rebooting server	oracle
Oracle how to export query to a text/csv file	oracle
Best way to handle LOBs in Oracle dblink'ed tables	oracle
Performance of Oracle .Net drivers	oracle
How to get Oracle create table statement in SQL*Plus	oracle
How update oracle heterogeneous services metadata?	oracle
ORA-27101: shared memory realm does not exist in Oracle 9	oracle
Is there any way to have the JBoss connection pool reconnect to Oracle when connections go bad?	oracle
Oracle 'printf' equivalent	oracle
Oracle packages in version control?	oracle
What is the best column for storing XML in an Oracle database?	oracle
In Oracle, why do public synonyms become invalid when a table partition is dropped.	oracle
Powerbook compiler queries	osx
[macosx]does dlopen call open and read functions?	osx
How to make a dashboard widget in mac os x using python	osx
OSX: Get application windows + bounds	osx
Remote debugging under Mac OS X	osx
Help writing a DVB driver for OS X	osx
Distinguishing between HFS+ and HFS Standard Volumes	osx
How do I use stackshot to debug my application?	osx
Equivalent of GetCursorPos() in Mac's Carbon	osx
Flowchart app for OSX?	osx
Getting the speaker audio signal and then streaming it out	osx
Is there a good Fogbugz client for Mac OS X?	osx
Mac OS. How to create PNG from array data?	osx
How to get NSAlert sheet to return focus to calling window?	osx
Help with OSSpinLock* usage to replace a while(true) {sleep(1);}	osx
Create a Mac Application Installer and Passing Arguments on Launch	osx
make mac package/bundle programmatically.	osx
How do you configure the Apache server which ships Mac OS X?	osx
Sample a process on Mac OS X from a C/C++ program	osx
Focus-follows-mouse (plus auto-raise) in Mac OSX.	osx
"Creating a ""Uninstaller"" for a program on Mac OS."	osx
Reloving AliasRecord with relative path on a new volume	osx
Getting a List of Applications Capable of Opening a Type of File	osx
Embed webserver in carbon bundle	osx
x84_64 compatibility with 10.5.8	osx
Measuring bluetooth signal strength via AppleScript on Mac OS X	osx
Is there a public source code repository for the Official Mac Github.com client?	osx
Unique hardware ID in MacOSX	osx
How to pass a command line switch to XCode when I start 'Build and Debug'	osx
register a protocol on mac osx?	osx
Is there non-daemon FTP server application fot Mac OS? (like MAMP)	osx
How can I format date -u so that the results include timezone offset in a Mac OSX terminal session?	osx
Drawing automatic graphs using dot in mac python	osx
How to I launch an on-screen keyboard from my application on Mac OSX?	osx
OS X bash: dirname	osx
"Is it possible to have PackageMaker build an installer without ""packaging"" the content at build time?"	osx
Extract from Cache.db files on Mac OS X Leopard	osx
How to discover number of cores on Mac OS X?	osx
"How to connect to server via ssh but use native ""Connect to Server"" in OS X?"	osx
Using an IOService port reference to turn off a device...	osx
Install PDO on OS X Leopard	osx
Mac Pro 64-bit addressing kernel	osx
Automatically compile any Java class when the file is dropped in a directory	osx
Where is the code for the function under c in Screen's copy-mode?	osx
OS X text drawing	osx
Citrix Server sort of app - on a Mac?	osx
When is a CGBitmapContext not a BitmapContext?	osx
install java se 6 on a mac without software updater	osx
Can MacOS be run in a VMWare type environment?	osx
installing cairo on Mac OS Lion	osx
Determine if a directory is a bundle or package in the Mac OS X terminal?	osx
How to start Mac OS X password screen	osx
How can I determine the running Mac OS X version programmatically?	osx
Windows to Mac transformation	osx
Any risks using Macports?	osx
What is the best tool for creating user guides with screenshots on MAC?	osx
Selecting OSX SDK version in Eclipse and Makefiles	osx
What is the keyword for Mac OS X Service-like applications?	osx
Restore app from dock	osx
Moving Mac's user settings to another users	osx
GCC without Xcode on OS X	osx
Running a Socket Server in Cocoa	osx
backporting NSWindowDelegates windowDidEndLiveResize behaviour in OSX 10.5?	osx
Blank process name for OSX Cocoa application?	osx
Good Editors for Web Development on OS X?	osx
Controlling OSX windows	osx
How to detect that an app (such as Quicktime) prevents screensaver to run on Mac	osx
How to close modal window when window is closed ?	osx
I need to develop a project involving hardware which should also work the same on Windows as well as Macs. Whats the way forward?	osx
CoreAudio AudioUnitSetProperty always fails to set Sample Rate	osx
Testing web application on Mac/Safari when I don't own a Mac	osx
How to detect current locale in Mac OS X from the shell	osx
How can I know if the user is in Exposé mode?	osx
CSS: How to increase the size of a OSX submit button	osx
Proper way to make a fat binary prefer to be 32bit on 64bit OS X 10.6?	osx
Simulate USB insertion on OSX via software	osx
How to isolate causes of system hang on Unix/OSX	osx
macports confusion	osx
Is there a way to install gcc in OSX without installing Xcode?	osx
what is the equivalent of COM in Mac OS?	osx
"How to create a zip file in the same format as the Finder's ""Compress"" menu item?"	osx
gdbinit conflict with Xcode debugging	osx
localhost working 127.0.0.1 broken in Safari	osx
Meta and # in a UK mac terminal	osx
Help needed with F_NOCACHE in mac	osx
Unable to find Applications folder in Mac's terminal	osx
OS X counterpart to Windows' SetTimer	osx
Alternative LAF to quaqua	osx
line-end agnostic diff?	osx
How do I get the name of the active user via the command line in OS X?	osx
osx: how do I find the size of the disk i/o cache (write cache, for example)	osx
