text	label
Excel get_Range missing when interop assembly is embedded in .NET 4.0	excel
DSUM: How to define the criteria range using braces?	excel
How to check for empty array in vba macro	excel
Excel: Changing right click menu above autoshapes.	excel
How to obtain the macros defined in an Excel workbook	excel
VBA editor auto-deletes spaces at the ends of lines	excel
Is it possible to access Excel file through ADO.NET that does NOT have a Header Row?	excel
Find distance between two cities in Excel using Google Maps API	excel
Excel 2002 Add-In not loading when the application opens	excel
Excel: Removing duplicates in one column while retaining highest value in the adjacent column.	excel
another excel offset question	excel
Unresponsive Cancel Button on VBA Userform	excel
Looping Variable Names	excel
Generating Excel Files with VB6	excel
How do I get a range's address including the worksheet name, but not the workbook name, in Excel VBA?	excel
XL VBA - Passing an array in a user defined function?	excel
Basic excel date and time problem	excel
How Do I Loop Through An Excel Spreadsheet With VBA, Paste A Value To A Website Form Then Extract The Result Back?	excel
Bind macro to excel cell onclick?	excel
Shared Worksheet with Macros in Excel 2003	excel
Multiple select Listbox in Excel for an import sheet	excel
How to identify where the excel file use Excel 95 or Excel 97 specifications?	excel
Language/framework to write Excel spreadsheets, webbased	excel
Exporting Native Excel 2007 Files From .NET	excel
Efficient method to enumerate cells in an Excel workbook using c#	excel
Changing Legend Type in Excel	excel
Dynamic pathfinding in Excel import	excel
Dynamically changing dropdown in excel.	excel
Excel: how to start macro recording from OLE	excel
Return value of nth or last match	excel
mass convert excel files into tab delimted text files	excel
Format cell color based on value in another sheet and cell	excel
Saving different csv files as different sheets in a single excel workbook	excel
Excel as database frontend for several concurrent users - doable?	excel
How do I prevent Excel from rendering the spreadsheet as my macro calculates it?	excel
Convert Excel 95 to Excel97+ without automation?	excel
"Excel - ""File Not Found: VBA6.DLL"""	excel
Setup an Excel template so calculations are not dependant on a specific number of columns / rows	excel
Exporting MySQL to Excel	excel
[Excel VBA]How to cast a shape object?	excel
Hiding Page Breaks in Excel	excel
Round time to nearest 15min interval in Excel	excel
ADODB.Connection undefined	excel
How do I programatically interface an Excel spreadsheet?	excel
Getting Valuue from MS Access form from Excel VBA.	excel
"Re-Initializing ""ThisWorkbook.Path"""	excel
Excel: How can I display the data from several sheets in one?	excel
Excel AVERAGEIF with TODAY() function as criteria	excel
What is the difference between a shared formula and an array formula?	excel
"Excel Number Format: What is ""[$-409]"" ?"	excel
Creating add-in for Excel using C#.	excel
Moving  MS Excel data to a website via a web service.	excel
Exporting data to excel	excel
Making Excel macro for fast data entering ::: VBA ::: Excel :::	excel
Use Excel Interop to grab image of Excel chart without writing to disk or using the clipboard	excel
Refresh Excel VBA Function Results	excel
Where is the best documentation of Microsoft Excel Biff format	excel
How do you add two COUNTIF equations together?	excel
converting an Excel (xls) file to a comma separated (csv) file without the GUI	excel
How do I create a status dialog box in Excel	excel
How do I create a multiple tab Excel workbook on a client machine?	excel
Determining wrong input file using VBA & Excel	excel
Return background color of selected cell	excel
What in the best exel book for non-programmers?	excel
Easily using  Excel data in SQL Server	excel
Load CSS In Excel	excel
"What causes ""Invalid advise flags"" run-time error in Excel VBA?"	excel
Workarounds to avoid trying to conditionally protect cells in a shared workbook	excel
Runtime error 1004: Application-defined or object-defined error	excel
removing some rows based on criteria - solving this by pivot tables	excel
How to print faster in Excel VBA?	excel
How do I change the indenting for Excel's XML Data Export?	excel
write the data from an excel sheet to the text file though C#	excel
how to get Min and max in excel depending on another column?	excel
What options do I have for reading Excel files and evaluating formulas in C#, Java and PHP?	excel
excel string comparison is failing when it should not	excel
Converting OOo macros to Excel macros	excel
Zip Code distance in excel	excel
Count rows until the sum value of the rows is greater than a value	excel
How do you test that a Range in Excel has cells in it?	excel
How do I make a burn down chart in Excel?	excel
VBA long overflow	excel
Selecting the max with a condition in excel	excel
Create a custom worksheet function in Excel VBA	excel
Non-Sequential Range	excel
how do i get a count of columns that contain data from excel	excel
How to write an Excel function which returns a value from an SQL database?	excel
looking for 'sed' like functionality in Excel	excel
Problem with toolbar in Excel 2003	excel
How to send an email attachment with signature in excel	excel
How do I save each sheet in an Excel workbook to seperate CSV files with a macro?	excel
Problems Reading a .xlsx file?	excel
Embedding Excel files in XSL-FO driven (Pdf)-Document Generation	excel
Is there any way to make Excel preserve XML attributes in root element?	excel
Excel merge and formatting	excel
Grabbing text between slashes in Excel	excel
Freezing Row 1 and Column A at the same time	excel
Excel Interop: Formatting Footers	excel
How do I export from MySQL to an Excel file in my PHP site?	excel
Sql server Newbie needs help	excel
making a Macro that exports chosen columns to a new file	excel
VBA: Querying Access with Excel.  Why so slow?	excel
Excel CSV - Number cell format	excel
How to find and select multiple rows with macro (excel) ?	excel
How to crack an Excel workbook that looks up values?	excel
generate excel sheet from a excel template in asp.net using vb.net	excel
Tab order VSTO Excel	excel
To upload an excel file as a clob	excel
How to tell if an Excel Workbook is protected	excel
Understanding / Modeling forumals from Excel.	excel
how to pass string array from C/C++ dll to vba (Excel)	excel
"MS Access 03 - muliplte ""ifs"" in one field of update query's criteria??"	excel
"Excel Prefixcharacter in C# with OLEDB causing ""Data type mismatch in criteria expression"" error on UPDATE"	excel
Help with excel automation addin	excel
Spreadsheet: Count Repeated Values In A Column	excel
Excel Interop: Range.FormatConditions.Add throws MissingMethodException	excel
Looping Code/Skipping Rows	excel
Merge Excel Files Into One	excel
Programmatically extract data from an Excel spreadsheet.	excel
How can I start a specific excel version in com automation?	excel
Excel: How to get a locale-independent printer name?	excel
How to keep one variable constant with other one changing with row in excel	excel
Excel Word Wrap Problem after Macro	excel
Microsoft Excel mangles Diacritics in .csv files?	excel
Excel workbooks produced by POI don't work when linked	excel
Automatically execute an excel macro on a cell changed by a real-time add-in	excel
Is is possible to insert an image into an excel cell via COM?	excel
Sql Import wizard imports 1022868890 as 1.02287e+009	excel
Need to embed Excel worksheet in .NET application	excel
Excel reading in ASP.NET : Data not being read if column has different data formats	excel
Where can I find documentation for Excel's Pictures collection?	excel
Excel - Red Cross where a drop down list should be	excel
Excel Range Format: Number is automatically formatted when Range::Value2 is set	excel
How to insert an excel chart into Word using AddOLEObject	excel
Delete a file after user download prompt	excel
How can I get back a previously created Excel ListObject?	excel
How to stop Excel to prompt to reopen a workbook.	excel
Change value for multiple cells in Excel	excel
Alternating coloring groups of rows in Excel	excel
Excel replace value without losing formatting	excel
Excel Floating Point Arihmetic - What Type Does It Actually Use	excel
VB.NET/COM Server code way slower than Excel VBA code	excel
Excel ODBC and 64 bit server	excel
ODBC connect with propritary driver/Excel Trust settings	excel
Cancel External Query in Excel VBA	excel
Excel 2003 VBA error 1004 after XML data import	excel
Elegant way to highlight chart data series in Excel	excel
Why does one ADO.NET Excel query work and another does not?	excel
collate 500 excel sheets into database	excel
Excel Vs C# Number Differences	excel
Excel and IE7 - Prevent IE from opening Excel files	excel
Copying Cells  from different sheets to one Main Sheet	excel
Excel Overtime Calculation	excel
How do I use a parameter in an Excel external data request?	excel
is it possible to display a Google Earth map INSIDE Excel?	excel
What is the algorithm to covert an Excel Column Letter into its Number?	excel
Do Excel 2003 and 2007 use differnt file formats?	excel
How do I Refresh Excel whilst Debugging	excel
Why does declaring content as a string cause WinHttp not send HTTP content in Excel VBA?	excel
import text file containing line breaks into excel	excel
[VB.NET] Better Way of Getting the Text Value of Cells in an Excel (*.xls) File	excel
Excel Formulas/VB: Show total based on date entry	excel
Excel: filter table rows by specified column value	excel
Excel - Highlight active row	excel
Combing Multiple Excel Files into Single Excel Workbook with Multiple She	excel
Multiple Cell Background Colors in Excel Spreadsheets	excel
How to iterate through all the cells in Excel VBA or VSTO 2005	excel
Using excel as UI without VB	excel
Programmatic mail-merge style data injection into existing Excel spreadsheets?	excel
Will upgrading Office from 2003 to 2007 break VB programs which use Excel through the COM interop?	excel
Is there a native excel class which allows a range to be copied and sorts/filters applied?	excel
VBSCRIPT: How do I copy all rows from 3 worksheets and merge rows that are unique in the first column?	excel
Creating a sublist based on a second column in excel	excel
Reading values from an Excel File	excel
can not get scion_server to be created using runghc	haskell
absolute values in Haskell	haskell
Cabal installing quickcheck version problem	haskell
Haskell: OpenGL, how to prevent immediate window closing	haskell
please help me understand the pattern match in haskell. i'm a little confused.	haskell
What can be improved on my first haskell program?	haskell
string interpolation in haskell	haskell
Haskell: read input character from console immediately, not after newline.	haskell
What to do with “Inferred type is less polymorphic than expected”?	haskell
Modifying the pretty printer from haskell-src-exts	haskell
How do I test if a floating point number is an integer in haskell?	haskell
Keep track of the program variables in Haskell like imperative programs	haskell
Complete Haskore example	haskell
putStrLn, type Char does not match [Char]	haskell
What are your favorite programming-related academic papers?	haskell
In Haskell, will calling length on a Lazy ByteString force the entire string into memory?	haskell
What does the >> symbol mean in Haskell.	haskell
Why is this form of haskell acceptable, but the other form raises a type error?	haskell
How to do conditional compilation in Haskell?	haskell
What is GHCi's default implementation of MonadError?	haskell
haskell: a data structure for storing ascending integers with a very fast lookup	haskell
Haskell question regarding data	haskell
Lifting class instance in Haskell	haskell
State Monad, sequences of random numbers and monadic code	haskell
Haskell type error: Could not deduce (Show a) arising from a use of `show' from the context (Num a)	haskell
haskell polymorphism and lists	haskell
Restricting a monad to a type class	haskell
foldl versus foldr behavior with infinite lists	haskell
Doing a binary search on some elements in Haskell	haskell
Haskell script running out of space	haskell
Haskell: What is the difference between $ (dollar) and $! (dollar exclamation point)	haskell
Is it better to use the State Monad, or to pass state recursively?	haskell
Crazy haskell indentation	haskell
How to get Haskell syntax highlighting on PHP blog	haskell
"Please confirm or correct my ""English interpretation"" of this Haskell code snippet"	haskell
Equivalent of python eval in Haskell	haskell
Haskell Applicative instance for ErrorT?	haskell
problem with Double and Rational Number	haskell
C compiler selection in cabal package	haskell
Haskell tool to rewrite import statements to name all imports?	haskell
Haskell XMLRPC server executing dynamically generated functions	haskell
Efficiency of equality in Haskell	haskell
How haskell tail recursion works?	haskell
Finding index of element in a list in Haskell	haskell
Haskell - how to write array to file?	haskell
Trying to understand Haskell's => vs defining the types	haskell
wxhaskell asynchronous updates	haskell
Where next, after Haskell?	haskell
Haskell: generic IORef, MVar?	haskell
What is [] (list constructor) *really* in Haskell?	haskell
Using Haskell's types to replace assert statements or if checks in other languages	haskell
When is the difference between quotRem and divMod useful?	haskell
How do i convert String to Integer/Float in Haskell	haskell
Types in Haskell	haskell
haskell import problem	haskell
Understanding Haskell's filter	haskell
Haskell simple compilation bug	haskell
Literate Haskell (.lhs) and Haddock	haskell
Could someone explain these Haskell functions to me?	haskell
simple putStrLn in Haskell/Yampa with arrows syntax	haskell
Pattern matching for lambda expressions	haskell
Implicit type parameters in Haskell class definition?	haskell
STUArray with polymorphic type	haskell
Outputing UTF-8 string on Mac OS's Terminal	haskell
How to move an element in a list in Haskell?	haskell
Problem detecting cyclic numbers in Haskell	haskell
Why does this Haskell statement not evaluate lazily?	haskell
Haskell map/zip Vs. list comprehension	haskell
Matching multiple data type constructors at once	haskell
Haskell FlatMap	haskell
Have J style adverbs, forks etc been emulated via libraries in mainstream functional languages?	haskell
Why does Haskell interpret my Num type as an Enum?	haskell
Using items in a list as arguments	haskell
Why isn't my IO executed in order?	haskell
Haskell: difference between . (dot) and $ (dollar sign)	haskell
how to execute haskell program in cygwin	haskell
Understanding Haskell's fibonacci	haskell
Haskell 64 bit numerical type	haskell
What programming task provided your breakthrough with monads?	haskell
Polyvariadic Functions in Haskell	haskell
Dealing with large files in Haskell	haskell
Creating monads in haskell	haskell
How can I write an addition of two items in a string representation???	haskell
on GHC extensions	haskell
Implementing a factorisation method in Haskell	haskell
wx file error when using Haskell	haskell
Pattern matching string prefixes in Haskell	haskell
[Haskell] Problem when mixing type classes and type families	haskell
Explanation of “tying the knot”	haskell
Operate on values within structurally similar types in Haskell	haskell
View Reduction Steps in Haskell	haskell
Haskell on Windows Setup	haskell
haskell grouping problem	haskell
Mapping the :edit command to a certain editor	haskell
Summation notation in Haskell	haskell
"Mysterious word (""LPS"") appears in a list of Haskell output"	haskell
Haskell Input Return Tuple	haskell
When should I use $ (and can it always be replaced with parentheses)?	haskell
Installing a Haskell package from Hackage through Cabal gets stuck at dependency resolution	haskell
Lists in Haskell : data type or abstract data type?	haskell
Haskell -- How to split a number into a list for further processing?	haskell
Haskell, HDBC, ODBC, MySQL and Mac OS X	haskell
How do I do automatic data serialization of data objects in Haskell	haskell
Writing a function with a universally-quantified return type	haskell
Infinite loop in haskell? (newbie)	haskell
"Haskell newbie question: What is ""lifting""?"	haskell
Creating a Haskell Empty Set	haskell
Are all Haskell functors endofunctors?	haskell
a function isn't loading	haskell
In Haskell, how do I recursively manipulate a tuple and preappend a character to the first element in the tuple?	haskell
How to extract terms of specific data constructor from a list in Haskell	haskell
"(newbie) type signature ""Maybe a"" doesn't like ""Just [Event]"""	haskell
Stack overflow in OCaml and F# but not in Haskell	haskell
Use of Haskell state monad a code smell?	haskell
Haskell FFI: Calling FunPtrs	haskell
haskell libmagic  how to use it???	haskell
Confusion about currying and point free style in Haskell	haskell
install haskell cabal w/o manual dependency resolution	haskell
How can I easily see the output from a Template Haskell statement?	haskell
Haskell: What's the type of this function?	haskell
How to determine the directory in which a running Haskell script or application lives?	haskell
NILL value in haskell	haskell
"Understanding the type error: ""expected signature Int*Int->Int but got Int*Int->Int"""	haskell
Haskell -- more type inference problems	haskell
How do I use constants in haskell, to avoid magic numbers ?	haskell
List of GHC extensions	haskell
What are my IDE/Editor choices for Haskell?	haskell
"""Pattern matching"" of algebraic type data constructors"	haskell
Haskell: recursion with array arguments	haskell
How to get 64-bit binaries from GHC for Snow Leopard?	haskell
Haskell. Why Array faster then lists ?	haskell
Tracking down errors in Haskell	haskell
Haskell type cast problem	haskell
Haskell quiz: a simple function	haskell
Haskell - how to generate permutations	haskell
Haskell: How to type cast	haskell
implementing a per-digit counter using the list monad	haskell
Haskell record syntax and type classes	haskell
Is Haskell mature enough for developing commerical web applications?	haskell
What does the parantheses signify in (x:xs) when pattern matching?	haskell
Creating Haskell instance declarations	haskell
Can I do something like this in haskell	haskell
How do I convert a variable to a string?	haskell
Haskell: Writing text files and parsing them back to original format	haskell
Closest equivalent to subprocess.communicate in Haskell	haskell
Why does this first Haskell function FAIL to handle infinite lists, while this second snippet SUCCEEDS with infinite lists?	haskell
Generating a list of lists of Int with QuickCheck	haskell
Implications of foldr vs. foldl (or foldl')	haskell
Intermediate lists in Haskell	haskell
What's the fuss about Haskell?	haskell
In Haskell, how can I use the built in sortBy function to sort a list of pairs(tuple)?	haskell
Haskell: Custom types with conditions	haskell
Constraining the returntype to a Context	haskell
Haskell Monoid Join Function	haskell
Multithreaded Haskell	haskell
Using Haskell for sizable real-time systems: how (if?) ?	haskell
Range checking in Haskell's case?	haskell
GHC type inference for higher rank types - assigning to monotypes	haskell
Fully parenthesizer for Haskell	haskell
Is there a way to optimise this program in Haskell?	haskell
How long does it take for you to be comfortable with Haskell?	haskell
Haskell audio output on OS X?	haskell
trying to install hs-ffmpeg haskell package fails to find libdc1394	haskell
List construction in Haskell	haskell
Return specific type within Haskell	haskell
Control.Monad.State found in multiple packages haskell	haskell
Why are side-effects modeled as monads in Haskell?	haskell
Automatic conversion of types for FFI calls in Haskell	haskell
Why do compiled Haskell libraries see invalid static FFI storage?	haskell
Show a list of words repetited in haskell	haskell
mail reader using haskell	haskell
Haskell sort funtion	haskell
Turn this recursive haskell function into a map call	haskell
What is the relationship between unboxed types and strictness?	haskell
Are these two combinators already available in Haskell?	haskell
Haskell - How to best to represent a programming language's grammar?	haskell
How can I factor this Haskell expression to avoid repeated computation?	haskell
What are uses of polymorphic kinds?	haskell
What does the : infix operator do in Haskell?	haskell
Haskell IO with Numbers	haskell
hibernate cascade deletion	hibernate
how to configure hibernate 3.3 in eclipse galileo?	hibernate
Why use Hibernate/nHibernate?	hibernate
Terracotta With Hibernate and EHCache	hibernate
How to create and read a sequence in Hibernate?	hibernate
Error in hibernate constraint	hibernate
Hibernate: Identifier	hibernate
Hibernate Criteria - Exclude records with same id but different attribute values	hibernate
one-to-many mapping // how to map an association of legacy tables (Hibernate)	hibernate
How to construct a hibernate query that uses a single element of all elements in a collection?	hibernate
Problem with mapping tag in hibernate configuration file	hibernate
Hibernate Search querying ?	hibernate
Recording test data in Hibernate	hibernate
hibernate result ordering	hibernate
Hibernate - One design problem	hibernate
(Lazy) LEFT OUTER JOIN using the Hibernate Criteria API	hibernate
Hibernate cannot recover after socket has timed out	hibernate
How to validate Hibernate mapping against database	hibernate
Oracle Deadlock when Hibernate application loading data for readonly use	hibernate
Transactional strategy for Hibernate L2 Cache	hibernate
Get the entity previous  version in Hibernate Envers	hibernate
Constraint error in hibernate	hibernate
How to add a Hibernate property that's really a query	hibernate
Best practice to return a result Flag after saveOrUpdate in hibernate ?	hibernate
Hibernate 2nd level cache not caching committed entities	hibernate
Hibernate One-to-Many cascade efficiency	hibernate
Turn off Hibernate Logs for certain query	hibernate
Hibernate transaction boundaries	hibernate
How do you programmatically turn off eager fetching with hibernate?	hibernate
Hibernate Criteria: Eagerly load ManyToMany collection	hibernate
Hibernate saveOrUpdate fails when I execute it on empty table.	hibernate
Hibernate Question on Sessions	hibernate
transaction timeout not working on hibernate with oracle	hibernate
Nhibernate multiple component properties of the same type in a class	hibernate
Hibernate load UserType object from repository	hibernate
Hibernate L2 Caching and Many-To-Many relationships	hibernate
How to transfer data from one database to another with Hibernate?	hibernate
why does hibernate not force you to mark fields as virtual, but nhibernate does?	hibernate
Can I make an embedded Hibernate entity non-nullable?	hibernate
Proper way to autowire a Hibernate Session in a Spring Transaction JUnit test	hibernate
Is it possible to load an object, it transient state from the get go?	hibernate
Elegant way to handle upsert with Hibernate and MySQL	hibernate
what the heck is a JPA configuration?	hibernate
"""SELECT ... FOR UPDATE"" not working for Hibernate and MySQL"	hibernate
Hibernate QueryException couldn't resolve property	hibernate
What are the differences between the different saving methods in Hibernate?	hibernate
Hibernate SessionFactory	hibernate
Using Maven in Hibernate Tutorial	hibernate
Left outer join fetch doesn't fill map collection properly (HQL)	hibernate
Hibernate Exception	hibernate
How can this be done with (N)Hibernate?	hibernate
Using Hibernate Validator with JPA and Spring	hibernate
NullPointerException on merge()	hibernate
Hibernate Auto Increment ID	hibernate
Hibernate with ZK	hibernate
How to know a entity is going to insert or update	hibernate
Add new Entity to persisted Collection	hibernate
Hibernate HQL query by using like operator	hibernate
Hibernate session not getting created.	hibernate
Why do we use hibernate annotation?	hibernate
Update of of Composite Entity fails	hibernate
Using entity id as a reference in Hibernate	hibernate
Hibernate/Spring application - export to CSV	hibernate
How to update a database schema without losing your data with Hibernate?	hibernate
How to use Hibernate @Any-related annotataions?	hibernate
Limit associated entities loaded through a Hibernate Criteria	hibernate
Hibernate + Annotations + Validator: Length constraint inside EmbeddedId ignored by hbm2ddl	hibernate
Hibernate problems with Auto Increment ID MYSQL 5	hibernate
Hibernate/JPA - annotating bean methods vs fields	hibernate
Double-logging in Hibernate	hibernate
Hibernate query by example (from Spring 3)	hibernate
Hibernate: How declare foreign key without having to code association methods in the domain object?	hibernate
hibernate - uniqueResult silently fails	hibernate
Hibernate: Specifying columns in a one-to-many relationship	hibernate
Generating a SWING/Gui from Hibernate	hibernate
Hibernate criteria query on different properties of different objects	hibernate
Hibernate: Why @OneToMany with List<MyClass> fails?	hibernate
How do I make/develop Hibernate caching?	hibernate
Making hibernate not include fields from joined tables in select clause	hibernate
Hibernate one-to-one entity association with shared PK between 3 classes	hibernate
Equinox (OSGi) and JPA/Hibernate - Finding Entities	hibernate
Hibernate: When to use getSession() and when to use getCurrentSession()?	hibernate
Hibernate mappings: Splitting up the file	hibernate
"hibernate: how to setup on-delete=""cascade"" in one-to-one relation"	hibernate
Creating Object from Hibernate Mapping	hibernate
Hibernate, Null values and nativeSQL	hibernate
MyEclipse HIBERNATE Does NOT Order Property Sets by ID?	hibernate
Hibernate polymorphic query	hibernate
Using hibernate hbm2ddl.auto=update : How can I alter column not to require value anymore?	hibernate
