text	label
Problem with AJAX and PHP	ajax
Send asapMail without reloading page using ajax	ajax
jQuery RoundedCorners with AJAX	ajax
Ajax-driven complex layout RIAs and mvc frameworks	ajax
automatically processing contents of <textarea> without user pressing a button	ajax
Web-based JSON editor that works like property explorer with AJAXy input form	ajax
SQL query in tables side by side instead of one long table	ajax
ajax js serialize not reading form elements	ajax
w3schools AJAX example	ajax
AJAX Enabled WebApplication	ajax
Reading Image from AJAX response	ajax
how to send an object from one js file to another js file ?	ajax
How to get Model errors in AjaxSubmit?	ajax
innerHTML size limit	ajax
Problem with IE8 using AJAX	ajax
creating a popupwindow from html, not a file	ajax
Dangers of Ajax	ajax
AJAX progress bar dispaying loading progress percentage for page load	ajax
How do I preview a url using ajax?	ajax
prototype serialize returns function instead of serialized string	ajax
AJAX (prototype/php) getting partial status updates during script execution	ajax
Create editable new rows to a table	ajax
Upload File Directly to S3 with Progress Bar	ajax
pass multiple parameters to jquery ajax call	ajax
Ajax project suggestion.	ajax
How do I specify multiple interfaces when registering a class in the Ajax Client script?	ajax
Problem with AJAX	ajax
Refire certain scripts after jQuery AJAX load.	ajax
Ajax Javascript show/hide works with JQuery 1.3.2 but not JQuery 1.4	ajax
"stackoverflow ""Related Questions"""	ajax
jquery script is using to much memory	ajax
How to post an image to a server using ajax	ajax
Isn't AJAX on pageload a bad thing?	ajax
Wait for getJSON response	ajax
cant query json	ajax
AJAX wont POST to URL	ajax
GET vs POST in ajax ?	ajax
Ajax doesn't work in iPhone safari	ajax
AJAX/JQUERY/PHP issue...	ajax
Ajax jquery success scope	ajax
how to set time in ajex slider control?	ajax
AJAX checkbox if statement	ajax
In AJAX how to retrive variable from inside of onreadystatechange = function ()	ajax
Is a variable in javascript available after loading an iframe and then going back to the page?	ajax
Basic AJAX example with ASP.NET MVC?	ajax
How to prevent IE6 from refetching already-fetched images added via DOM manipulation	ajax
ajax login using httpRequest?	ajax
AJAX support in smart phones	ajax
Need Help With AJAX-Enabled WCF Services (Please Look @ System.ServiceModel in Web.Config)	ajax
Are there any good drag&drop AJAX web app toolkits out there?	ajax
Default radio button not triggering an UpdateControl postback	ajax
Why don't browsers let you open a regular connection instead of Ajax or Comet?	ajax
How to hide AJAX HTML Editor Bottom Toolbar	ajax
What are the steps to create AJAX login in yiiframework?	ajax
ASP.NET Ajax script registration	ajax
Some Paramters in $.ajax not passing	ajax
Problem adding item to sortable list	ajax
Learning Ajax - where to search for online instruction.	ajax
Asp.net Ajax , Hangs Somtimes	ajax
XMLHttpRequest vs Socket vs ?	ajax
IIS equivalent of VirtualHost in Apache	apache
.htacess mod_rewrite on root directory but need it to skip all other directories	apache
How to get Tomcat Working on WIndows 7?	apache
Apahe configuration with virtual hosts and SSL on a local network	apache
"when should I use ""apache:apache"" or ""nobody:nobody"" on my web server files?"	apache
What is CGI and what are CGI Scripts?	apache
Apache Rewrite Rule Regex Problem	apache
How do I conditionally add a line to Apache  .htaccess based on the domain?	apache
"How to put Apache website to 503 ""temporary down""?"	apache
Apache mod_rewrite %2B and plus (+) signs...	apache
mod_rewrite: setting GET depending on HTTP_HOST	apache
How to serve PHP dynamic images efficiently on a LAMP server?	apache
How to timestamp request logs with millisecond accuracy in Apache 2.0	apache
Configuring Apache Web Server with Tomcat	apache
Why I cannot use my apache server?	apache
Can't get Xdebug to work on Windows 7	apache
How to track down CPU intensive requests	apache
Can I serve a ClickOnce application with Apache?	apache
Using relative URLs with mod_rewrite	apache
Apache module FORM handling in C	apache
Apache logs -- what is difference between %a and %h?	apache
How to find where Apache's httpd.exe is installed?	apache
Apache HttpClient making multipart form post	apache
PHP Server settings causing problem	apache
Implementing Tiny MCE As Local HTML Editor	apache
500 error when trying to add expires header to .htaccess	apache
Setting a header in apache	apache
installing additional apache modules	apache
Programmable transparent forward proxy	apache
htaccess rewrite not working for all rules	apache
i can do http://bookroom and smb://bookroom... to test my local site or use shared resources.  anything i don't know yet?	apache
Apache rewriteRule for root directory	apache
PHP using too much memory	apache
Map virtual directory to another web server in apache	apache
Mask redirect to temporary domain with mod_rewrite	apache
how to make apache rewrite this url ?	apache
Setting up Ruby CGI in Apache	apache
Apache/Tomcat site nesting	apache
Whats the best way to get multiple instances of an application to run in Apache Tomcat?	apache
Why is Apache mod_rewrite not behaving as expected	apache
Using random folder name on web server to restrict access to it - bad idea?	apache
Is there a way to make git remember the password for WebDAV remotes?	apache
apache mod_proxy_html on Ubuntu ProxyHTMLEnable not working	apache
User getting default Apache page instead of website - Safari/FF?	apache
Can you configure mod_proxy as a reverse proxy cache?	apache
htcaccess - ModRewrite	apache
apache mod_rewrite one rule for any number of possibilities	apache
RewriteRule in .htaccess not working	apache
How can I convince mod_rewrite to stay away from my Subversion repositories?	apache
MPM Prefork Apache Uses Absurd Amount of Memory	apache
How many connections/how much bandwidth can Apache handle?	apache
Multiple RewriteConds and RewriteRule Stacked Together	apache
Apache2: Environment variables for user http	apache
Apache sub-sites	apache
Webserver Log Analysis	apache
Invoking Wine From Apache	apache
How can I configure Apache to map  /talk.html?id=77 to the file that is called talk.html?id=77  ?	apache
"Direct ""puts"" in Rails, to Apache log"	apache
apache configuration - what am I missing here?	apache
Apache Mod_Rewrite RewriteRule strange behaviour	apache
Bash script with find command drops me to bash shell	bash
Bash Customizations	bash
more efficent shell text manipulation	bash
Bash script what is := for?	bash
How to create folders using file names and then move files into folders?	bash
Validating parameters to a bash script	bash
Unable to put a .txt -file to the end of another .txt -file	bash
Can I specify redirects and pipes in variables?	bash
Unable to scp from my server to my computer	bash
bash rename files	bash
Testing for GUI in .bashrc	bash
right align/pad numbers in bash	bash
Redirect output to a bash array	bash
Bash Script - Read Binary File	bash
running two bash commands simultaneously on two different computers from one script	bash
Bash insert a comma (,) after every third field of a variable or array?	bash
How to properly make path handling robust in a bash program?	bash
environment path loading incorrectly in bash	bash
Bash: Recursively remove files	bash
Awk pattern macthing	bash
In bash, how can I print the first n elements of a list?	bash
How to echo directories containing matching file with Bash?	bash
How to use > in an xargs command?	bash
BASH: error message does not get redirected to file	bash
Shell scripting: die on any error	bash
cd doesn't work when redirecting output?	bash
replace a particular value in a string of key - values	bash
Bash: how to traverse directory structure and execute commands?	bash
Bash shell function error : command not found	bash
Bash - Passing arguments by reference	bash
How to confirm a command in every bash loop	bash
Bash for loop with wildcards and hidden files	bash
Moving a directory atomically	bash
Bash TAB-completion inside double-quoted string	bash
Bash alias of an svn command piped to awk	bash
How can I put $HOME/opt/git/bin to my PATH?	bash
Passing a string with spaces as a function argument in bash	bash
Access a variable in a bash script	bash
Bash: ambiguous redirect	bash
How to exit all the calling scripts in bash?	bash
how to chop last n bytes of a sting in bash string choping?	bash
Bash Scripting and bc	bash
Bash: Join elements of an array?	bash
how to scp across servers using bash?	bash
Negate Unsigned Number in Bash	bash
How to process file names with variables from a list in a file in Bash	bash
bash errors in this script ?	bash
Removing created temp files in unexpected bash exit	bash
Howto Pass A String as Parameter in AWK within Bash Script	bash
"Detecting failure of a Bash ""export"" value"	bash
Bash script for manual routes and default gateway problem	bash
Execute a shell command from a shell script without stoping if error occurs	bash
How to use a pipe in a foreach statement	bash
How to program using cat	bash
How to check syntax in bash (without running the script)	bash
Bash output as Applescript list problems.	bash
Replace chars in file by index	bash
Printing out names of only directories and not files (BASH)	bash
How to set an alias inside a bash shell script	bash
how to automatically ignore files in grep	bash
Retrieving All Of An NSTreeController's Objects.	cocoa
Countdown Timer in Cocoa	cocoa
Using single quote when building a string in Cocoa	cocoa
Cocoa Framework Issue	cocoa
How would you make a checkbox delete a row in a table if checked (Cocoa) ?	cocoa
How to make a transparent NSView subclass handle mouse events?	cocoa
loading custom framework in iphone	cocoa
iPhone subview design (UIView vs UIViewController)	cocoa
Key Value Observing in Cocoa, introspecting the change property	cocoa
OS X - App doesn't show up in force quit.  How do I fix that?	cocoa
Is it possible to observe a readonly property of an object in cocoa?	cocoa
resizing an NSPanel to fit a dynamic NSMatrix and a button	cocoa
how to new a nib file in xcode 3.0?	cocoa
How to automatically expand all children of an nsoutlineview in cocoa?	cocoa
Load SWF inside NSView	cocoa
Why the splash window can’t show before the App lunch?	cocoa
Helper functions in Cocoa	cocoa
How to use NSURLRequest with non-static content?	cocoa
Mac OS X: Quickest way to kill/quit an entire process tree from within a Cocoa application.	cocoa
Using Calender Store.	cocoa
find natural block size of the media being used by file handle	cocoa
Correct Structure to check for Errors using NSError	cocoa
NSTask returning HTTP Headers	cocoa
Any reason to use NSViewAnimation over CoreAnimation techniques?	cocoa
What do these errors in the XCode Debugger Mean?	cocoa
Memory Leaks - Formatting a String To Display Time, Each Second	cocoa
NSMutableArray count always returns zero	cocoa
How do you put a normal control into an NSView?	cocoa
Creating a Quartz Composer Style interface	cocoa
Count of chars in NSString or NSMutableString?	cocoa
NSTableView - NSButtonCell Data Source type?	cocoa
CFStringRef to NSString	cocoa
Debugging a Cocoa droplet application in Xcode	cocoa
How to make an NSString path (file name) safe	cocoa
Create DMG file	cocoa
Cocoa bindings: custom setter methods?	cocoa
Why is App window only opening once and then not opening again?	cocoa
how to open a panel with new folder function by NSOpenPanel ?	cocoa
NSString's initWithData:encoding: return type issue	cocoa
In cocoa, Is there a proper way to handle overlapping NSView siblings?	cocoa
Reference from UITableViewCell to parent UITableView?	cocoa
Background image for a window in cocoA framework	cocoa
How to get the token type from a CFStringTokenizer in Cocoa?	cocoa
Highlight NSToolbarItems	cocoa
SFAuthorizationView authorize: method does not work.	cocoa
UINavigationController and autorotation.	cocoa
Traversing multiple Core Data objects using NSPredicate	cocoa
Posix Error 14 (bad address) on open read stream in Cocoa.  Hints?	cocoa
Cocoa: Quartz, Core Graphics, Context vs View. Oh My!	cocoa
Who owns an NSWindowController, in standard practice?	cocoa
CATransform3D vs. CGAffineTransform?	cocoa
how do I package support files in a cocoa app	cocoa
When does selectedCell change?	cocoa
NSTableView Troubles	cocoa
NSOutlineView - Auto-expand all nodes	cocoa
Why does my nib's window close immediately?	cocoa
Triggering a method when a row in a Table View is edited.	cocoa
How did the Cocoa Framework got its name?	cocoa
Best way to post NSNotification with NSRect info?	cocoa
Comparing Two Arrays.	cocoa
Drupal Views (Page) Using Human-Friendly Path	drupal
drupal 6: how to email users of tasks due (week b4, day before, and overdue)	drupal
[Drupal] How do i give a specific user editing rights to a specific node?	drupal
drupal: auto-generate video thumbnails	drupal
A metaphor for Drupal module's inner workings	drupal
drupal bootstrap script: how to get list of all nodes of type x?	drupal
Add another node display (like teaser, full node) to Drupal	drupal
drupal node update permission once a week	drupal
At what point do you need to be a programmer to work with Drupal?	drupal
drupal's hook_preprocess_page not working as expected	drupal
Drupal best practises for custom admin section	drupal
Differing Apache Solr results when doing queries through Drupal – why?	drupal
Drupal 6: Modifying uid of a submitted node	drupal
Is Drupal ready for the enterprise?	drupal
Embedding inline advertisement in nodes in Drupal 6.x ?	drupal
using Drupal for 1 page of xhtml-css website.	drupal
Passing Multiple Arguments from Panels in Views ( Drupal)	drupal
How can we add an iframe into the contact page in Drupal 6	drupal
Drupal Views: How to a print the last time a View cache was refreshed to the view Display	drupal
How to open a flash SWF in ThickBox in Drupal on page load, and close it after x seconds	drupal
drupal_add_css not working	drupal
jQuery $.get() not working in Drupal 6	drupal
Drupal/Drush: How to bundle a project.profile within a project.make?	drupal
Team working on Drupal - Tips	drupal
Drupal Form-API: #field_prefix doesn't work on textfield	drupal
How to add classes for styling to Drupal when using menu_block?	drupal
How to solve the problem with the use of deprecated function ereg() of PHP 5.3.0 in Drupal  6.13	drupal
Detect which other modules are enabled in a new Drupal module	drupal
How do I move the tag section below the content in Drupal 6?	drupal
Simple Drupal sub-themeing...what am I doing wrong...?	drupal
using BC dates in Drupal date field	drupal
Filter and View screens on different pages	drupal
Get all Comment ID's within a Drupal node	drupal
Drupal Token Examples of Usage	drupal
What version of TinyMCE will work in Drupal 5 with google chrome?	drupal
When to develop a new drupal module vs. work with what exists?	drupal
Drupal 6: How to quickly theme a view ?	drupal
Date Popup module - I want a Time Popup as well	drupal
Preserving data integrity in Drupal:	drupal
drupal: hide single taxonomy term in particular view display	drupal
Migrating from Drupal to Rails - Routing	drupal
Drupal: customizing user registration workflow for communicating with another webapp	drupal
How to change Drupals menu alternatives for creating a page	drupal
How to add theme settings to Zen-based themes?	drupal
Drupal: View with exposed Taxonomy filter.. 3 questions	drupal
How does Drupal provide an edit/review/publish model?	drupal
drupal multiple node forms on one page	drupal
Drupal VS Zikula	drupal
disabling Drupal's CSS/JS aggregation for admins	drupal
Access Drupal views arguement in the same views header or footer section.	drupal
Drupal How to get a view to display as columns rather than rows	drupal
Underscore before theme name	drupal
how to add additional message in a Drupal form	drupal
Drupal incorrectly espaces tags in javascript	drupal
Is there option to have powerfull URL and Aliases in Drupal, not the poor one that I've found?	drupal
Drupal Add Static link to a view	drupal
Drupal and Ubercart - Add order that customer can pay for online? Bill customer's order without having them manually put it in their cart?	drupal
Invoking drupal	drupal
What is the best Drupal Survey module	drupal
Does the order of cases matter in PHP switch statements?	drupal
Excel VBA pastelink run-time error 1004: Application-defined or object-defined error.	excel
Saving different csv files as different sheets in a single excel workbook	excel
Excel CSV - Number cell format	excel
Need VB to make Excel calculate a sheet or range in realtime and in the background	excel
How to call a long-running external program from Excel / VBA	excel
Excel: how to start macro recording from OLE	excel
Can I make a structured reference absolute in excel 07?	excel
Can this be done using excel macos?	excel
VBA and Private Functions	excel
Excel Interop Formatting Issues	excel
Excel VBA - Stop running program that was started by Shell?	excel
Default value for PivotChart Report Filter/Page Field	excel
Excel Replace all found chars	excel
.Net Localization problem	excel
trouble connecting Excel to Analysis Services server..	excel
Looping Code/Skipping Rows	excel
How can I hook up to Excel events in Javascript	excel
"Excel Interop ""FindAll"" Method"	excel
excel VBA horizontal alignment problems when using NumberFormat codes	excel
generate excel sheet from a excel template in asp.net using vb.net	excel
Using a formula from another column in Excel	excel
Excel: how to create a number in a column according to a text value in other column?	excel
How to stop Excel to prompt to reopen a workbook.	excel
Read password protected excel file using OLEDB in C#	excel
How can an Excel Add-In respond to events in any worksheet?	excel
Please help me the macro that only a cell of the specific keyword does in a blank. in Excel	excel
XlsIo DateTime Incorrect by about 4 years	excel
How to show long numbers in excell ?	excel
How to create Linked texbox in worksheet?	excel
excel time serial back to text	excel
Excel VBA: Identify invalid characters in text based cell	excel
How to store information in a Excel WoorkBook	excel
Convert Excel 95 to Excel97+ without automation?	excel
converting an Excel (xls) file to a comma separated (csv) file without the GUI	excel
Print certain tabs	excel
Excel xth letter of the alfabet	excel
Excel problem with deleting CustomProperty in Korean	excel
Best short examples of the need for Excel VBA	excel
MS Excel create virtual column to use in formula	excel
excel string comparison is failing when it should not	excel
Excel / Quickbooks data to c#	excel
Grabbing text between slashes in Excel	excel
Why does declaring content as a string cause WinHttp not send HTTP content in Excel VBA?	excel
Excel: filter table rows by specified column value	excel
Selecting the max with a condition in excel	excel
Excel Add-in doesn't get the hint	excel
Is there a way to use OLE DB Provider for Jet on an unsaved Excel workbook?	excel
Making Excel 2002 use .NET v2.0.50727 runtime	excel
How to read Excel file in c# by connection string?	excel
DSUM: How to define the criteria range using braces?	excel
Find distance between two cities in Excel using Google Maps API	excel
What is the difference between a shared formula and an array formula?	excel
Docking Custom Task Panes	excel
Excel/VBA to check if a row exists	excel
How to insert the symbol 'Infinite' in Excel programmatically?	excel
Generating CSV file for Excel, how to have a newline inside a value	excel
Excel Range describes a group of adjacent cells.  When several groups of non-contiguous cells are selected, how do you get them all from Worksheet.Selected (range)?	excel
How to keep one variable constant with other one changing with row in excel	excel
Fill array with consecutive integers	excel
How can I get back a previously created Excel ListObject?	excel
Replacing an element in a n-ary tree	haskell
Why is [String] the inferred type when there are no lists visible in the code?	haskell
Haskell -- How to split a number into a list for further processing?	haskell
Haskell - specyfing kind in data declaration	haskell
Is there a way to implement constraints in Haskell's type classes?	haskell
How to mix binding (<-) and assignment (let) in one line? (in Haskell)	haskell
How to remove an item from a List in Haskell	haskell
"what is a ""Spark"" in haskell"	haskell
Linking/Combining Type Classes in Haskell	haskell
How to split up a file into modules in Haskell?	haskell
Raise ParseError in Haskell/Parsec	haskell
Guarded Equations in Haskell	haskell
What does the : infix operator do in Haskell?	haskell
List of GHC extensions	haskell
Using items in a list as arguments	haskell
Call an haskell function in .net	haskell
How does 'get' actually /get/ the initial state in Haskell?	haskell
What are zygo/meta/histo/para/futu/dyna/whatever-morphisms?	haskell
"Is do-notation specific to ""base:GHC.Base.Monad""?"	haskell
Dealing with large files in Haskell	haskell
C stack overflow on Project Euler Problem 27	haskell
How do I convert a variable to a string?	haskell
Haskell's liftIO's litter functions of type ErrorT String IO ()	haskell
"Which is your favorite ""hidden gem"" package on Hackage?"	haskell
Handling incremental Data Modeling Changes in Functional Programming	haskell
"""Lazy IO"" in Haskell?"	haskell
Haskell n-ary tree traversal	haskell
Good functions and techniques for dealing with haskell tuples?	haskell
how can i evaluate an expression?	haskell
What are some good intermediate problems and projects for learning Haskell?	haskell
Haskell, HDBC, ODBC, MySQL and Mac OS X	haskell
Haskell Error: Couldn't match expected type `Integer' against inferred type `Int'	haskell
Haskell numeric type heirarch in SICP exercises	haskell
Haskell execution sequence	haskell
Using MonadPlus in FRP.Reactive.FieldTrip	haskell
How do I install nano-hmac on Mac OS X?	haskell
When is the difference between quotRem and divMod useful?	haskell
Haskell Pattern Matching on the Empty Set	haskell
What does `~` means on Haskell Code	haskell
Haskell pixel drawing library linux	haskell
changing search-dirs for $ sudo gcc	haskell
Haskell recursive problem, tiny parser. Negation of Expr and let expressions	haskell
Function application: Why is $ used here?	haskell
Pass Pointer to an Array in Haskell to a C Function	haskell
haskell polymorphism and lists	haskell
Problem installing haskel-platform	haskell
Why does the following simple Haskell function give slightly strange answers?	haskell
absolute values in Haskell	haskell
Concurrent DB connection pool in Haskell	haskell
How to get 64-bit binaries from GHC for Snow Leopard?	haskell
Infinite loop in haskell? (newbie)	haskell
How do you solve this Haskell problem using higher order functions?	haskell
Haskell and random numbers	haskell
What is primitive recursion?	haskell
Cannot derive a Show instance for data containing UTCTime	haskell
How to move an element in a list in Haskell?	haskell
Can I do something like this in haskell	haskell
Why must recursion be in a separate file in hugs?	haskell
Help Understanding Arrows in Haskell	haskell
Haskell audio output on OS X?	haskell
Criteria query with restriction across a joined subclass problem	hibernate
Hibernate Query vs Criteria Performance	hibernate
Hibernate Immutable Value Object	hibernate
hibernate manytomany	hibernate
How to create and read a sequence in Hibernate?	hibernate
hibernate criteria - querying tables in n:m relationship	hibernate
InvalidMappingException  Hibernate mapping file...anybody can you give resolution	hibernate
Add (external) relationship (tagging) to existing Hibernate entities	hibernate
Why does hibernate-entitymanager-3.3.2.GA depend on hibernate-3.2.6.ga?	hibernate
Hibernate - query caching/second level cache does not work by value object containing subitems	hibernate
Problem with mapping tag in hibernate configuration file	hibernate
Setting up NHProf for Hibernate	hibernate
delete hibernate entity without (attempting to) delete association table (view) entry	hibernate
understanding JasperReports and JRBeanCollectionDataSource...	hibernate
How to use the Hibernate optimistic locking version property on the front end?	hibernate
Remove dinamically an ordering to the result set in org.hibernate.Criteria	hibernate
hibernate connection pool	hibernate
hibernate mapping class	hibernate
Recording test data in Hibernate	hibernate
Double-logging in Hibernate	hibernate
Does Hibernate 2nd-Level cache invalidate when running a JPQL update statement	hibernate
Cannot run JBoss Cache as a second level cache for Hibernate in JBoss 5	hibernate
Terracotta With Hibernate and EHCache	hibernate
Hibernate ordering	hibernate
Update of of Composite Entity fails	hibernate
How to reuse existing connection in Open Session In view pattern implementation of Hibernate?	hibernate
JPA and Hibernate Fetch ignoring Associations?	hibernate
Hibernate case-insensitive utf-8/unicode collation that works on multiple DBMS	hibernate
Spring-Hibernate DAO naming convention?	hibernate
Hibernate: Persisting Objects	hibernate
How to query distinct values from map with given key in Hibernate?	hibernate
Hibernate Criteria and multiple join	hibernate
hibernate - projection a component	hibernate
Strategies for designing a database (being accessed by hibernate) which will have alot of archivial data.	hibernate
Hibernate session / transaction design	hibernate
"Hibernate <generator class="""" > When is it best to use what?"	hibernate
Hibernate Error : Caused by: org.hibernate.NonUniqueObjectException: a different object with the same identifier value was already associated with the session:	hibernate
How do I persist a Java property of type Object using Hibernate?	hibernate
Hibernate Annotations generating query that produces SQLGrammarException	hibernate
Adding a enum as a class property in HBM.	hibernate
Preventing NaN from being persisted by Hibernate	hibernate
