text	label
how to define an inverse cascade delete on a many-to-one mapping in hibernate	hibernate
Mapping to varchar and nvarchar in hibernate	hibernate
Hibernate Exception	hibernate
Hibernate @OrderBy with referenced class	hibernate
hibernate one to one mapping example	hibernate
many-to-many mapping not working, one side is set to inverse.	hibernate
Hibernate load UserType object from repository	hibernate
Problems with ArrayList items and hibernate	hibernate
"How to achieve ""not in"" by using Restrictions and criteria in Hibernate?"	hibernate
With Hibernate, an Interceptor receives the same collection object as current and previous, how do I get real current and previous values?	hibernate
Hibernate running random queries.	hibernate
Turn off Hibernate Logs for certain query	hibernate
Hibernate query not returning full object	hibernate
Obtaining a new session from Hibernate for a background thread.	hibernate
How to do ORM for this situation?	hibernate
How to use Hibernate @Any-related annotataions?	hibernate
Hibernate: ORDER BY using Criteria API	hibernate
Hibernate Question on Sessions	hibernate
Hibernate 2nd lvl cache	hibernate
How can I query two databases and combine the results using LINQ?	linq
Sum of items in a collection	linq
Why would a Database developer use LINQ	linq
linq operators like in	linq
Populating child collection property with LINQ sub-query	linq
Linq query built in foreach loop always takes parameter value from last iteration	linq
linq to sql:  join multiple columns from the same table	linq
LINQ Except operator and object equality	linq
How save XPathExpression result to separate XML with ancestor structure?	linq
LINQ Syntext Sequence	linq
Automatically Compile Linq Queries	linq
Are Update/Delete/Insert on the Linq Roadmap?	linq
How can I perform a nested Join, Add, and Group in LINQ?	linq
Need some help ordering a Linq result.	linq
The Microsoft.VisualStudio.Data.Interop.IVsDataProviderManager service could not be found.	linq
How do I use subquery, groupby, max, and top in single linqToSql statement?	linq
Using XQuery in Linq To SQL?	linq
Use LINQ for arbitrary sorting	linq
Clever tricks to find specific LINQ queries in SQL Profiler	linq
How to add collation to Linq expressions?	linq
NullReferenceException when using Linq to XML	linq
Add incremented property to IEnumerable by group using LINQ	linq
Bind Exclude Asp.net MVC doesn't work on LINQ Entity	linq
Checking if Var from LINQ query is Null and returning values older than x	linq
How do you handle arbitrary namespaces when querying over Linq to XML?	linq
How do I project to a dictionary with a custom type using Linq to SQL?	linq
How to get Max String Length in every Column of a Datatable	linq
Linq validation non nullable properties	linq
What would this sql query (w count and group by) look like when translated to linq?	linq
LINQ to SQL and object lifetimes, references vs. values	linq
linq cache and disposing datacontext	linq
join between two tables with linq to datasets	linq
How can I use linq to sort by multiple fields?	linq
LINQ to SQL	linq
LINQ inner join betwenn Enumerable and DB Table	linq
How do I write this in Ruby/Python? Or, can you translate my LINQ to Ruby/Python?	linq
Linq (MIN && MAX)	linq
How would you write an Upsert for LINQ to SQL?	linq
How much overhead does 'Update Check' have for LINQ UPDATES	linq
multiple orderby in this linq code	linq
How LINQ works internally?	linq
LINQ- Combine Multiple List<T>  and order by a value (.Net 3.5)	linq
Determine if a sequence contains all elements of another sequence using Linq	linq
LINQ Refactoring	linq
Manually select related table data when quering in LINQ to SQL	linq
ADO.NET Data Service not dynamically updating	linq
Adding a custom member to a mapped type	linq
Timesheets: Retrieve data using SQL, LINQ or class?	linq
How mainstream is LINQ?	linq
Using LINQ to get column value from column name when you have the row?	linq
Your Favorite LINQ-to-Objects Queries	linq
LINQ External Mapping to Class Library	linq
Linq for java	linq
Silverlight 3 - RIA Services and LINQ	linq
Non generic IQueryable Enumeration Problem	linq
Is there a way to write a group by query in LinqToSql grouping not on a scalar value?	linq
LINQ to DATASET update with a stored procedure	linq
Linq to SQL Nested IN FROM query	linq
When using a LINQ Where clause on a Dictionary, how can I return a dictionary of the same type?	linq
Linq Not Retrieving Correct Items in a Big Table	linq
Magento Community Edition Capability Questions	magento
how to get store information in magento?	magento
How to solve 404 not found problem in Magento	magento
free shipping based on product weight in magento	magento
How to get reviews success message in magento?	magento
Set session time out limit for magento frontend	magento
Magento 1.4 - Display All Products	magento
"""Magento Tax Zones & Rates"": how to incorporate store location and price dependencies for Tax Rates"	magento
Problems in installation of magento on wamp	magento
Filter Magento collection but not products, using distinct	magento
Magento Admin Custom Sales Report	magento
magento example module	magento
Magento 1.3 or 1.4	magento
Magento - Use Short description for Google base description	magento
Magento - Layout and block	magento
Magento Developers: Is Magento really -that- good?	magento
Testing sucess with shipping enabled vs disabled in Magento	magento
How do I change the admin header color in Magento?	magento
move magento attribute to tab	magento
Magento - 2 or more observer on same event	magento
my Magento Observer is getting in Endless loop	magento
Magento - determine which xml layout file a page is using?	magento
Magento - Cronjob outside magento to update shipment status	magento
"Magento - Using alternative ""reviews count"" on category list page"	magento
Add a date picker to system.xml on custom module	magento
can a magento adminhtml field depend on more then one field or value?	magento
how to add Adding external javascript in magento.	magento
magento block injction via module.xml	magento
"magento extension ""remeber me"" not working"	magento
Hide categories that have no products magento	magento
Overridding a Shipping Method - What am I missing	magento
Magento: output an attibute as a link	magento
Magento - Display Attribute Admin Title	magento
Magento: find products without images (no image)	magento
magento onepage checkout problem	magento
Magento add rate options to products	magento
Creating a configurable Magento attribute from scratch	magento
Magento topSearch doesn't work in template	magento
Magento & vertnav extension	magento
Magneto as B2B - view 'company name' instead of first/last name	magento
Custom cases of product in Magento?	magento
Weird Error In My system.log file Over and Over and Over	magento
i need help to integrate webgistix shipping method into magento	magento
Magento - Difference Between Import All Products/import Product Stock?	magento
magento VS magento clone - cost of ownership	magento
Invoice for 2 or more orders in magento	magento
Magento: Getting Product Url's for Products within a Grouped Product	magento
in magento 1.3.2 which file is responsible forstoring the data of payment gateway options like Mastercard visa AMEX?	magento
Magento > product displaying in subcategory but not in the category	magento
[MAGENTO] How to use an external lib? (PclZip)	magento
Magento Email Template Help	magento
Current user in Magento?	magento
FILTER BY ATTRIBUTE MAGENTO	magento
Magento Product Details Image Size	magento
Ideas for Implementing Magento Order Approval process?	magento
Magento - Adminhtml - Get id of order just created	magento
magento url rewrite	magento
Free downloadable products in Magento	magento
sort categories according to date when its added	magento
"Magento xml layouts - before=""-"" not working in 1.4.2"	magento
How do I update the matlab path?	matlab
Can someone explain what the output of fft means in MATLAB?	matlab
[Matlab] Storing Results of a Operation in a Matrix	matlab
How to merge a 64 by 64 cell into a 1 by 1 cell	matlab
Help me understand FFT function (Matlab)	matlab
Plot overlaps in matlab	matlab
Compiled Matlab: application hangs at the end	matlab
Optimizing extraction of data from a Matlab matrix	matlab
matlab - creating a single dimensional array from two dimensional parts	matlab
Matlab Simulation: Point (symbol) Moving from start point to end point and back	matlab
How do I make a plot in Matlab if I do not know the specific size of the array?	matlab
MySQL and Matlab	matlab
matlab:comparing all elements in three arrays	matlab
How to set output size in Matlab newff method	matlab
MATLAB GUI axes break window layout	matlab
MATLAB: Assign multiple colors to text in legend	matlab
Using find function on columns and rows in matlab	matlab
Neural network XOR backpropagation info needed.	matlab
matlab quickie: test if text file is empty	matlab
Tidying up a list	matlab
Problem (bug?) loading hexadecimal data into MATLAB	matlab
How do i get rid of NaNs in matlab?	matlab
matlab:find the 4th vertice of a parallelogram	matlab
Packages in MatLab for a beginner?	matlab
Problem computing a summation in matlab, seems so simple but i can't get it...	matlab
Analyzing data for noisy arrays	matlab
Test if a data distribution follows a Gaussian distribution in MATLAB	matlab
MATLAB functions in C++	matlab
How to apply moving windows to a 2D matrix in MATLAB?	matlab
MATLAB - Delete elements of binary files without loading entire file	matlab
recursive function's summation in MATLAB	matlab
Matlab subclassing question	matlab
sorting a timer in matlab	matlab
MATLAB: pre-allocation of matrix yields error	matlab
What is the closest thing MATLAB has to namespaces?	matlab
Compiling Matlab to C# Problem: fatal error C1083: Cannot open include file: 'windows.h'	matlab
accelerating Wheel - psychtoolbox in matlab	matlab
How to open DBase files (.DBF) in Matlab?	matlab
How do I use the least squares approximation in MATLAB?	matlab
Matlab: Filling a matrix with each column being the same	matlab
Saving matlab sparse matrix to text file	matlab
How to change Matlab program for solving equation with finite element method?	matlab
Matlab - usage of knnclassify	matlab
How to efficiently find correlation and discard points outside 3-sigma range in MATLAB?	matlab
joining dots of scatter plot and create line	matlab
Can the following loop be vectorize?	matlab
Alternate method to kron	matlab
matlab in C C++ and  C C++ in matlab	matlab
Matlab Polymorphism question	matlab
Matlab - plot multiple data sets on a scatter plot	matlab
Cell Array appending in Matlab.	matlab
Why is this class re-initialized every time?	matlab
To find points of intersection between straight lines & our figure in matlab	matlab
Color Comparison of two images using matlab	matlab
how to plot ellipse in this format?	matlab
TreePlot String Labeling MATLAB	matlab
Problems with Matlab javabuilder and memory	matlab
how to divide a spectogram into a certain number of ranges using mel filter banks using matlab???	matlab
Matlab Maximum Function Count Exceeded	matlab
How to plot 2 graphics in one picture?	matlab
JVM crashes when trying to connect to Oracle using OCI	oracle
Database history for client usage	oracle
How to disable XML DTD validation in Oracle DB?	oracle
Oracle command-line tools on Linux	oracle
Is it recommended practice to use uniform extent sizes in Oracle tablespaces?	oracle
Oracle: How to create an element in a specific namespace with XMLElement()	oracle
Microsoft provider for Oracle and positional parameters	oracle
"Any difference between ""current row"" and ""0 preceding/following"" in windowing clause of Oracle analytic functions?"	oracle
Oracle EXECUTE IMMEDIATE with variable number of binds possible?	oracle
Why would a database trigger be invalid in an oracle DB?	oracle
Tools for matching name/address data	oracle
Oracle 10g PL/SQL- Select results as update column values	oracle
#define Equivalent for Oracle SQL?	oracle
Predicting Oracle Table Growth	oracle
What is the bullet-proof way to specify the Easy Connect string for Oracle?	oracle
How do I let my DBA pause and resume a stored procedure that is updating every row in a large table?	oracle
What is the dual table in Oracle?	oracle
Oracle: OALL8 is in an inconsistent state	oracle
ORA-03113: end-of-file on communication channel after long inactivity in ASP.Net app	oracle
Oracle V-Limits (VARCHAR, VARRAY, etc)	oracle
How to get column info from oracle table you don't own (without using describe)?	oracle
How do I test if a column equals empty_clob() in Oracle?	oracle
How many temporary extents is my oracle 10g session using?	oracle
How can I use the 'NVL' function on a result table?	oracle
Things to watch out for in moving from Oracle Express to the Real Deal?	oracle
Sessions with clustered instances of Oracle Application Server	oracle
Oracle can I use scalar functions in WHERE Clause? or a NULL issue	oracle
Oracle triggers error are not captured while using ADODB	oracle
A useful example of when to use vsize function instead of length function in Oracle?	oracle
SQL Developer error	oracle
Resultset logic when selecting tables without a join?	oracle
Detecting the number of ORACLE rows updated by a OCI OCIStmtExecute call	oracle
Inserting multiple rows into Oracle	oracle
Identify a table with maximum rows in Oracle	oracle
Understanding Lob segments (SYS_LOB) in oracle?	oracle
In Oracle, is starting the SQL Query's WHERE clause with 1=1 useful?	oracle
What column type in Oracle can take full range of java double values	oracle
SQLPlus settings to generate tab-separated data file	oracle
How can multiple rows be concatenated into one in Oracle without creating a stored procedure?	oracle
How to extract leaf nodes from Oracle XMLTYPE	oracle
passing a datatable as a field from Oracle to .NET	oracle
Print text in Oracle SQL Developer SQL Worksheet window	oracle
Use Oracle 6 from ASP.NET application	oracle
OracleDependency not firing event	oracle
How to select a related group of items in Oracle SQL	oracle
Always get exception when trying to Fill data to DataTable	oracle
Oracle - select AND delete in a procedure	oracle
Using Semicolons in Oracle SQL Statements	oracle
"Oracle: what is the ""instantclient"" connection string format?"	oracle
How to load Java Stored Procedure through JDBC into Oracle 10g?	oracle
When programatically creating a DSN for an Oracle database how can I reliably tell the driver name?	oracle
Allow Oracle User to connect from one IP address only	oracle
Oracle DATE Index	oracle
How to execute an Oracle stored procedure via a database link.	oracle
Using a ref cursor as input type with ODP.NET	oracle
Is there a way to specify a super-type sub-type relationship in Oracle Designer?	oracle
How to get UTC value for SYSDATE on Oracle	oracle
Oracle: How do I convert hex to decimal in Oracle SQL?	oracle
Is it stupid to write a large batch processing program entirely in PL/SQL?	oracle
In Oracle Spatial (SDO), is there a way to get the centroid point of a polygon that is contained by the surface of the polygon?	oracle
NSImage color shift on Snow Leopard	osx
How to I launch an on-screen keyboard from my application on Mac OSX?	osx
Mac Plugins no longer support GetWindowFromPort?	osx
Unable to build SciPy on OS X 10.5.7	osx
A simple way to generate tones / sine waves on mac? (ruby would be nice)	osx
Building universal binaries on Mac - Forcing single compiler child process	osx
How can I change the default edtior for OS X on install?	osx
Getting the name of document that used to launch the application bundle on OS X	osx
Powerbook compiler queries	osx
"How to create a zip file in the same format as the Finder's ""Compress"" menu item?"	osx
Applescript to launch iTunes with a specific library	osx
How to avoid installing unnecessary dependencies with MacPorts?	osx
Is it possible to create autorun hybrid CD/DVD on Max OSX Tiger/Leopard?	osx
USB (PNY 4GB) suddenly appears empty - mounts, but name is strange, files not there	osx
Where is PyGTK for Mac OS X?	osx
How to get NSAlert sheet to return focus to calling window?	osx
Launch safari from a Mac application	osx
OSX - always hide certain files	osx
When was <input type=search> introduced in Safari	osx
Mail Message Link Handling	osx
Resources to learn MacOSX development from Linux/Windows development point of view	osx
Sample a process on Mac OS X from a C/C++ program	osx
Is it possible to add multiple commands to the readline .inputrc file?	osx
What does it mean when AuthorizationExecuteWithPrivileges() returns -1?	osx
developing a osx deamon that runs before user login using xcode.	osx
List potential applications that could open a file	osx
How do I disable warnings being flagged as errors in XCode	osx
Epoch Time (Ticks since 1970) - Mac vs. Windows	osx
Precompiled headers and compiling universal objects on OSX	osx
OS X: creating or extracting preview(.jpg,.png) of .eps file	osx
How to simulate a low level keypress on os x?	osx
Best location for database file in Mac OSX	osx
Looking for an OSX application that can do image processing using a webcam.	osx
Blank process name for OSX Cocoa application?	osx
Applet lifecycle in Mac OS X	osx
Upload Folder via Mac Terminal	osx
Multiple mice on OS X	osx
Good framework for the game of Go (weiqi, baduk)?	osx
Problem building Ruby on Mac OSX Snow Leopard	osx
[macosx]does dlopen call open and read functions?	osx
Problem with Apache on Mac OS X	osx
Embed webserver in carbon bundle	osx
How to pass a command line switch to XCode when I start 'Build and Debug'	osx
virtual machine player to os x	osx
I already have PHP installed, what's the easiest (best) way to get GDLib installed?	osx
C++ FileIO Pointer Leak error	osx
Cocoa NSArray/NSSet: -makeObjectsPerformSelector: vs. fast enumeration	osx
What's the best Mac custom disk image creation app?	osx
Eclipse keyboard shortcuts broken in 10.5.6	osx
Where to find volume mount icon on Leopard	osx
OSX: Environment variables pointing to application bundles?	osx
What are the alternatives to using phpMyAdmin?	osx
osx change file encoding (iconv) recursive	osx
What's the best way to remove all .svn directories throughout a directory hierarchy on Mac OS X?	osx
changing Mac keychain Password programatically?	osx
Testing web application on Mac/Safari when I don't own a Mac	osx
Obtaining a Mac's System Profiler data from shell	osx
Sporadic errSecAuthFailed (-25293) when accessing KeyChain with SecKeychainFindGenericPassword?	osx
Odd Behavior With Copy/Paste Into FSI On Mac	osx
Beginner question about XCode 3.1.1 and static libraries	osx
How to deallocate memory when a Qt window closes?	qt
Performance issue with QGraphicsScene::createItemGroup	qt
QT Repaint/Redraw/Update/Do Something!	qt
Resizing Mfc dialog with embeded QWinWidget	qt
Hiding a QWidget on a QToolbar?	qt
For Qt 4.6.x, how to auto-size text to fit in a specified width?	qt
Dynamically manipulate Qt GUI	qt
QT set window background	qt
Qt, text on a black and white screen	qt
How do I respond to an internal drag-and-drop operation using a QListWidget?	qt
Qt how can i get content of web-page?	qt
What's the best strategy for large amounts of audio files in mobile application?	qt
64-bit Qt and Postgres in Windows	qt
QT & UDP-Socket	qt
breakpoints not working after installing valgrind	qt
QListWidget on freemantle	qt
What is the minimum amount of tweaking needed to get QClipboard::setText() to work under X11?	qt
PCSC-Lite Codes on Windows	qt
Compiling QT-Creator with mingw	qt
Qt Animation: Appearing & Disappearing Objects	qt
qt soap client + ASP.net Web service	qt
Does Qt have a C interface?	qt
How to Add this functionality to Qt 4.6 embedded linux QWS ( Qt Windowing System) ?	qt
Question about Qt slots and multiple calls	qt
QT creator Installation error? - Snow Leopard	qt
is it possible to use QtConcurrent::run() with a function member of a class	qt
Removing arrows from scrollbar in Qt	qt
how can I find out why a custom widget isn't showing up in the Qt Designer?	qt
How to create a QWidget with a HWND as parent?	qt
QT4: Transparent Window with rounded corners	qt
QTabBar vs QTabWidget	qt
Can a class inherited from Qthread behave as a normal class?	qt
Qt conflicting with GLee	qt
Qt: Session Management Error	qt
C++ Qt: bitwise operations	qt
How do I auto-adjust the size of a QDialog depending on the text length of one of its children?	qt
undo redo with an auto delete mechanism	qt
QT: Using QPainter on child widgets	qt
How can I prevent dragged items to be drawn during a drag and drop operation in Qt?	qt
Is it necessary for Qt::paintEvent to be reentrant?	qt
QT 4.6 release date	qt
Figuring out which menu item was triggered in Qt	qt
Set parent's status bar text?	qt
IE window in QT	qt
Measuring text width in Qt	qt
Linking with a debug/release lib with qmake/Qt Creator	qt
Cross Platform C library for GUI Apps?	qt
QT / thread event loop QTimer/Mysql queries	qt
How to create a bold, red text label in Qt?	qt
How can I implement a blocking process in a single slot without freezing the GUI?	qt
QProcess::setStandardOutputFile only creates 0kb File	qt
How to create artificial nodes in QAbstractItemModel for QTreeView	qt
help with mixing widget painting and UDP data transfers in a multi-threaded context	qt
Corrupted Qt Widgets on Windows Mobile	qt
Displaying translucent / irregular-shaped windows with Qt	qt
most effective row removal strategy for QStandardItemModel	qt
Question about QThread implementation	qt
How to show Tooltips in Qt	qt
Qt4.5: Using event-loop based localsocket before app.exec	qt
How can I implement Google Maps-like tile scrolling in Qt?	qt
scala 2.8 breakout	scala
How are Scala traits compiled into Java bytecode?	scala
Scala 2.8 - Potential problem with named arguments	scala
Is there a nice, safe, quick way to write an InputStream to a File in Scala?	scala
scala: Method\Operator Overloading	scala
Is pretty XStream serialization feasible with Scala?	scala
Conflicting nested inherited traits	scala
How to play with Specs matchers in Scala REPL?	scala
Question on scala compiler syntax hacking	scala
"What's the ""functional way"" to avoid passing state-choosing context down the call stack?"	scala
O(1) conversion from mutable.Map to immutable.Map?	scala
short way to breakOut to specific collection type?	scala
Pattern matching with multiline XML case	scala
Why does scala immutable HashMap methods return a Map?	scala
Writing applications with Scala actors in practice II	scala
How to integrate Scala language with Spring Security	scala
Applying a function to a tuple in Scala	scala
Why does one of these statements compile in Scala but not the other?	scala
Scala: How do I cast a variable?	scala
How can I iterate a list of lists in scala?	scala
Can one create Sized Types in Scala?	scala
How do you define an @interface in Scala?	scala
is there any scala network library with actor model	scala
How can I define an anonymous generic Scala function?	scala
How can I serialize (and later deserialize) a generic type in Scala?	scala
scala compilation problem - with java libs	scala
Scala Tuple Deconstruction	scala
Using scala actor framework as fork-join computation?	scala
Is it possible to specify an anonymous function's return type, in Scala?	scala
Learning Scala or Haskell	scala
Security of scala runtime	scala
How well does Scala Perform Comapred to Java?	scala
how do i create a map with a type parameter of class	scala
Composing actors	scala
Project Euler 7 Scala Problem	scala
Does Scala have a library method to wrap nullable return values in an Option?	scala
Why it is allowed to point to constructors parameters?	scala
Type parameters versus member types in Scala	scala
scala: mixins depending on type of arguments	scala
How to do something like this in Scala?	scala
Avoiding Scala memory leaks - Scala constructors	scala
Using type aliases to Java enums	scala
Idiomatic IO with scala	scala
Scala Actors suspends unexpected when connecting to a database	scala
`sbt package` results in huge war file - how to make it smaller?	scala
Convert Scala Set into Java (java.util.Set)?	scala
Internal scala compilation. Working with interactive.Global	scala
When is @uncheckedVariance needed in Scala, and why is it used in GenericTraversableTemplate?	scala
How can I create a typed Tuple2 from Java / Spring?	scala
Why does Scala create a ~/tmp directory when I run a script?	scala
Can a Scala program be compiled to run on any JVM, without having Scala installed on the given machine?	scala
Can someone explain this article about enforcing race safety in Scala.	scala
How to make a Scala Applet whose Applet class is a singleton?	scala
Is it bad practice to send an  actor a message from something which is not an actor?	scala
Is there a way to control which implicit conversion will be the default used?	scala
scala mailbox size limit	scala
Scala AST in Scala	scala
scala - Getting a read-only sublist view of a List	scala
Parse error of nested tuples in scala	scala
Scala abstract type bounds cross referencing	scala
SharePoint - Connection String dialog box during FeatureActivated event	sharepoint
Logging in as another user in sharepoint	sharepoint
CAML query to add a ListItem in Sharepoint	sharepoint
CAML to HTML	sharepoint
Open Source SharePoint?	sharepoint
SharePoint exception documentation	sharepoint
Placing a Sharepoint Site under version control	sharepoint
SharePoint and deployment of global.asax code	sharepoint
sharepoint web services in subwebs	sharepoint
Update Item attribute in sharepoint using web services	sharepoint
Howto get SharePoint version using object model	sharepoint
SharePoint - simplest feature config to register a server control?	sharepoint
SharePoint setup best practices with ISA	sharepoint
Sharepoint: How to programmatically manage SPFolder and SPListItem permissions	sharepoint
SharePoint: How do I create a new list from a list template?	sharepoint
SharePoint WebPart Permissions	sharepoint
How to use the SharePoint MultipleLookupField control?	sharepoint
