text	label
Best practices for applying changes to a SharePoint application	sharepoint
Getting properies from SharePointWebControls	sharepoint
Microsft Enterprise Search - FAST	sharepoint
Sharepoint form layout in VB	sharepoint
Backup and Restore SSP on MOSS 2007 fails due to missing .mdf files	sharepoint
SPListItem in FormsLib does not handle blank values	sharepoint
Check permission on item in list	sharepoint
Dated reminders in sharepoint calendars	sharepoint
How to make an ASP.Net page with a C# code behind that will work in Sharepoint	sharepoint
Doing Forms With Just Windows SharePoint Services 3.0?	sharepoint
MOSS 2007: BDC permisson problem - no BDC application is listed in the web part's configuration menu	sharepoint
SharePoint user's AD group membership	sharepoint
Microsoft Dynamic CRM integration SharePoint	sharepoint
How to direct to a custom error page?	sharepoint
SharePoint and workflows	sharepoint
"SharePoint Site Design & Implementation: ""Online Manual"""	sharepoint
Getting a list of running workflows?	sharepoint
SharePoint searching external database	sharepoint
Where are SharePoint resources strings located.	sharepoint
Sharepoint: Calculated Column replace all spaces	sharepoint
SharePoint SPContext.List in a custom application page	sharepoint
SharePoint Search on default Masterpage	sharepoint
Workflow with user selecting Destination doc library	sharepoint
VSeWSS Administrator Privileges and <SafeControl> entry	sharepoint
SharePoint 2007 - SQL Query to find a list of documents in site collection	sharepoint
Is there any way to change the index of menu items in a SharePoint menu?	sharepoint
Different coloured fly out menu	sharepoint
Is it possible to aggregate information from portal list to My Site	sharepoint
display fieldname and value of sharepoint list	sharepoint
SharePoint Designer Workflow: Unruly 'Collect User Data' Action	sharepoint
Can MOSS 2007 integrate with multiple LDAP/AD stores?	sharepoint
How should I use this SetSPN command when installing SharePoint	sharepoint
Can I programaticaly replace one webpart with another in Sharepoint?	sharepoint
Tracking permissions in SharePoint	sharepoint
Sharepoint webpart and overiding the css style	sharepoint
Explorer view on a non-SharePoint page	sharepoint
Multiple copies of a Sharepoint list view	sharepoint
stsadm differential backups when directories are renamed?	sharepoint
Document is not updated after check in form Word	sharepoint
Controlling how custom field types are rendered when exported to spreadsheet	sharepoint
Web Part Feature and Reading XML File	sharepoint
How to Run a workflow on an item inserted by an anonymous user	sharepoint
Can Web Parts in Sharepoint be moved outside of edit mode using drag & drop?	sharepoint
Trouble configuring AspectJ LTW with Tomcat and Spring	spring
Spring configuration file cannot parse elements defined in my own schema	spring
How can i register a global custom editor in Spring-MVC ?	spring
How can I translate text inside controller in Spring Framework 3 ?	spring
Validation framework for business app built on Spring 2.5	spring
Example of Spring missuse	spring
How do I redirect to an ftp:// url with Spring Webflow?	spring
How to externalize a Spring MessageSources bundle outside the WAR	spring
Spring parent and child resources	spring
Autostart spring app	spring
Where do you define spring bean configuration files	spring
Reading annotation property in aspect	spring
How can I configure Spring to save as much memory as possible?	spring
Logging user agent info on login with Spring Security	spring
DAO, Spring, Hibernate, Jboss	spring
Is there a spring lazy proxy factory in Spring?	spring
incompatible types found: required: default enums in annotations	spring
jpaTamplate how to autocommit...?	spring
Using single spring application context for web app	spring
Spring Test / JUnit problem - unable to load application context	spring
Exposing multiple objects with RMI in Spring	spring
Spring - How do you set Enum keys in a Map with annotations	spring
Two approaches of task distribution in a multi tier application	spring
@Secured()      is there any statement show on log...?	spring
How to XML configure Spring bean for constructor injection when bean has varargs constructor	spring
Java Project Configuration	spring
How to use CurrentSessionContext/SpringSessionContext along with HibernateDaoSupport to intercept calls to getCurrentSession()	spring
Spring Framework Events	spring
Spring validator default message codes not resolving	spring
Spring dependency injection in construcor with annotations	spring
Spring Security 3.0- Customise basic http Authentication Dialog	spring
Null Inner Bean with Spring IoC	spring
How to perform spring validation  in multiaction controller?	spring
spring transactional cpool. Which one do I use?	spring
Can't make hibernate stop showing SQL using Spring JPA Vendor Adapter	spring
Spring to understand properties in YAML	spring
Q about AbstractApplicationContext.getBeansOfType() and getBean()	spring
Is the following utility class thread-safe?	spring
How can I access the ApplicationContext from within a JAX-WS web service?	spring
Spring Faces Javascript	spring
Is there any advantage to use spring DataAccessExceptions instead of JPA PersistenceExceptions ?	spring
Spring AOP vs AspectJ	spring
Custom spring scopes ?	spring
Spring: How to programmatically define FactoryBean	spring
Spring and hibernate.cfg.xml	spring
Getting template text from FreeMarker in Spring app	spring
Can I dynamically load additional Spring configuration files into an existing WebApplicationContext?	spring
Best Spring/Hibernate configuration for never changing tables	spring
How to Debug Spring NoSuchBeanDefinitionException	spring
Bulk inserts with Spring / Hibernate	spring
Spring Unit/Intergration Testing setup	spring
Executing a method from another class in java(and more)	spring
map url to controller	spring
Different i18n in spring according to url	spring
Problem managing session with multiple data sources	spring
Creating temporyary JMS jms topic in Spring	spring
Spring and the anemic domain model	spring
SPRING: What is AOP, Dependency Injection and Inversion Of Control in Simple English	spring
Jersey w/ Spring 3.0?	spring
Cannot get bean from flowScope	spring
[easy] SVN checkout with svn protocol	svn
Can subversion be hosted on amazon's hosted cloud?	svn
SVN Repository Search	svn
? Structuring a Revision Control System (SVN)	svn
Rearranging project after SVN checkout	svn
Checkout one file from subversion	svn
Subversion as version-incrementor at each commit?	svn
How to require commit messages in VisualSVN server?	svn
Perforce blame	svn
SVN Merge changes made on FTP into working copy	svn
SVN Doubt - VMWARE Image / Install / Hosted which would you pick?	svn
Viewing repository information from within Eclipse, when code was checked out using svn tortoise	svn
When using cvs2svn how can you rename symbols such that a branch and tag resolve to the same name?	svn
View Content of Deleted File Svn	svn
Visual SVNServer with Trac	svn
Can I keep CruiseControl.Net's ccnet.config in svn, then have CruiseControl update its own config file when a change is checked in?	svn
What is the correct way to restore a a deleted file from SVN?	svn
How do I get a list of files that have been added to the SVN since a certain date?	svn
Subversion for SourceSafe users	svn
SVN update command to target a single externals subfolder ?	svn
Moving directories in subversion	svn
Advice on setting up a server to host source code and other documents...	svn
What is the more efficient version control methodology - checkout or merge (ie Perforce vs Subversion)	svn
How to prevent svn from expanding $Id$ keyword?	svn
SVN: a versioned directory of the same name already exists	svn
SVN Weirdness: Is It Possible It's Not My Fault	svn
Easy way to embed svn revision number in page in PHP?	svn
"How do I do ""svn st"" in AnkhSVN for Visual Studio? -no text-"	svn
What is the best way to make files live using subversion on a production server?	svn
LocationMatch and DAV svn	svn
"Eclipse ""Share Project"" by hand?"	svn
Revert a whole directory in tortoise svn?	svn
How to make a private branch of public SVN repository?	svn
how to update a file in svn?	svn
Subclipse svn:ignore	svn
How to use svn with emacs (psvn can't create tunnel)	svn
Access denied  Tortoise SVN 64 bits	svn
Using svnversion with svn:keywords	svn
subversion merge a delete command	svn
Problems commiting file to SVN repository	svn
What is the limit of source repositories in Visual Source Safe 2005	svn
Setting up SVN to Best Suit Dev -> QA -> Prod	svn
How can I enforce a reviewers name being entered into SVN log	svn
Best source control package	svn
subversion cherry picking	svn
WAMP - PHP shell_exec() problem	svn
How can you overcome the svn 'out of date' error?	svn
Best way to let third-parties work on your site	svn
What's the least painful way to transfer local Subversion changes to another machine?	svn
Is it possible to get a list of added or deleted files from subversion?	svn
SVN Server running on Windows Vista in a Home Network, Accessing from Mac OS X	svn
svn ignore without deleting files?	svn
shared components throughout all projects, is there a better alternative than svn:externals?	svn
Using Git in a Company?	svn
Creating symbolic links to branches in SVN?	svn
One SVN repository or many?	svn
Use SVN instead of CVS on SourceForge	svn
How to export a part of SVN repository with dependencies?	svn
Managed Source Control Hosting and Continuous Integration with CVSDude and CruiseControl.net	svn
SVN automatic code formatting on check in?	svn
Debugging with command-line parameters in Visual Studio.	visual-studio
Mixing Visual Studio versions OK?	visual-studio
How to order variables alphabetically (Visual Studio 2008)	visual-studio
How can I clear the Warnings sections of the error list In VS2008?	visual-studio
Resources for building a Visual Studio plug-in?	visual-studio
What Visual Studio add-ins do you use?	visual-studio
How to quickly organize functions in source code (c#) to order by alpabetical order?	visual-studio
Visual Studio Express any good ?	visual-studio
DLL versions and Visual Studio attach to process	visual-studio
How to setup non-admin development in Visual Studio 2005 and 2003	visual-studio
How do you default a new class to public when creating it in Visual Studio?	visual-studio
"Per-filetype ""View whitespace"" setting in Visual Studio"	visual-studio
"How to ""watch"" character values of a string on Visual Studio?"	visual-studio
Help documenting Javascript in Visual Studio?	visual-studio
Visual Studio - tips for managing work on many open files	visual-studio
Why does Visual Studio 2005/2008 keep 'forgetting' to color code and format?	visual-studio
Embedding non-edit widgets in a DataGridView	visual-studio
How do I get rid of the unknown property name errors in Visual Studio?	visual-studio
How do I get output to show up in the Messages pane of the Error List for Visual Studio 2005?	visual-studio
How to put BIDS solutions under source control?	visual-studio
Visual Studio won't make debug DLL	visual-studio
MRU list in Visual studio is missing	visual-studio
"What are the various ""Build action"" settings in VS.NET project properties and what do they do?"	visual-studio
visual studio 2008 - is hand coding ~80% of the time too much?	visual-studio
Creating mdf file from sql script	visual-studio
How do I get the assembler output from a C file in VS2005	visual-studio
API/Framework to generate Visual Studio solutions/projects	visual-studio
Connect Visual Studio 2008 to Virtual PC 2007	visual-studio
Tools for inspecting .lib files?	visual-studio
Is there a Visual Studio plugin for sorting build output (scrambled from multi-threaded builds)?	visual-studio
Using VS 2005 to design abstract forms	visual-studio
How can I point Visual Studio 2008 to a new path for projects?	visual-studio
Useful Add-In's or Plug-In's for native Visual Studio developer	visual-studio
Setting both Debug and Release settings in Visual C++ 2008	visual-studio
How to profile methods in dependent assemblies in a unit test instrumentation performance session?	visual-studio
Are there any Jira plugins for Visual Studio?	visual-studio
"Enable/Disable ""Step into"" debugging on certain project in visual studio solution"	visual-studio
Smart tool (addin?) for creating class body from header file	visual-studio
What do you do about references when unloading a project in Visual Studio?	visual-studio
Getting Visual Studio to ignore source control bindings in a solution	visual-studio
Displaying Japanese fonts in source code using Visual Studio	visual-studio
Ability to set the font to italics in Visual Studio	visual-studio
Where is the 'Autos' view in msdev 2005 ?	visual-studio
"How can I use the ""Publish"" function in Visual Studio 2008 without erasing the contents of the target folder?"	visual-studio
Create SQL Database and add to project using Visual Studio	visual-studio
"Any way to do Visual Studio ""project only"" build from command line?"	visual-studio
How do I write a custom start page for VS 2008?	visual-studio
Visual Studio Context Menu Shortcut	visual-studio
Can you print JavaScript variables from a Visual Studio 2008 Tracepoint?	visual-studio
What do you use to develop for PowerShell?	visual-studio
"Visual Studio 2008 ""randomly"" hangs on test run"	visual-studio
[Visual Studio 2003] Setting environment variables in pre-build event and using in compilation step	visual-studio
Can I compile legacy MFC applications with Visual Studio 2008 ?	visual-studio
Can Visual Studio 2010 Beta be installed side by side with VS2008?	visual-studio
A project with output type of class library cannot be started directly - with a startup exe	visual-studio
Loads of extra space at bottom of class in Visual Studio 2008 C# Express	visual-studio
How can I customize the syntax highlighting in Visual Studio 2005?	visual-studio
Contextual code generation in Visual C# 2008?	visual-studio
Visual Studio color settings for better eye	visual-studio
How to make document tabs in Visual Studio 2008 appear in left-to-right order, just as it was in earlier VS?	visual-studio
What is your workflow for creating websites based on WordPress?	wordpress
wordpress: actions, filters & hooks	wordpress
Filtering Custom Fields in Wordpress Plugin Dev	wordpress
How can I determine a first-time hit in Wordpress?	wordpress
Wordpress homepage problem	wordpress
trying to find the comment hook I need for wordpress?	wordpress
How Does WordPress Block Search Engines?	wordpress
How can I remove jquery from the frontside of my WordPress?	wordpress
Wordpress retrievig Post children	wordpress
Strategy in the design and coding of wordpress themes?	wordpress
wordpress: how to get x youtube thumbnails of my youtube account ?	wordpress
How can I work with paragraphs in Wordpress?	wordpress
Custom post metabox with upload file button	wordpress
Get WordPress Post ID from Post title	wordpress
Which additional securities do you add to your open source cms installations?	wordpress
Why aren't jQuery and cycle working in Wordpress?	wordpress
Is it possible to register a user and submit a comment with one form with Wordpress?	wordpress
Use post tags for meta keyword content	wordpress
How do I order subpages within my static ones in Wordpress.org 2.8.4 ?	wordpress
P tag is not displayed in html editor for Wordpress	wordpress
"WordPress > Calling ""Recent Posts"" widget via script from custom theme"	wordpress
wordpress: add the categories to a post rss title	wordpress
Change wordpress navbar to link straight to post or page	wordpress
Wordpress get_post_meta	wordpress
using static wordpress login form on front page but links to another wp install?	wordpress
retrieve only sub-pages (wordpress)	wordpress
Wordpress Page order	wordpress
Wordpress Content Box not formatting correctly.	wordpress
Issues with 404 pages when inserting posts and changing permalink to /%postname%/	wordpress
Password Protected Wordpress MU	wordpress
Plugin to avoid share username in Wordpress	wordpress
Wordpress post sync / publish to production	wordpress
Wordpress dynamic reply to comment not working	wordpress
How can I pass variables from a form within the Wordpress platform?	wordpress
Possible Wordpress URL rewriting issue	wordpress
WordPress get count of posts without using get_posts()?	wordpress
creating rss.xml file for wordpress posts...	wordpress
Wordpress OR Joomla?	wordpress
How can I make custom Wordpress comments form?	wordpress
Wordpress plugin for enhanced WYSIWYG image resizing?	wordpress
Wordpress theme not displaying when activated on production server, but will display on development environment	wordpress
insert in the head tag after wp_head	wordpress
WordPress: Image In Every Post	wordpress
Getting WP Functions to Return rather than Printing Immediately	wordpress
Wordpress permalinks problem	wordpress
WordPress theme blog not displaying well in FireFox-how to fix?	wordpress
Generic Category Sidebar in Carrington Wordpress Theme Framework	wordpress
Redirecting Wordpress's Login/Register page to a custom login/registration page	wordpress
Codeigniter In Wordpress Page	wordpress
Wordpress - Get name of Category a post belongs to?	wordpress
"Wordpress, when using the ""comment_text"" action is it possible to get commenter information?"	wordpress
Differentiating between P tags wrapping images and P tags wrapping text nodes in Wordpress?	wordpress
Show Attached Image to Post on Wordpress	wordpress
Wordpress Admin Plugin	wordpress
using the search box causes get_posts() malfunction	wordpress
Show Only Pings (Pingbacks+Trackbacks) Number on Wordpress	wordpress
i inserted a search field into wordpress and it wont show.	wordpress
Overwriting a core Wordpress function - should work but it doesn't	wordpress
Center block element in element	wordpress
Wordpress: Find posts in category 1 and not in category 2	wordpress
