text	label
Ajax update panel problem !!	ajax
Get result of a JS file directly? (sorta AJAX related)	ajax
Make web application with ajax from the begining or add ajax later?	ajax
Handle www-authentication request using ajax?	ajax
POST versus Ajax call	ajax
IE7 onSubmit return false in function may fail?	ajax
Newbie: What does jQuery.ajaxSetup 'beforeSend' do?	ajax
w3schools AJAX example	ajax
MaskedEdit Extender lost data on postback	ajax
Ajax won't get past readyState 1, why?	ajax
AJAX boardgame runs fine in Windows, but not in Linux - PROGRAMMING QUESTION	ajax
Ajax jquery success scope	ajax
AJAX browser-dependent limit on length of data sent? (SAJAX)	ajax
Favorites star switching in Javascript	ajax
Is there a list of AJAX JSF Libraries available?	ajax
Access denied problem in AJAX	ajax
Changing a user created control based on content of input from JS tied textbox	ajax
"Ajax Asynchronous in IE - Error ""The Data Necessary to Complete This Operation is Not Yet Available"""	ajax
jQuery and AJAX	ajax
ajax :populating 2 drop down boxes via ajax using value of the third one	ajax
How do I make Ajax calls at intervals without overlap?	ajax
web toolkit that does all of this?	ajax
Should I bring HTML snippets or JSON?	ajax
How can i get around the same origin policy?	ajax
AJAX page + SQL query behaving vaguely ?!	ajax
Ajax File download Issue	ajax
Scriptaculous Ajax.InPlaceEditor: How to trigger cancel action?	ajax
JQuery AJAX syntax	ajax
Best way to implement realtime UI updates like SO's 'new answer' notifier?	ajax
IE hungs when more than 4 async requests are triggered with xmlhttprequest object	ajax
IE not updating display after callpback pane updates the DOM	ajax
ajax jquery - why this extra slash?	ajax
Reading Image from AJAX response	ajax
ScriptResource.axd requests return HTTP 302	ajax
AJAX popup causes screen to re-load using ASP.Net	ajax
AJAX table update script	ajax
Exception thrown in a referenced .dll how do I debug?	ajax
Create editable new rows to a table	ajax
Jquery ajax getting the XMLHttpRequest  state	ajax
Ajax breaks frameset in IE only	ajax
AJAX progress bar dispaying loading progress percentage for page load	ajax
Is there ANY way to suppress the browser's login prompt on 401 response when using XmlHttpRequest	ajax
ASP.NET Ajax script registration	ajax
JQuery AJAX Web Service call on SSL WebServer	ajax
how to get a js png fix to work on ajax calls	ajax
Ajax onSuccess callback while not having any control over ajax calls	ajax
Rendering HTML Content from AJAX result	ajax
How often should a web chat client check for updates?	ajax
AJAX Library Strategies	ajax
AJAX checker script, problem with redirect	ajax
GUI Toolkit for ASP.net	ajax
Ajax request parametors, what am I doign wrong?	ajax
AJAX Function to populate a field in a form?	ajax
Wtf IE7 - AJAX calls using setTimeout	ajax
What would be the best place to start learning AJAX (I have Perl as a backend)	ajax
Cannot do response.redirect from page with Ajax controls	ajax
can I update a label using ajax, instead of a textbox?	ajax
googlemap-like drag and zoom	ajax
Library for browser based outliner	ajax
Problem with IE8 using AJAX	ajax
jquery form plugin & programmatic submit	ajax
What's a good book for learning Ajax?	ajax
AJAX and prediction of actions.	ajax
JQGrid url action not firing when using Ajax.BeginForm	ajax
How to keep database connect alive?	ajax
Making Browser Back button work while using AJAX requests	ajax
XMLHttpRequest vs Socket vs ?	ajax
How to send js array via ajax?	ajax
AJAX and callback function	ajax
Online dictionary - should I use AJAX for the search results?	ajax
web service being called twice with jquery ajax function	ajax
What are the options available for cross platform rich user interfaces development?	ajax
"Ajax: Partial refresh of a parent page (update a div) from ""lightbox"" window"	ajax
Loop doesnt work without alert() in ajax readystate()	ajax
Submit multiple value when using Ajax.Request and Starbox	ajax
best practice for loading necessary JSON data: jquery's $(document).ready() hook? in the <HEAD> of page?	ajax
Response.redirect does not work with Ajax controls	ajax
"Ajax POST method converts my ""+"" value in a string  to "" "" why?"	ajax
AJAX slowdown because of virus scanners or active network filtering?	ajax
What is the difference between request by form submit and request by ajax?	ajax
Ajax: Load XML from different domain?	ajax
How to iterate headers of sys.net.webrequest (ajax)	ajax
Multiple responses from one AJAX request	ajax
Rails: submit (via AJAX) when drop-down option clicked	ajax
Returning value from AJAX request in a global variable	ajax
Best practices for handling a web service failure	ajax
ASP.net AJAX Control Toolkit will not recognise my specified css classes in the autocomlete extender?	ajax
Is there a super-high-load (Ajax) chat script out there?	ajax
Ajax and record ID's	ajax
Ajax Assembly Error - Assembly {0} does not contain a Web resource with name {1}	ajax
AJAX load of a rendered PNG not working	ajax
How to avoid calling a ajax method more than once?	ajax
how to use ajax datepicker in vb.net 2.0	ajax
"Did you try Doloto ""AJAX application optimization tool"" ? have any comments/concerns about?"	ajax
Upload File Directly to S3 with Progress Bar	ajax
Browser continues 'loading' after ajax request finishes.	ajax
does ssl also encypt ajax posts?	ajax
View more link should display next 3 records instead of displaying new page	ajax
How to implement a AJAX function in PHP ?	ajax
What comparable Javascript function can reference a file like PHP's include()?	ajax
How do I bind an ASP.net ajax AccordionPane to an XMLDatasource?	ajax
HTML/Javascript app that runs on the filesystem, security issue	ajax
Upload and Crop image	ajax
AJAX requests Synchronous Vs Asynchronous	ajax
Differentiating Between an AJAX Call / Browser Request	ajax
How can I check my AJAX for browser capable?	ajax
Best tools for AJAX	ajax
How to manipulate ajax loaded content?	ajax
Ajax & Forms Question (Looking for Resources)	ajax
using ajax update panel for update progress	ajax
javascript or php - what is most efficient for updating?	ajax
Deep Zoom in Ajax - Possible? Any examples out there?	ajax
How to return javascript variable to Ajax?	ajax
Ajax ReordeList and asp:FileUpload Problem	ajax
jquery tab gives 404 sometimes when loading remote content	ajax
What is the best way to bind a repeater to an AJAX response?	ajax
set Request Header in javascript	ajax
Send HTML through Ajax POST	ajax
Ajax: Definition vs Implementation?	ajax
paging with ajax and asp.net mvc	ajax
UpdatePanel where Button Event does not fire.	ajax
How do i submit an ajax request before the page is loaded	ajax
How can I setcookies in php server side with ajax and read cookies in the real time with ajax or javascript?	ajax
AJAX chat, auto scroll window	ajax
Best way to use jQuery's .ajax() function retrieve variables from a php script?	ajax
"Implementing a text slider or ""slideshow"" with AJAX or JQuery"	ajax
jquery script is using to much memory	ajax
Javascript if(function_foo()) doesn't wait for function_foo() to complete	ajax
Problem with textbox inside updatepanel - not causing OnTextChanged event	ajax
Is it possible to recreate IKEA's functionality using Ajax?	ajax
What are the (technical) pros and cons of Flash vs AJAX/JS?	ajax
Does the iPhone has AJAX and jQuery support?	ajax
Preventing ajax-jquery loaded external file from caching in IE	ajax
Dangers of Ajax	ajax
AJAX Testing Tools	ajax
how do you screen scrape ajax pages ?	ajax
Problem with cakePhp and nested ajax form in firefox 3.5	ajax
how to scroll asp.net textbox to bottom	ajax
Using Google Table inside jqueryui ajax tab	ajax
javascript, html and browsing, is there an easy solution?	ajax
How to make all connected browsers reload initiated by a server-side event	ajax
MS Ajax Toolkit now on backburner?	ajax
AJAX (prototype/php) getting partial status updates during script execution	ajax
Default radio button not triggering an UpdateControl postback	ajax
$.ajax() methods data	ajax
Code separation in AJAX applications	ajax
How to pass HTTP AUTH values via prototype Ajax.Request()?	ajax
Using Yes/No Messagebox in Updatepanel AJAX.	ajax
Can AJAX calling a external webservices functions	ajax
SQL query in tables side by side instead of one long table	ajax
ajax and codeigniter duplicating header	ajax
How to notify my JS client without polling?	ajax
Some Paramters in $.ajax not passing	ajax
What is the simplest way to allow a user to drag and drop table rows in order to change their order?	ajax
Refresh Using Ajax/PHP	ajax
Which Javascript Ajax Framework is most powerful and very lightweight?	ajax
Customizing an AJAX AutoCompleteExtender with a checkbox	ajax
Open Ajax Issue	ajax
Dealing with incremental server response in AJAX (in JavaScript)	ajax
Disabling interstitial graphic when using cfdiv binding	ajax
IE doesn't wait for result of $.post(	ajax
How to Force Javascript to Execute within HTML Response to Ajax Request	ajax
How do I send a cross-domain POST request via JavaScript?	ajax
How important do you think Progressive Enhancement is?	ajax
Exception handling in Ajax Calls.	ajax
dynimically created DOM can't hold up in cache	ajax
how to set time in ajex slider control?	ajax
Getting wordpress to play nice with AJAX	ajax
deleting mysql records with ajax	ajax
Set timeout on jQuery .load	ajax
Twitter notification ajax bar, how did they do it?	ajax
Timeout setting of different browsers?	ajax
AJAX refresh script	ajax
ajax - getting seperate lines of data	ajax
ajax success event not working	ajax
Can entire page be developed out of ajax in asp.net 3.5?	ajax
"how do widgets like ""http://sharethis.com/"" make what seem to be XSS calls"	ajax
AJAX Call to PHP script gives me 500 Internal Server Error??	ajax
JQuery AjaxUpload and PHP Max File Size Issue	ajax
"Is it possible to send custom headers with an XHR (""Ajax"" request)?"	ajax
How to set up virtual hosts properly on a windows machine using Zend Community CE ?	apache
How to password protect files (images, video, zip) dynamically from public and allow access to members only?	apache
Should mod_proxy_ajp or mod_jk be used for a production environment?	apache
Can't get Xdebug to work on Windows 7	apache
Passing CGI arguments to an executable in Apache on Windows	apache
Subdomain read domain session	apache
FastCGI cleanup code does not work under windows	apache
My cgi script can't write to cgi-bin folder of Apache	apache
Apache: Deploying a new site to the server	apache
What is CGI and what are CGI Scripts?	apache
increasing ServerLimit & MaxClients on Apache	apache
Invoking Wine From Apache	apache
Make Apache wait longer before delivering HTTP 408 request timeout	apache
Need help with Apache Rewrite issues	apache
Map virtual directory to another web server in apache	apache
How do I conditionally add a line to Apache  .htaccess based on the domain?	apache
mod_rewrite depends on what other modules?	apache
Redirection to different port for different sub domain failed	apache
"is this true? ""Gzipped items will not have the same etags (even if the content did not change)"""	apache
Dynamic DNS on your own server	apache
How do I change which version of python mod_python uses	apache
add a server alias to the domain's VHOST?	apache
How to convert Apache .htaccess files into Lighttpd rules?	apache
Apache/Tomcat site nesting	apache
Can I use resources licenced under the Apache Public License in my commercial app?	apache
Long-lived connections (asynchronous server push) with Apache/PHP/Javascript?	apache
Self-extracting web environment	apache
using BOSH/similar technique for existing application/system	apache
htaccess rewrite	apache
can abybody explain the structure of apache server.......	apache
Apache log analyzer which outputs user flows	apache
I want to host my own home web server. I installed Apache already but I can't log in other computers	apache
Why do I have to copy the libmysql.dll to the apache/bin directory to get the PHP extension to load properly?	apache
How to hide distributed servers under a single domain?	apache
Apache RewriteRule not working without Page # specified.	apache
How to password control access to all urls except one in apache 2	apache
Apache: multiple ../ in query string = internal server error (error 500)	apache
Permissions to PHP session files	apache
Is there a way to force traffic comin from www.abc.com to go to abc.com via htaccess or dns?	apache
Setting expires header for a specific URI?	apache
What is Apache process model?	apache
Apache with mod_dav_svn starts to consume a lot of memory	apache
Moveable type images not displayed	apache
mod_rewrite Rule to Cover All Domains	apache
Compressing HTTP request with LWP, Apache, and mod_deflate	apache
It there a framework for running unit tests on Apache C modules?	apache
Apache mod rewrite simple redirect	apache
HOWTO transfer a request made to an Apache server to an IIS server without using a URL redirect?	apache
Bandwidth throttling for Apache<2.2 on Windows (mod_throttle?)	apache
"Direct ""puts"" in Rails, to Apache log"	apache
Rewriting query string using mod_rewrite	apache
What does Apache need to support both mysqli and PDO?	apache
Apache CGI redirect to absolute URI doesn't work	apache
Setting the umask of the Apache user	apache
How to benchmark apache with delays?	apache
Redirect 404 to another domain with apache?	apache
User getting default Apache page instead of website - Safari/FF?	apache
defer processing during apache page render	apache
What's a good library to manipulate Apache2 config files?	apache
Apache mod_rewrite and PHP ?argument=something	apache
htaccess mod_deflate does not work on shared server	apache
Do I need to send a 404?	apache
System.Net.WebClient request gets 403 Forbidden but browsers do not with Apache servers	apache
cakephp & httpd.conf issues on windows based apache server (wamp)	apache
APACHE-TOMCAT can anybody elaborate which one is web-server and web-container?	apache
How to serve PHP dynamic images efficiently on a LAMP server?	apache
XAMPP and WAMP in the LAMP, whats the best ?	apache
How to encode special characters using mod_rewrite & Apache?	apache
Redirect subdomain to /folder	apache
500 error when trying to add expires header to .htaccess	apache
URL Segment Support macosx 10.6	apache
Apache module FORM handling in C	apache
Apache Config - Exclude Subdirectories	apache
Restrict access using SSL certs	apache
suPHP upgrade causing 500 internal server error	apache
Apache mod_rewrite: redirecting subdomains to the HTTPS login page	apache
(Apache) Possible to match UTF8 characters in rewrite rules?	apache
Unexpected Connection Reset: A PHP or an Apache issue?	apache
Apache url rewrite problem	apache
Can I serve a ClickOnce application with Apache?	apache
Location of web app on my server and Apache.	apache
RewriteRule for mapping x.domain.com to y.domain.com	apache
What setting might be causing an AMP server to only allow 1 request at a time per browser?	apache
Apache Rewrite does not redirect	apache
How to access images on a directory outside of the web application	apache
ZendFrameworks not working nice with RewriteRule	apache
Apache/Tomcat error - wrong pages being delivered	apache
mod_rewrite not working as internal proxy	apache
Internal Server Error	apache
Digester: Extracting node name	apache
Apache, PHP and MySQL portable?	apache
Apache / htaccess rewrite - From domain to subdomain	apache
[Apache] RewriteRule removing trailing dot.	apache
how to handle PermGen space exception in Apache	apache
Rewrite rule-- If incoming request is not consist of certain characters then rewrite to other URL	apache
Applying mod_rewrite rules AFTER DirectoryIndex is applied	apache
finding apache build options	apache
Virtual Host points to another Virtual Host - Urgent!	apache
Why are my file permissions on Apache being reset?	apache
Implementing Tiny MCE As Local HTML Editor	apache
How URL rewriting work?	apache
Apahe configuration with virtual hosts and SSL on a local network	apache
mod_jk on windows 64 bit	apache
What access does Apache 2.0 need in Windows Server 2003 in order to start as a service?	apache
Using mod_rails to host multiple apps under SSL, same domain	apache
Apache RequestHeaders for Software-As-a-Service under Rails	apache
Why browsers sometimes render site bad?	apache
How to allow only certain files in Apache	apache
Error while loading FastCGI module in apache 2.2	apache
Is there a way to encode a URL in velocity template	apache
The Current State Of Serving a PHP 5.x App on the Apache, LightTPD & Nginx Web Servers?	apache
using apache location directive to list folders from trac	apache
Proxy choices: mod_proxy_balancer, nginx + proxy balancer, haproxy?	apache
How to set REMOTE_ADDR in apache before php is invoked	apache
How to turn off optimization (-02) for apache modules built with APXS	apache
"Apache is incorrectly converting jsp pages to ""text/plain"""	apache
Apache URL Redirect	apache
Are these lines an error or info in Apache's error log?	apache
With Apache/mod_wsgi how can I redirect to ssl and require Auth?	apache
Help making my root directory not executable for CGI scripts	apache
.htaccess and seo-friendly urls	apache
A general linux rights question: Apache and WordPress	apache
internally redirecting to another file in Apache	apache
Self-referential URLs	apache
Apache rewrite based on subdomain	apache
Using mod_rewrite with mod_vhost_alias	apache
Difference in website display depending on domain	apache
Restrict Apache to only allow access using SSL for some directories	apache
Proxy URL without authentication	apache
Apache/nginx fine grained (per file) permissions?	apache
Internal redirects after using Apache's mod_rewrite	apache
Using Apache proxy to foward traffic to tinyproxy	apache
Hide directories from listing, but don't disable directory listings.	apache
Whats the best way to get multiple instances of an application to run in Apache Tomcat?	apache
how to achieve this in Apache?	apache
How can I deny all but one directory name with .htaccess?	apache
How do I generate an SSL Certificate with Microsoft Certificate Services and then install / configure it to work with Apache?	apache
How do I configure Apache to forward some URLs to my servlet container regardless if the file exists.	apache
How do I fix this apache error log issue? Mod Deflate	apache
Apache automatically restarting itself every couple of requests	apache
Apache and IIS side by side (both listening on port 80) on windows2003	apache
Apache LogFormat IP Address	apache
apache on windows virtual directory config help	apache
Parse the HTTP_COOKIES string from Apache for use in #if clause	apache
Apache capacity planning tool?	apache
mod_rewrite: setting GET depending on HTTP_HOST	apache
Mask redirect to temporary domain with mod_rewrite	apache
URL Rewrite Apache locating files	apache
How do you redirect https to http	apache
How can I setup Apache to serve SVN with this particular URL configuration?	apache
How to track down CPU intensive requests	apache
Sub second request time logging	apache
Apache mod_deflate based on url parameters	apache
Communicate to Apache Server	apache
Configuring Apache Web Server with Tomcat	apache
How do I ignore a directory in mod_rewrite?	apache
Apache on WIndows - growing VM Size of httpd.exe	apache
Set up Apache for local development/testing?	apache
web page finish loading before all images is completed	apache
Apache .htaccess hotlinking redirect	apache
How to keep URL display unchanged after redirecting root folder to sub folder	apache
RewriteRule checking file in rewriten file path exists.	apache
RewriteRule in .htaccess not working	apache
Blocking specific extensions in htaccess	apache
Apache and mod_rewrite: Redirect domain to subdirectory	apache
Apache Rewrite Rule Regex Problem	apache
Why won't my local Apache open html pages?	apache
Apache reverse proxy set up secure certificate	apache
Using relative URLs with mod_rewrite	apache
Differences between stock Apache on OS X 10.5 Leopard and OS X 10.5 Leopard Server?	apache
Redirecting a Directory to a Script on Apache	apache
Apache lags when responding to gzipped requests	apache
url_rewrite /#/something/here to /something/here	apache
"What is the cause and how to fix 503 errors with this in Apache error_log: ""Broken pipe: ajp_ilink_send(): send failed"""	apache
Link to download apache http server  source for windows	apache
Apache+Tomcat6+Struts2 redirect problem	apache
CodeIgniter Backend Frontend .htaccess router	apache
adsense iframes create new sessions on my server	apache
Mixing RewriteRule and ProxyPass in Apache	apache
"what is the real version for ""Apache/2.0.63 (Unix)"" in a HTTP response header?"	apache
"Using linux ""cut"" with stdin"	bash
Mutable list or array structure in Bash? How can I easily append to it?	bash
ls Return Values	bash
How to copy a file to multiple directories using the gnu cp command	bash
Auto confirm EULA in bash script	bash
Preserve ls colouring after grep'ing	bash
Notify upon background jobs finishing running in bash	bash
How can grep interpret literally a string that contains an asterisk and is fed to grep through a variable?	bash
awk without printing newline	bash
BASH: Assign '&' to variable NOT as string	bash
To understand Typeset for PythonPath	bash
Problems using git diff to create file list for deploy	bash
Bash input/output in C++	bash
Display characters of a variable	bash
How to tell if a sting is not defined in a bash shell script?	bash
UNIX commands that support colours	bash
How do you use Binary conversion in Python/Bash/AWK?	bash
split svnversion output in bash	bash
Technique to compute next day's date from a date supplied via an arg?	bash
Replace output in a loop in bash scripting	bash
"matching a line with a literal asterisk ""*"" in grep"	bash
remove whitespace from bash variable	bash
Why do processes spawned by cron end up defunct?	bash
How do I delete a bash function?	bash
How can I select random files from a directory in bash?	bash
What does ${2:-${1}} mean in Bash?	bash
bash scripting..copying files without overwriting	bash
How to verfiy information using standard linux/unix filters?	bash
What should a longtime Windows user know when starting to use Linux?	bash
Bash: Delete until a specific file	bash
List all leaf subdirectories in linux	bash
Use a cat + grep as an included source in bash	bash
pipelines vs for	bash
How do you use shell script variables as arguments to sed?	bash
"Grep with ""half""-exact match"	bash
A script to ssh into a remote folder and check all files?	bash
How do you append to an already existing string?	bash
Reading java .properties file from bash	bash
using find with exec	bash
autoconf using sh, I need SHELL=BASH, how do I force autoconf to use bash?	bash
How to process file names with variables from a list in a file in Bash	bash
basics of using cut awk grep and sed...	bash
How can I suppress the output due to a SIGSEGV or a SIGFPE in a Fortran 90 program?	bash
Bash or Python or Awk to match and modify files	bash
Access a variable in a bash script	bash
With bash, how can I pipe standard error into another process?	bash
BASH : List files by last edited date?	bash
See binary instead of hex in Binary file while in a shell like bash.	bash
bash history re-runs: possible command to avoid using !bang! ?	bash
Ending tail -f started in a shell script	bash
Bash: add value to array without specifying a key	bash
FTP not uploading last 4 bytes	bash
How to iterate over arguments in bash script	bash
Issue with echo and tab in Bash	bash
Bash Scripting - no output, no echo	bash
Can I specify redirects and pipes in variables?	bash
command line connect to tcp port, read data, match pattern, print true or false	bash
Count number of occurences of token in a file	bash
How can I remove the first line of a text file using bash/sed script	bash
How do I include parameters in a bash alias?	bash
How to properly make path handling robust in a bash program?	bash
how to chop last n bytes of a sting in bash string choping?	bash
bash errors in this script ?	bash
Using the result of a command as an argument in bash?	bash
echo in a bash script changing '--md5' to '?-md5'	bash
What are some of your favorite little known command-line tricks using Bash?	bash
creating a file downloading script with checksum verification	bash
Functionality in .profile (login script) versus distributing to other scripts.	bash
awk my number, im supid in bash	bash
Bash Script on a Mac creates a info popup	bash
Boolean Expressions in Shell Scripts	bash
How to run processes piped with bash on multiple cores?	bash
Bash: space in variable value later used as parameter	bash
Timing a Curl Operation in Bash	bash
Encoding Keyboard Command Onto Bash Script	bash
Transpose a file in bash	bash
"Bash Scripting "" [!: not found "" errors, and how to write an or statement"	bash
What are replacement and new practices from sh to Bash?	bash
How can I program ksh93 to use bash autocompletion?	bash
Copying a Directory Tree File by File	bash
how to base64 encode /dev/random or /dev/urandom?	bash
Bash script for manual routes and default gateway problem	bash
is bash getopts function destructive to the command-line options?	bash
Easiest way to extract the urls from an html page using sed or awk only.	bash
a sufficant way to show logs in a graphical interface using whiptail bash	bash
Bash shell function error : command not found	bash
Parse a dhcpd.lease File with Bash	bash
Check if a program exists from a bash script.	bash
Unable to have a tab completion of system variables without a backward flash	bash
How to glob variables in bash script	bash
How to get all matches from regex?	bash
Perform OR on two hash outputs of sha1sum.	bash
Appened to /etc/apt/sources.list	bash
Unix commandline history substitution ^foo^bar (for multiple replacements)	bash
Check if a string contain Asterisk (*)	bash
Concatenate strings in bash	bash
Extraction of data from a simple XML file	bash
