text	label
roll a dice for me	roll_dice
i want you to roll a 5 sided dice for me	roll_dice
ai throw the dice on the table	roll_dice
roll a seven sided dice for me	roll_dice
when you roll a six sided dice what is the results	roll_dice
please roll the 5 sided dice	roll_dice
will you roll a 2 sided dice	roll_dice
6 sided dice roll	roll_dice
roll dice please	roll_dice
could you roll the dice please	roll_dice
roll a 6 sided die	roll_dice
please roll twelve sided dice	roll_dice
roll a die with 6 sides please	roll_dice
ai, please roll the dice	roll_dice
roll the die!	roll_dice
i just acquired a new job but i need help with my 401k rollover	rollover_401k
i need help with my 401k rollver since i got a new job	rollover_401k
do you know if my 401k is able to be rolled over	rollover_401k
what do i do to rollover my 401k	rollover_401k
what do i have to do to transfer my 401k	rollover_401k
i have a new job and need direction with my 401k rollover	rollover_401k
can you help me with my 401k rollover since i got a new job	rollover_401k
help me to roll over my 401k	rollover_401k
now that i have a new job, i need getting my 401k rolled over	rollover_401k
what are the steps to rollover my 401k	rollover_401k
i want to rollover my 401k	rollover_401k
can you tell me how to transfer my 401k	rollover_401k
will my 401k carryover or not	rollover_401k
i need a 401k rolled over to my brand new job	rollover_401k
i switched companies and need to rollover my 401k	rollover_401k
i just found a better job and need to move my 401k over to my new employer	rollover_401k
tell me how to get my 401k rolled over	rollover_401k
i need assistance figuring out how to rollover my 401k	rollover_401k
how do i transfer my 401k to a new firm	rollover_401k
explain to me how to rollover my 401k	rollover_401k
i have just switched jobs and need assistance with my 401k rollover	rollover_401k
can you explain to me how to rollover my 401k	rollover_401k
i need your assistance on transfering my 401k	rollover_401k
i jot got hired and need help with my retirement account	rollover_401k
i have a new job, help me with my 401k rollover	rollover_401k
rollover my 401k assistance	rollover_401k
i need some help with transferring my 401k, can you help	rollover_401k
i need your assistance on rolling over my 401k	rollover_401k
my 401k, can i roll it over	rollover_401k
i got a new job, can you help me with my 401k rollover	rollover_401k
how do i rollover my 401k after i got a new job	rollover_401k
i want to figure out how to rollover my 401k	rollover_401k
i just got a new job and need help transferring my 401k	rollover_401k
i have to get my 401k rollover because i just got a new job	rollover_401k
rolling over my 401k help	rollover_401k
what are the steps for transferring my 401k	rollover_401k
for my westport account, what is the routing number	routing
what is the location that td bank has their routing number listed	routing
let me know my routing number	routing
i need to know chase banks routing #	routing
can you help me find the routing number	routing
where can i locate the routing number for the bank i bank with	routing
show me the routing number for chase	routing
will you tell me my routing number	routing
what is the routing number of my checking account at first national bankj	routing
i must learn my routing number	routing
what is the correct routing number for my citizens bank account, pennsylvania	routing
what's my bank routing number	routing
where do i go if i am seeking the routing number of dallas capital	routing
where do i find my routing number for my pnc account	routing
where do i find the routing number for sunflower bank	routing
where do i find the routing number for great western bank	routing
i need the routing number to my chase checking account	routing
do you know where i can find my suntrust routing number	routing
where can i find wells fargo's routing number	routing
what is the routing number for my wells fargo account	routing
what is my routing number for home federal account	routing
how can i find my routing number for el dorado	routing
does pnc have a routing number	routing
i wanna know my bank of america routing number	routing
what's the routing number for my current checking	routing
tell me the routing number for my wf account	routing
what's the routing number for my money market account	routing
how do i locate my routing number for tax reasons	routing
i need my routing number	routing
can i get the routing number for sunflower bank	routing
what's the routing number for my navy federal account	routing
tell me what my savings account routing number is	routing
show me my routing number for account finishing in 29309	routing
what's the routing number for my savings account	routing
where's the routing number for wells fargo	routing
please find my routing number for my citizens' bank account	routing
i should get my tires checked, schedule that	schedule_maintenance
i need to find someone to look at my check engine light	schedule_maintenance
i gotta schedule some car maintenance	schedule_maintenance
look for auto companies that do scheduled maintenance on my vehicle	schedule_maintenance
i need to get my tires checked out somewhere	schedule_maintenance
schedule an oil change for me	schedule_maintenance
i'd like to schedule a tire inspection	schedule_maintenance
find a mechanic to look at my check engine light	schedule_maintenance
can someone look at my car cause the check engine light is on	schedule_maintenance
i wanna have an appointment to get my oil changed	schedule_maintenance
make me an appointment for a tire check	schedule_maintenance
i'd like to make an appointment to get my oil changed	schedule_maintenance
is there a special place where i can schedule to check my tires out	schedule_maintenance
my check engine light is on and someone needs to look at it	schedule_maintenance
i must schedule somewhere get my tires checked out	schedule_maintenance
find me someone who can deal with my car's illuminated check engine light	schedule_maintenance
where can i get a appointment for a tire check for the car	schedule_maintenance
please schedule car maintenance for me	schedule_maintenance
i don't know why my check engine light is on, i need a mechanic	schedule_maintenance
is there any way to change the date of my oil change	schedule_maintenance
can someone take a look at my car because the check engine light is on	schedule_maintenance
can i get someone to look at my check engine light that is on	schedule_maintenance
find out the next available date and time i can go to get my oil changed please	schedule_maintenance
please find someone who specializes in cars, my check engine light has turned on	schedule_maintenance
is it possible to get schedule getting my tires inspected	schedule_maintenance
i need to find somewhere to check my tires out	schedule_maintenance
who can look at my car, the engine light is on	schedule_maintenance
find a place near me to have my tires inspected	schedule_maintenance
i need to have an appointment to get my oil changed	schedule_maintenance
i have to schedule somewhere get my tires checked out	schedule_maintenance
i want to get an appointment to get my oil changed	schedule_maintenance
can i please get an appointment to get my oil changed	schedule_maintenance
where can i get my tires checked and how can i schedule it	schedule_maintenance
i need to get my oil changed	schedule_maintenance
may i schedule a car maintenance	schedule_maintenance
should i call a car maintenance	schedule_maintenance
i have to meet with sam at 9:00am in two days	schedule_meeting
check meeting rooms available between one and three pm	schedule_meeting
please schedule a meeting with kim at 10 am	schedule_meeting
i need to know how to schedule a meeting	schedule_meeting
help me get a meeting set up	schedule_meeting
please schedule a meeting room for 9am on friday	schedule_meeting
i'm having trouble scheduling a meeting	schedule_meeting
can you schedule a meeting with jessica at the office, please	schedule_meeting
can you book a meeting room for friday at 9:00 am	schedule_meeting
i'm going to need to meet with scott at 1pm	schedule_meeting
can you schedule a meeting with steve for 5	schedule_meeting
i want you to schedule a meeting with carrie and lisa	schedule_meeting
can you schedule a meeting with george for 4	schedule_meeting
can you schedule a meeting with steve at the office, please	schedule_meeting
are there meeting rooms available between 10-11	schedule_meeting
can you hook me up with a meeting room on saturday morning at 10am	schedule_meeting
please book a meeting room for thusday at 4:00	schedule_meeting
could you schedule a meeting with john smith at 1 pm tomorrow	schedule_meeting
are there rooms available between 5 and 530	schedule_meeting
at noon, schedule a meeting with saul	schedule_meeting
make sure i get a meeting room for 9am on friday	schedule_meeting
i need you to schedule a meeting with carrie and lisa	schedule_meeting
arrange a meeting room for 9am on friday	schedule_meeting
how can you schedule a meeting for me	schedule_meeting
i'm going to need a meeting room on 9am on tuesday	schedule_meeting
i want a meeting to be scheduled	schedule_meeting
get me a meeting with bill for 5:30pm tomorrow	schedule_meeting
tell me how to schedule a meeting	schedule_meeting
how is a meeting scheduled	schedule_meeting
i want you to set a meeting with john at 5 pm	schedule_meeting
how does scheduling a meeting work	schedule_meeting
walk me through the process of scheduling a meeting	schedule_meeting
i need assistance scheduling a meeting	schedule_meeting
do you have a meeting room open from noon until 2:00 pm	schedule_meeting
are there meeting rooms available between 11-12	schedule_meeting
i want to schedule a meeting with tom for 6pm	schedule_meeting
i want david to know where i'm at	share_location
give tom my location	share_location
tell carl my gps coordinates	share_location
share my location with darren and stacey	share_location
give tim my current location from the gps	share_location
please show my current location to andre	share_location
share my location with ma	share_location
please allow dan to see my location	share_location
let lucy know my gps coordinates	share_location
my gps coordiantes will be shared with aunt sunny	share_location
send my gps location to manuel	share_location
share my location with mom	share_location
give my location to stan	share_location
i need to send my current location to sean	share_location
tell my location to david	share_location
please show me how to share my location with noel	share_location
tell david my location	share_location
please share my location with my boss and my lawyer	share_location
can you tell bob and alice where i am	share_location
let shih chieh see my location	share_location
send my location to ben and jerry	share_location
i need you to send my location to paul and ryan	share_location
show cody where i am	share_location
share my location with google	share_location
share my gps coordinates with kelly	share_location
send the location i'm at with martin	share_location
tell brady where my location is	share_location
give my gps location to jason	share_location
please send my location to kevin and also to lucy	share_location
can you send my exact location to laura	share_location
tell david where i am	share_location
send my gps coordinates with home base please	share_location
can you let michael and julie know my location	share_location
show my gps location to brittany	share_location
have miranda know about my current location	share_location
can i share my location with david	share_location
can you tell me if i have paper towels on my shopping list	shopping_list
what all do i have on my shopping list	shopping_list
what do i have on my list for shopping	shopping_list
shopping list	shopping_list
is it possible for you to read the things on my shopping list	shopping_list
i need to know what's on my shopping list	shopping_list
are carrots added to the grocery list	shopping_list
does my shopping list have tomato written on it	shopping_list
did i remember to put eggs on my shopping list	shopping_list
read me everything on my shopping list	shopping_list
my shopping list contains what	shopping_list
what products are on my shopping list	shopping_list
check my shopping list	shopping_list
can you look up what my shopping list has on it	shopping_list
did i remember to put milk in the shopping list	shopping_list
is milk on my shopping list	shopping_list
i'd like to know what's on my shopping list	shopping_list
do i need milk at the store	shopping_list
what are my shopping list's content	shopping_list
did i remember to add milk to my shopping list	shopping_list
give me all contents of my shopping list	shopping_list
what did i put on my shopping list	shopping_list
will you please read the things on my shopping list	shopping_list
does the shopping list have apples on it	shopping_list
do you want peanut butter for your lunches this week	shopping_list
which purchases are on my shopping list	shopping_list
what do i need to go shopping for	shopping_list
read my shopping list	shopping_list
recite the items i'm planning to purchase	shopping_list
do i have twinkies on the grocery list	shopping_list
did i include butter in my shopping list	shopping_list
list everything on my shopping list	shopping_list
is there milk on my shopping list	shopping_list
can you tell me what i have on my shopping list	shopping_list
what does my shopping list say that i should get	shopping_list
what did i write down on my shopping list this time	shopping_list
would you add bananas to my shopping list as i am out	shopping_list_update
make sure bread gets added to my shopping list	shopping_list_update
i'm out of apples, add that to my list	shopping_list_update
add milk to my shopping list	shopping_list_update
can you put detergent on my shopping list cause i'm all out	shopping_list_update
is the milk on the shopping list if not, please add	shopping_list_update
remind me to buy bread next time i go shopping	shopping_list_update
update my shopping list, delete canned olives	shopping_list_update
put film on my shopping list	shopping_list_update
do me a favor and put sharpies on my list for shopping	shopping_list_update
delete fries from shopping list	shopping_list_update
i need you to add creamer to my shopping list	shopping_list_update
i'd like you to add oranges to my shopping list	shopping_list_update
x on the shopping list please	shopping_list_update
remove carrots from my shopping list and add soda	shopping_list_update
add eggs to my shopping list and remove cheese	shopping_list_update
add laundry detergent to the list	shopping_list_update
take soda from my shopping list, and while you're at it add tea	shopping_list_update
i need milk on my shopping list	shopping_list_update
on my shopping list, remove bread and add milk	shopping_list_update
add apples to my to do shopping list	shopping_list_update
do i have bananas on my list, if not please put them on the list	shopping_list_update
take fresh carrots off my shopping list	shopping_list_update
put bread on my shopping list	shopping_list_update
add bread to my list of groceries	shopping_list_update
i need soda added to my list and carrots removed	shopping_list_update
i would like to put carrots on my list for shopping	shopping_list_update
delete ice cream from my shopping list	shopping_list_update
add eggs to my shopping list if it's not already there	shopping_list_update
go ahead and erase cashews from my list, and add walnuts to it, please	shopping_list_update
i'd like to add pancake mix to my shopping list if it's not already there	shopping_list_update
delete soda from my shopping list and add water to it	shopping_list_update
i need to add cherrios to the grocery list	shopping_list_update
take toilet paper off my shopping list	shopping_list_update
put rice and pudding on my shopping list cause i need them	shopping_list_update
do i have milk on my shopping list please add it if it is not	shopping_list_update
what's the persons name at my door	smart_home
make the temperature 78 in here	smart_home
please lock the doors	smart_home
the oven be set at 350	smart_home
please start my car	smart_home
secure the doors	smart_home
please get my car started before i go out to it	smart_home
on the tv	smart_home
can you adjust the lights down	smart_home
did anyone securely lock the door	smart_home
set temperature to 75	smart_home
please set the temperature to 80	smart_home
on the tv, turn on	smart_home
turn on the tv on channel 6	smart_home
turn on the fan	smart_home
can you please turn the fan on	smart_home
start the dishwasher	smart_home
set the temperature to 78	smart_home
the temperature at ac is what	smart_home
tv turn it on	smart_home
turn on the tv please	smart_home
i want the light less bright please	smart_home
can you check who is at the door	smart_home
set my oven to 350 for me right now	smart_home
can you tell me what the ac is on	smart_home
put fan on	smart_home
put the garage lights on	smart_home
turn lights on in my master bathroom	smart_home
can you get my car started	smart_home
put on lights	smart_home
i would like it if you would turn the bedroom lights on low until i'm finished reading	smart_home
please turn on the hallway lights	smart_home
i would appreciate it if you help me turn the car on	smart_home
make the lights dimmer please	smart_home
set the temperaure to 71	smart_home
turn the furnace on please	smart_home
i'd like to know how acommodate is spelled	spelling
what is the spelling of potato	spelling
how do you spell tomato	spelling
what is the correct spelling of the word: dessert	spelling
can you tell me how to spell the word schadenfreude, i don't know how it's spelt	spelling
how do i spell acquaintance	spelling
how do you spell antipathy	spelling
i can't figure out how to spell superficial	spelling
can you give me a spelling for antipathy	spelling
spell potato	spelling
how do you spell out espresso	spelling
water is spelled how	spelling
how do you spell aaron	spelling
please tell me how to spell the word coup	spelling
i need to know how to spell xylophone	spelling
i forget how to spell xylophone	spelling
i don't know how to spell threshold	spelling
how does the dictionary spell antipathy	spelling
"tell me how to spent ""frightened"	spelling
i need to know how to spell the word serendipity	spelling
"what's the right way to spell ""emolument"	spelling
what's the right spelling of rambunctious	spelling
how do you spell out newspaper	spelling
i don't know how to spell theater	spelling
how many cs are in acquiescence	spelling
tell how many a's are in the word happiness	spelling
can you spell hamburger	spelling
"can you spell ""fragile"" for me"	spelling
can you spell out the word special for me	spelling
"can you spell ""diatribe"" for me"	spelling
i don't know how to spell apparently	spelling
how do you spell asian	spelling
i am not sure how to spell the word liaison	spelling
"how do you spell ""montpelier"	spelling
"i need help spelling ""exquisite"	spelling
spell government	spelling
how much have i spent this week	spending_history
have i been spending a lot on take out lately	spending_history
can you tell me what i have spent on food recently	spending_history
how much have i spent on alcohol recently	spending_history
how much have i spent on food in the past week	spending_history
have i been spending a lot on roast beef lately	spending_history
could you tell me how much i've spent over the past two weeks	spending_history
did i spend a lot on shoes recently	spending_history
how much have i spent on starbucks since the beginning of 2019	spending_history
i need to know my total spending on amazon for november and december 2018	spending_history
what was the total i spent at home depot last month	spending_history
i have been spending a lot on insurance lately	spending_history
how much have i spent on shoes	spending_history
would you say i've spent too much money on chips as of late	spending_history
have i spent a lot on food recently	spending_history
where did all my money go this month	spending_history
how much have i spent lately on food	spending_history
how much have i spent eating out this week	spending_history
i need to know what i spend on utilities for the last year	spending_history
what've i spent on gas this month	spending_history
what have i spent on fast food recently	spending_history
was i spending too much money on doughnuts last week	spending_history
tell me how much i have spent on grocery shopping just now	spending_history
please check and tell me the amount i spent on food last month	spending_history
what has gas cost me this week	spending_history
what did i spend at bath and body works last month	spending_history
what is the total i spent on shoes recently	spending_history
how much money have i spent on groceries recently	spending_history
what have i spent over the last few days	spending_history
how much fast food have i bought recently	spending_history
how much have i spent on clothes recently	spending_history
would please let me know how much i spent on food in january	spending_history
what's the total i've spent on shoes this month	spending_history
have i been spending a lot on alcohol lately	spending_history
looking at this week only, have i overspent on hoagies	spending_history
how much did i spend on food	spending_history
i wanna disconnect from my phone	sync_device
stop syncing with this phone	sync_device
could you connect to my phone	sync_device
can you pair yourself with my phone please	sync_device
unsync from my phone	sync_device
can you connect to my phone, please	sync_device
quickly disconnect the phone	sync_device
unsync my phone	sync_device
please immediately disconnect this mobile	sync_device
please unsync my phone	sync_device
is my phone connectable right now	sync_device
can you connect to my phone	sync_device
i must disconnect from my phone	sync_device
remove the connection to my phone	sync_device
you can unsync from my phone now	sync_device
can you disconnect from my phone	sync_device
i want for you to disconnect from my phone	sync_device
please unsync from my phone	sync_device
connect with my phone	sync_device
connect to my phone for me	sync_device
you can disconnect from my phone now	sync_device
i would like for you to unsync my phone	sync_device
please link up to my phone	sync_device
please unsync from my phone right now	sync_device
would you unsync the phone now please	sync_device
disconnect sync from my phone	sync_device
stop syncing with my phone	sync_device
can you disconnect yourself from my phone	sync_device
pair with my phone	sync_device
pair yourself to my phone if you can	sync_device
please desync my current mobile	sync_device
please add onto my phone	sync_device
sync with my phone	sync_device
will you please end the connection to my phone	sync_device
would you connect to my phone	sync_device
can you sync up with my phone	sync_device
what will my state taxes amount to this year	taxes
what do my state taxes look like	taxes
what's my bill going to be for my taxes for tennessee	taxes
tell me what my federal taxes amount to	taxes
please tell me what i pay in taxes	taxes
what amount of tax should i pay	taxes
tell me what my state taxes are	taxes
i need to know my tax rate	taxes
can you calculate my tax	taxes
how much do i pay the government in taxes	taxes
i pay how much of taxes with my income	taxes
what amount do my state taxes look like	taxes
what do i pay in taxes	taxes
what does it look like i will be paying in federal taxes this year	taxes
i need the details on my federal taxes	taxes
talk to me about the total of my state taxes	taxes
how much am i paying from my income in taxes	taxes
what do i currently pay in taxes	taxes
how different will my state taxes be	taxes
what will my state taxes cost	taxes
i would like to know how much i pay in taxes	taxes
tell me what the tax amount is	taxes
what do my federal taxes amount to	taxes
what can i expect to pay in taxes	taxes
what kinds of taxes am i facing	taxes
what is my tax burden	taxes
do i pay a lot of taxes on my income	taxes
i have to pay how much back in taxes	taxes
what's the tax bracket for my income	taxes
how much do i owe the irs	taxes
what is the price of my state taxes that i owe	taxes
do you know the price for my taxes in income	taxes
tell me my tax rate	taxes
can you calculate my state taxes	taxes
what is the amount of my federal taxes	taxes
whats the total of my federal taxes	taxes
tell me a funny joke about men	tell_joke
tell me a good joke	tell_joke
do you have any jokes to tell me	tell_joke
tell me a joke about baseball	tell_joke
do you know any dad jokes	tell_joke
do you know any good jokes about zebras	tell_joke
look for funny jokes	tell_joke
i want to hear a joke that’s funny	tell_joke
i'm in the mood for a joke	tell_joke
can you share a humorous joke with me	tell_joke
i want to hear a joke about elephants	tell_joke
tell me a joke about cows	tell_joke
please tell me a joke about dinosaurs	tell_joke
tell me a funny joke	tell_joke
give me your best joke	tell_joke
tell me something funny about horses	tell_joke
would you like to tell me a joke	tell_joke
what's the funniest thing you know about peanuts	tell_joke
do you know any jokes	tell_joke
tell me a blonde joke	tell_joke
tell me something funny about animals	tell_joke
do you know any good jokes	tell_joke
i want to hear something funny about politicsi	tell_joke
i'd like to hear a joke	tell_joke
i'd love to hear a joke	tell_joke
would you tell me a joke	tell_joke
do you know any good jokes about lawyers	tell_joke
could you please share a joke with me	tell_joke
what are some funny jokes	tell_joke
tell me your funniest joke	tell_joke
tell me a joke about lawyers	tell_joke
can you tell me a few funny jokes	tell_joke
tell me something funny about pizza	tell_joke
i would like to hear a funny joke	tell_joke
i could use a laugh, got any jokes	tell_joke
tell me a dog joke	tell_joke
please send a text message to natalie for me	text
start a new text	text
