text	label
I just checked and my payment was cancelled, why?	reverted_card_payment?
Why did my payment go back to my account when I bought something?	reverted_card_payment?
I just found out from the seller that my money didn't go through. I checked my account and it was deducted at first but now it's back in my account. Can you  please fix this for me quickly?	reverted_card_payment?
Why did my payment not go through why did it cancel?	reverted_card_payment?
I believe that a card payment I made was cancelled.	reverted_card_payment?
Please help me with my card payments which keeps getting reverted whenever i do online shopping. I am having this problem since last two weeks.	reverted_card_payment?
Hello, I was contacted by a seller who let me know my money didn't come through on their side. It most certainly came out of my account so I need this looked at immediately because now it has been returned to me!	reverted_card_payment?
The card payment didn't work	reverted_card_payment?
There's a problem - I bought something about a week or two ago but just today the payment somehow came back into my account! I already received the item though, what's going on here?	reverted_card_payment?
What happens when a payment is reverted?	reverted_card_payment?
My card payment might have been reverted.	reverted_card_payment?
I really wanted to buy something online but seems the card is not working as the payment suddenly came back! What's going on here, I've been trying for a good week or two.	reverted_card_payment?
Why has my payment been reversed?	reverted_card_payment?
Explain why a card payment would be cancelled?	reverted_card_payment?
How come I can't find my payment?	reverted_card_payment?
I seem to have a problem here, I bought something about a 2 weeks ago and just now received the payment back into my account and I've already received the item. Can you tell me what is going on here?	reverted_card_payment?
What does it mean if it says my card payment has been cancelled?	reverted_card_payment?
My payment came back for something i'm trying to buy online? it's been doing it for two weeks.  do you know what the issue is?	reverted_card_payment?
I had a payment reverted and would like to figure out why.	reverted_card_payment?
I was checking my statement and I think one of my card payments has reverted	reverted_card_payment?
I dont know what happened, but my payment was cancelled	reverted_card_payment?
What should I do if my card payment was cancelled?	reverted_card_payment?
Is it on purpose that my payment has been returned to my account?	reverted_card_payment?
I'm not sure what is going on here. I've received payment back into my account  for an item I've already received, from about 2 weeks ago.	reverted_card_payment?
I believe my card payment were reverted	reverted_card_payment?
Can you tell me why the card payment came back?	reverted_card_payment?
My payment was stopped	reverted_card_payment?
Under what condition will my payment revert?	reverted_card_payment?
Why was a payment cancelled on my account?	reverted_card_payment?
What does it mean if my payment was reverted?	reverted_card_payment?
I made a payment and it was reverted and wanted to know why?	reverted_card_payment?
Why would my card payment get reverted?	reverted_card_payment?
How can I tell if my card payment is reverted?	reverted_card_payment?
I was refunded the money for something I bought already.	reverted_card_payment?
It looks like my card payment was sent back.	reverted_card_payment?
Do you have a list of cards and currencies you support?	supported_cards_and_currencies
What currencies can I use?	supported_cards_and_currencies
Which cards are accepted for topping up?	supported_cards_and_currencies
What types of cards and money do you accept?	supported_cards_and_currencies
What are the currencies and cards that are supported with my account?	supported_cards_and_currencies
What payment methods are used to top up?	supported_cards_and_currencies
What forms of payment do you accept?	supported_cards_and_currencies
What currencies can be used for top up?	supported_cards_and_currencies
What US credit cards do you accept?	supported_cards_and_currencies
What currency can I use to pay for a top up?	supported_cards_and_currencies
What cards do you accept to top up my account?	supported_cards_and_currencies
What cards do you support	supported_cards_and_currencies
use my credit to add money	supported_cards_and_currencies
Is my credit card supported for top-ups?	supported_cards_and_currencies
With what currencies can I add money?	supported_cards_and_currencies
What cards and currencies can I use to top up my account?	supported_cards_and_currencies
I'd prefer to use my American Express when putting funds into my account.	supported_cards_and_currencies
What card or currency can I use to pay?	supported_cards_and_currencies
I want to deposit funds, what payments are accepted?	supported_cards_and_currencies
do you accept from usa credit card?	supported_cards_and_currencies
Do you accept any card and currency?	supported_cards_and_currencies
Can I use a credit card from the US to top up?	supported_cards_and_currencies
Am I able to use my American Express to add money to my account balance?	supported_cards_and_currencies
I have a US credit card, will you accept it?	supported_cards_and_currencies
What kind of cards are supported?  What currency?	supported_cards_and_currencies
What are the acceptable currencies for adding funds?	supported_cards_and_currencies
I have a second credit card from the US. Will you take it?	supported_cards_and_currencies
Why doesn't it work when I use American Express to try to add money to my account?	supported_cards_and_currencies
how can i add money from my amex card	supported_cards_and_currencies
Is American Express supported for adding money into my account?	supported_cards_and_currencies
Do you accept credit cards from the US	supported_cards_and_currencies
Will you accept my credit card, it my only one.	supported_cards_and_currencies
why wont my american express work to add money	supported_cards_and_currencies
What are the cards and currencies that you support?	supported_cards_and_currencies
Is American Express supported for adding funds?	supported_cards_and_currencies
Can I electronically transfer funds into my account from my American Express?	supported_cards_and_currencies
I only have a card from the US is that okay?	supported_cards_and_currencies
Which foreign currencies do you accept for adding money?	supported_cards_and_currencies
I want to add funds to my account. What payment methods are accepted?	supported_cards_and_currencies
Are there certain cards and currencies you support?	supported_cards_and_currencies
I have one other credit card from the US. Do you take it?	supported_cards_and_currencies
I have one other credit card from the US. Do you take that?	supported_cards_and_currencies
What currencies are approved to add money?	supported_cards_and_currencies
how can i transfer money from american express card	supported_cards_and_currencies
I have an American Express that I'd like to add money to my account with.	supported_cards_and_currencies
What are the various currencies and cards that you offer support for?	supported_cards_and_currencies
Please let me know what currency I can use to top up my account?	supported_cards_and_currencies
What currency is acceptable for a top up?	supported_cards_and_currencies
Can I use any card and currency?	supported_cards_and_currencies
What currencies and methods can i use to top up my account?	supported_cards_and_currencies
I only have one other credit card from the US. Do you accept that?	supported_cards_and_currencies
Help me use American Express to add money to the account.	supported_cards_and_currencies
How can I pay for top-ups?	supported_cards_and_currencies
I need to know if you will accept my credit card.	supported_cards_and_currencies
Which cards do you support for top up?	supported_cards_and_currencies
If I top up by card, what options do I have re: currency and card type?	supported_cards_and_currencies
Do I have to top up in euros if I use a card, or can I use a different currency?	supported_cards_and_currencies
For adding money, which currencies do you accept?	supported_cards_and_currencies
This company is bad, delete my account now.	terminate_account
Your service is bad.  Close my account.	terminate_account
I want to terminate my account	terminate_account
I am not satisfied with your service.  Close my account.	terminate_account
How do I terminate my account.	terminate_account
I would like to cancel my account.	terminate_account
I'm not happy with the services I'm getting with this company. Can you please delete my account?	terminate_account
I want to cancel my account.	terminate_account
Your company is lame. Shut down all my account services right now.	terminate_account
I need to terminate my account.	terminate_account
I want to inactivate my account.	terminate_account
I am looking to delete my account. I'm not happy with the service provided by you.	terminate_account
I want to delete my account. How do I do this?	terminate_account
I need to delete my account.	terminate_account
Please help me delete this account.	terminate_account
I need to close my account as soon as possible.	terminate_account
I don't want this account anymore, how do I delete it?	terminate_account
I want to shut down my account as soon as possible.	terminate_account
Tell me how to delete my account.	terminate_account
I'm dissatisfied with the service and would like to terminate the account.	terminate_account
How do I delete an account?	terminate_account
how to delete account, not happy	terminate_account
how do i cancel my account	terminate_account
I would like to close my account, as I'm not happy.	terminate_account
Can you delete the account?	terminate_account
I wish to remove my account.	terminate_account
I am upset with your service.  Please delete my account.	terminate_account
I want to delete my account.	terminate_account
I need to terminate my account immediately.	terminate_account
for god sake, just delete my account i am sick of this	terminate_account
I no longer want this account, what should I do?	terminate_account
I want to close my account due to poor customer service.	terminate_account
terminate my account please	terminate_account
I need to delete my account, please.	terminate_account
I am not satisfied with your company and wish to delete all accounts immediately.	terminate_account
The company is no good, please terminate my account.	terminate_account
I want to close my account & I will never do business with you again.	terminate_account
I want to get rid of the account, and delete personal information .	terminate_account
i'm not satisfied with the services and no longer want to be a customer	terminate_account
Is it possible to delete the account?	terminate_account
I don't like the services, please close my account	terminate_account
Delete my account now please.	terminate_account
I am not happy with your service and request that my account be terminated!	terminate_account
Help me delete my account.  I am not satisfied with the service.	terminate_account
I'm not happy with service and would like to delete this account.	terminate_account
Please delete this account.	terminate_account
I need you to delete my account now.	terminate_account
What are the steps to finishing up with this account?	terminate_account
Will I be charged for topping up my account using a bank transfer?	top_up_by_bank_transfer_charge
What is the cost of a transfer?	top_up_by_bank_transfer_charge
Are you going to charge me to collect the money?	top_up_by_bank_transfer_charge
How much do I need to pay for a transfer?	top_up_by_bank_transfer_charge
Can third party fees affect a transfer?	top_up_by_bank_transfer_charge
I want to top up my account by a bank transfer, but will I be charged?	top_up_by_bank_transfer_charge
Do you charge anything for topping up?	top_up_by_bank_transfer_charge
How much would it cost me for a bank transfer to top up my account?	top_up_by_bank_transfer_charge
Does it cost me anything to top up my account via bank transfer?	top_up_by_bank_transfer_charge
Will I be charged any fee for receiving money?	top_up_by_bank_transfer_charge
For topping-up is there a charge?	top_up_by_bank_transfer_charge
Is there a charge for using transfers for top ups?	top_up_by_bank_transfer_charge
Are you aware of any charges for receiving money?	top_up_by_bank_transfer_charge
Is there a fee for topping off by transfer?	top_up_by_bank_transfer_charge
What is the charge for receiving a SEPA transfer?	top_up_by_bank_transfer_charge
Are there any charges for receiving money?	top_up_by_bank_transfer_charge
Is there a top up fee?	top_up_by_bank_transfer_charge
What are the additional charges for a SWIFT transfer?	top_up_by_bank_transfer_charge
Will I be charged for adding money by transfer?	top_up_by_bank_transfer_charge
If I were to transfer, what would the cost be?	top_up_by_bank_transfer_charge
Will there be a charge when money is added to my account?	top_up_by_bank_transfer_charge
If someone sends me money, will I be charged?	top_up_by_bank_transfer_charge
If I were to do a transfer, what is the rate for that?	top_up_by_bank_transfer_charge
Am I going to see a charge for a SEPA transfer?	top_up_by_bank_transfer_charge
I want to do a swift transfer	top_up_by_bank_transfer_charge
Is there a charge for getting my money?	top_up_by_bank_transfer_charge
Will I be charged to top off my account?	top_up_by_bank_transfer_charge
Are there any fees associated with receiving money?	top_up_by_bank_transfer_charge
are SWIFT transfers an option?	top_up_by_bank_transfer_charge
How much does each transfer cost?	top_up_by_bank_transfer_charge
What are the fees associated with top up via transfer?	top_up_by_bank_transfer_charge
Do you process SWIFT transfers?	top_up_by_bank_transfer_charge
If I top up by transfer, am I going to be charged?	top_up_by_bank_transfer_charge
How much is it to receive money?	top_up_by_bank_transfer_charge
how much will I be charged for making a transfer?	top_up_by_bank_transfer_charge
is there a fee for swift transfer	top_up_by_bank_transfer_charge
Am I able to do a SWIFT transfer?	top_up_by_bank_transfer_charge
Is there any fees associated with receiving money with this account?	top_up_by_bank_transfer_charge
How much would it cost me if I transfer?	top_up_by_bank_transfer_charge
What is the fee to top-up my account	top_up_by_bank_transfer_charge
Are there fees for receiving a SEPA transfer?	top_up_by_bank_transfer_charge
Will I receive all the money sent to my account by SEPA transfer?	top_up_by_bank_transfer_charge
To receive money are there charges?	top_up_by_bank_transfer_charge
Can I use SWIFT transfers?	top_up_by_bank_transfer_charge
Am I charged for receiving money?	top_up_by_bank_transfer_charge
How much does it cost to do a transfer?	top_up_by_bank_transfer_charge
Can I Transfer from SWIFT?	top_up_by_bank_transfer_charge
Will there be a charge for topping up by account with a SEPA transfer?	top_up_by_bank_transfer_charge
Do you charge for transfers?	top_up_by_bank_transfer_charge
Can you tell me the cost of a transfer?	top_up_by_bank_transfer_charge
Is there a fee to top up a US card using a debit or credit card?	top_up_by_card_charge
Do you charge a fee for adding money in USD?	top_up_by_card_charge
Are there top up charges for US cards?	top_up_by_card_charge
If US cards have a top up charge, what is it?	top_up_by_card_charge
If I add money with an international card, are there any fees?	top_up_by_card_charge
Will I be charged any fees if I want to add money with an international card?	top_up_by_card_charge
Will you charge me more if I use a European bank card for a top up?	top_up_by_card_charge
Is there a fee for european bank cards?	top_up_by_card_charge
Is USD free to top up with a US card?	top_up_by_card_charge
I was wondering if you will take any fees in exchange for top ups?	top_up_by_card_charge
What are the top-up fees for my card?	top_up_by_card_charge
Will there be extra charges regarding to adding money into my international card?	top_up_by_card_charge
Would I be charged any fees if I added money to my account using an international card?	top_up_by_card_charge
I want to add money to my international card, so are there any fees charged to do this?	top_up_by_card_charge
Will I see fees from adding money with an international card?	top_up_by_card_charge
how much for topping up by card?	top_up_by_card_charge
Are there any charges for using a bank card to top up	top_up_by_card_charge
What is the fee if I use a European bank for a top up?	top_up_by_card_charge
Will you assess me more fees if I top up with an international card?	top_up_by_card_charge
What options do I have when topping up a US card?	top_up_by_card_charge
European bank card for top up will come with any extra fees?	top_up_by_card_charge
How much are the fees for adding funds using an international card?	top_up_by_card_charge
Does it cost to add money to my card?	top_up_by_card_charge
Are there going to be fees from adding money with an international card?	top_up_by_card_charge
Can I top up for free using a European card?	top_up_by_card_charge
Will you charge me for topping up with a European card?	top_up_by_card_charge
What fees to you have for top ups?	top_up_by_card_charge
What do I need to know about topping up?	top_up_by_card_charge
Can I get information on topping up?	top_up_by_card_charge
What fees are charged when I top up	top_up_by_card_charge
Do you charge extra for topping up with a debit or credit card?	top_up_by_card_charge
What is the fee for topping up a US card?	top_up_by_card_charge
I need to know what charges I will incur for using a European card for top up.	top_up_by_card_charge
Is there a fee when I add money to my international card?	top_up_by_card_charge
How much does top up fees cost?	top_up_by_card_charge
how much does it cost to add money	top_up_by_card_charge
Do you charge if I use a European bank card for top up?	top_up_by_card_charge
Are you going to charge me to top up my card?	top_up_by_card_charge
Is there a fee for topping up a card?	top_up_by_card_charge
Are there any charges for European bank card for top up?	top_up_by_card_charge
I am worried about fees for top up cards?	top_up_by_card_charge
Is there a fee for adding funds with a credit card?	top_up_by_card_charge
should i add money via bank transfer instead	top_up_by_card_charge
Is topping up free?	top_up_by_card_charge
Do you have any card fees if I want to add money using an international card?	top_up_by_card_charge
Does it cost to top up my card?	top_up_by_card_charge
What are the fees for using a European bank card?	top_up_by_card_charge
Are there still fees for european top-ups?	top_up_by_card_charge
Is there a charge for using an European bank card for top up?	top_up_by_card_charge
how should i add money to my card	top_up_by_card_charge
Will I get charged for topping up with an international card?	top_up_by_card_charge
What is the charge for topping up a card?	top_up_by_card_charge
Is it possible for me to top up with cash?	top_up_by_cash_or_cheque
How do you top-up using cash?	top_up_by_cash_or_cheque
Can I deposit a check?	top_up_by_cash_or_cheque
Is there an option to top up with a cheque?	top_up_by_cash_or_cheque
How do I top up with cash?	top_up_by_cash_or_cheque
Is it possible to top up using a cheque?	top_up_by_cash_or_cheque
What form of payments can I use for topping up?	top_up_by_cash_or_cheque
Help me please, I need to top up cash.	top_up_by_cash_or_cheque
What are my payment options for topping off my account?	top_up_by_cash_or_cheque
i would like to top up with check	top_up_by_cash_or_cheque
Do you have any options to top up with a cheque on my account?	top_up_by_cash_or_cheque
can i use check to top up	top_up_by_cash_or_cheque
I need a hand here, I need to top up cash.	top_up_by_cash_or_cheque
how can i add money to my account if you don't accept cash	top_up_by_cash_or_cheque
Where is the option to top up with a cheque?	top_up_by_cash_or_cheque
Is there somewhere I can send a check to add to my account?	top_up_by_cash_or_cheque
Who do I make a check out to if I want to top off my account?	top_up_by_cash_or_cheque
What's the best way to use a cheque to top up?	top_up_by_cash_or_cheque
How do I top-up my card with a cheque?	top_up_by_cash_or_cheque
Can cash be used in physical locations to top up?	top_up_by_cash_or_cheque
I tried to deposit a cheque into my account and it is not letting me.	top_up_by_cash_or_cheque
Why can't I top up by cheque?	top_up_by_cash_or_cheque
Can you tell me where to find top up by cash deposit?	top_up_by_cash_or_cheque
What types of top-up methods do you accept?	top_up_by_cash_or_cheque
Help, I need to top up my account. Where do I send a check?	top_up_by_cash_or_cheque
Can I write a cheque to top up?	top_up_by_cash_or_cheque
Where can I find top up by cash deposit?	top_up_by_cash_or_cheque
How can I add physical money to my card?	top_up_by_cash_or_cheque
How do I add cash to my account?	top_up_by_cash_or_cheque
What are the steps for depositing cash into my account?	top_up_by_cash_or_cheque
I'm trying to use a cheque to top up	top_up_by_cash_or_cheque
I can't find out how to top-up my account using cash.	top_up_by_cash_or_cheque
Is there a way to use a cheque to top up my account?	top_up_by_cash_or_cheque
Can I top up my account with a check?	top_up_by_cash_or_cheque
I can't find any option to top up with a cheque?	top_up_by_cash_or_cheque
I want to do a cash deposit to top up. How do I do this?	top_up_by_cash_or_cheque
Can I top up online?	top_up_by_cash_or_cheque
What apps can I use to top up my account?	top_up_by_cash_or_cheque
What is the procedure for topping up with a cheque?	top_up_by_cash_or_cheque
can i top up with check?	top_up_by_cash_or_cheque
I would like to use this cheque to top up.  Can you tell me how to do that?	top_up_by_cash_or_cheque
May I transfer a cheque into my account?	top_up_by_cash_or_cheque
Do you accept cheques for top-up?	top_up_by_cash_or_cheque
can i deposit a check here?	top_up_by_cash_or_cheque
How do I deposit cash?	top_up_by_cash_or_cheque
Do you take checks?	top_up_by_cash_or_cheque
Can I cash deposit to top up my account	top_up_by_cash_or_cheque
How can I top up my account with a cheque?	top_up_by_cash_or_cheque
Can I mail in a check to top up?	top_up_by_cash_or_cheque
How long before a check I send clears?	top_up_by_cash_or_cheque
Can I use check to deposit?	top_up_by_cash_or_cheque
What physical locations can I use cash to top up?	top_up_by_cash_or_cheque
What if my top up didn't work?	top_up_failed
I believe my top up did not work.	top_up_failed
Why is it failing to top-up?	top_up_failed
I wanted to top up my account and it doesn't look like it worked	top_up_failed
My top-up was declined	top_up_failed
I don't know why my credit card was declined while I was trying to top-up. Was it something on my end or was there something wrong with the top-up function?	top_up_failed
My credit card seems to have been declined for top up. Why is it not going through? Can you tell me what's going on?	top_up_failed
My credit card got declined for top up! What's going on? Can you check on why it didn't go through?	top_up_failed
Why has my top-up been denied?	top_up_failed
I urgently need to top-up my card but its getting declined. Please help me in this or advise with other options if any.	top_up_failed
I need assistance finding out why I am unable to top-up my card, it keeps getting refused.  It is extremely imperative I get this resolved quickly.	top_up_failed
Hello, I tried to top up with my card, but it didn't work. I just got it a couple days before and it works fine. What's the deal? Can you check into this?	top_up_failed
I don't think my top up worked	top_up_failed
Can I tell if my top off didn't work?  It doesn't seem to have.	top_up_failed
I can't get the top-up to work! What's going on here.	top_up_failed
How do I know if my top up worked?	top_up_failed
My credit card was just denied for top up! Can you tell me why this happened and what's going on?	top_up_failed
Can you find out why my credit card didn't process payment? It was declined for top up so what's the deal?	top_up_failed
I added funds to my account but the app didn't process it.	top_up_failed
How can correct Top up with the app to work correctly?	top_up_failed
I need help reapplying my top-up. It seems it isn't working.	top_up_failed
Fix my top up	top_up_failed
What was the issue with my topping up?	top_up_failed
I'm confused as to why my top-up did not go through.	top_up_failed
Why was my top-up rejected?	top_up_failed
Can you tell me why my top-up failed?	top_up_failed
Um, my top up didn't work	top_up_failed
I am having problems with a top-up.	top_up_failed
I added money but my top-up wasn't processed by the app.	top_up_failed
What's the problem? My card keeps getting declined for top up. I need to know what is going on.	top_up_failed
Why did the top-up fail?	top_up_failed
My top-up didn't go through	top_up_failed
Hello, there was an error while attempting top-up with my card this morning. I was able to use the card two days ago with no issues. Could you please assist?	top_up_failed
why is my top up failing	top_up_failed
My top-up was rejected	top_up_failed
Please explain why my top-up didn't go through.	top_up_failed
I believe my top up has failed	top_up_failed
I attempted to top up my car today, it failed! I just got it a couple of days before and it worked then. What is going on with it?	top_up_failed
I tried to top up but the app rejected it.	top_up_failed
My card keeps getting declined when I try to use it.  I would like to top-up, but it is not going though.	top_up_failed
It looks like my top up didn't work.  Why?	top_up_failed
I tried topping up my account but it failed, can you help me?	top_up_failed
