text	label
Why are you charging for cash withdrawals? I went to withdraw some money earlier today after getting my groceries, and it appears there is a fee that wasn't there before	cash_withdrawal_charge
Why was I charged for withdrawing cash?	cash_withdrawal_charge
What's up with the fee for getting cash?	cash_withdrawal_charge
Why did I get charged a fee, I thought it was free?	cash_withdrawal_charge
When I withdrew my money, why was there an extra charge?	cash_withdrawal_charge
So, I was just charged for my recent ATM withdrawal and any withdrawal prior to this has been free. What is the issue here?	cash_withdrawal_charge
to cash withdrawals charge me?	cash_withdrawal_charge
Tell me why there is a charge on my cash withdrawl.	cash_withdrawal_charge
Why did you charge a fee when I withdrew from an ATM?	cash_withdrawal_charge
Is there a charge for getting cash?	cash_withdrawal_charge
I noticed a different charge while I was taking my money out.	cash_withdrawal_charge
Hello, I have a question concerning an unfamiliar fee that I notice on my account. I see that you guys charge for ATM withdrawal. Never notice this fee until now. Can you please explain?	cash_withdrawal_charge
It seems I've suddenly been charged for my recent ATM cash withdrawal. What's up with that? I though withdrawals are free, you never charged me so far!	cash_withdrawal_charge
I believe i was charged for making a withdrawal after i went grocery shopping. Are you guys charging for this now?	cash_withdrawal_charge
I just saw a charge for a cash withdrawal that I made! ATM withdrawals have always been free in the past, so why is there suddenly a charge? What is it going to cost me now?	cash_withdrawal_charge
that fee should not be there, you charged my cash for an unnecessary thing.	cash_withdrawal_charge
Why did I get a fee from the ATM?	cash_withdrawal_charge
I saw a fee on my receipt from withdrawing money while shopping earlier.  Is there supposed to be a fee for this type of transaction?	cash_withdrawal_charge
I was charged a fee with my cash withdrawal that I shouldn't have been charged.	cash_withdrawal_charge
I was charged a fee when withdrawing cash, can you explain why?	cash_withdrawal_charge
Why was i charged for making a withdrawal? After i went grocery shopping i withdrew some money from my account and now there is another charge.	cash_withdrawal_charge
I made a cash withdrawl and there is a charge.  What is this?	cash_withdrawal_charge
Why did you charge me for taking out cash?	cash_withdrawal_charge
I have a question about fee for cash withdraw.	cash_withdrawal_charge
I got cash and was charged a fee that shouldn't be there!	cash_withdrawal_charge
What is your policy on withdrawing cash from an ATM? There is a fee on my account that wasn't there before I paid for my groceries.	cash_withdrawal_charge
Why am I charged a fee for withdrawing cash?	cash_withdrawal_charge
I used my card the other day to get cash from an ATM and was charged an extra fee. I don't understand why I am being charged a fee all of a sudden. I thought it was free to withdraw from an ATM?	cash_withdrawal_charge
Do I get charged for withdrawals?	cash_withdrawal_charge
Make me understand why I am charged an extra fee when I use the ATM.	cash_withdrawal_charge
While getting cash, I was charged a fee.	cash_withdrawal_charge
I have been charged a fee for getting cash	cash_withdrawal_charge
Why was I charged when taking out money?	cash_withdrawal_charge
Are there ATM fees?	cash_withdrawal_charge
I want to get some cash from the ATM using my card but I dont want to be charged any fees. Ive taken some money out before with no fees, but recently Ive been getting charged. Why?	cash_withdrawal_charge
extra fees on a cash withdrawal, not cool.	cash_withdrawal_charge
Can you tell me why I was charged extra when I withdrew money?	cash_withdrawal_charge
Am I charged more for using the ATM?	cash_withdrawal_charge
I was recently charged for withdrawing money from my bank ATM. How can that be possible when I haven't been charged for using it before?	cash_withdrawal_charge
I just had a look at my statement. Why have I been changed for using the ATM?	cash_withdrawal_charge
The past few times I've been to the ATM, I was charged a withdrawal fee. Have your policies changed regarding fees?	cash_withdrawal_charge
I got charged a fee that shouldn't be there from my cash	cash_withdrawal_charge
Do you charge for making a withdrawal? I took some money out of my account earlier and I was charged for this.	cash_withdrawal_charge
Why am I being charge a fee when using an ATM?	cash_withdrawal_charge
How do I avoid a fee to use an ATM?	cash_withdrawal_charge
Why have I all of a sudden been charged for my ATM withdrawal? I thought the withdrawals were free because this is the first time I've ever had this problem.	cash_withdrawal_charge
What is the extra fee I was charged when using an ATM?	cash_withdrawal_charge
I have a strange transaction on my account which appears to pertain to a cash withdrawal I made outside Nandos in Leeds.  What is that for?  Is it fraud?	cash_withdrawal_charge
Is there a cash withdrawal fee? Because I just got charged?	cash_withdrawal_charge
Please help!  There was an extra fee when I got cash.	cash_withdrawal_charge
I withdrew cash and was charged. Why?	cash_withdrawal_charge
Is there a fee when I get cash from an ATM? Is there a limit I can take out? If there is a fee, what is it?	cash_withdrawal_charge
The ATM charged me an extra fee, Why?	cash_withdrawal_charge
Why did using an ATM cause me to have an extra fee charged?	cash_withdrawal_charge
I didn't realize that there were any fees for withdrawing money from my account--this has never happened to me before.  What exactly are the fees?	cash_withdrawal_charge
I used an ATM and wanted to know why I was charged an extra fee.	cash_withdrawal_charge
I was told that withdrawing cash from the ATM is free, but I'm charged a fee. Why is this?	cash_withdrawal_charge
I withdrew money and got a fee, please explain	cash_withdrawal_charge
I think somebody made an unauthorized copy of my card.  My account has a cash withdrawal for 500£ that I did not make.  Please help.	cash_withdrawal_not_recognised
I was trying to use my card and it was declined, when I tried to find out what happened I found cash withdraw for $500 that I didn't do.  Can you please help figure this out?	cash_withdrawal_not_recognised
Some cash shows up on my app.	cash_withdrawal_not_recognised
I am seeing unathorized transactions in the app, on my account.	cash_withdrawal_not_recognised
There was just a withdrawal but it wasn't me, I've never even visited the town where the withdrawal happened.	cash_withdrawal_not_recognised
What is the strange cash withdrawal on my statement?	cash_withdrawal_not_recognised
Hi, It's urgent, please freeze my card. As someone has withdrawn money using my card in odd remote town. Since i have not done this withdrawal. Do it fast.	cash_withdrawal_not_recognised
Help! I think someone has made a cash withdrawal with my card!	cash_withdrawal_not_recognised
I got a notice from my app that I withdrew cash but I don't remember doing so. How do I fix this?	cash_withdrawal_not_recognised
There is random cash in my account.	cash_withdrawal_not_recognised
Some cash was withdrawn in the app, but I did not do it.	cash_withdrawal_not_recognised
I lost my wallet and I think someone is withdrawing cash with my card. Please help. It is urgent.	cash_withdrawal_not_recognised
Somebody made a withdrawal from my account for 500. I have my card so how can this be? Does somebody have a duplicate card or something? Help please.	cash_withdrawal_not_recognised
My wallet was just stolen and I see my account already has a withdrawal. Can you please help me.	cash_withdrawal_not_recognised
I saw there is a cash withdrawal from my account via the app which I did not complete.	cash_withdrawal_not_recognised
How can I verify if a cash withdrawal was made from my account? I still have my card with me but I did not authorize the withdrawal that just occurred.	cash_withdrawal_not_recognised
Help!  There is a cash withdrawl on the account that I didn't make!	cash_withdrawal_not_recognised
What should I do if I see an unauthorized withdrawal on my statement?	cash_withdrawal_not_recognised
There is a cash withdrawal on my statement that I did not make	cash_withdrawal_not_recognised
There was money taken out of my account, and I'm pretty sure I didn't do it.	cash_withdrawal_not_recognised
There are funds showing in my app that I did not receive.	cash_withdrawal_not_recognised
i didnt put that money in my account	cash_withdrawal_not_recognised
I have a cash withdrawal that I do not recognise.	cash_withdrawal_not_recognised
According to the app, I got cash from an ATM but I haven't made any transactions.	cash_withdrawal_not_recognised
It is urgency. Please freeze my card now. As someone in some odd remote town has withdrawn some money by using my card. As i did not withdraw any money.	cash_withdrawal_not_recognised
I was checking my account when I saw a $500 cash withdraw that I know I didn't do.  I have my card so I don't understand how this happened.  Please help me.	cash_withdrawal_not_recognised
Hello, Please look into this matter urgently. As i have lost my wallet and i can see one withdrawal, now i do not want to loose more money.	cash_withdrawal_not_recognised
My app says I made a withdrawal, but I didn't.	cash_withdrawal_not_recognised
Someone stole my account, there's a withdrawal but it wasn't me, can we put a stop to it please?	cash_withdrawal_not_recognised
I think there's been an unauthorized cash withdrawal from my account.	cash_withdrawal_not_recognised
I got a message saying I made a withdrawal from the bank machine, but I did not.	cash_withdrawal_not_recognised
I think someone stole money from my card	cash_withdrawal_not_recognised
There is a cash withdrawl I don't remember.	cash_withdrawal_not_recognised
Can you tell me what this cash withdrawal is?	cash_withdrawal_not_recognised
I was the victim of someone stealing my wallet.  My card is being used and it isn't me.  What should I do?	cash_withdrawal_not_recognised
I hope you can help me. Someone has stolen my wallet and now I have noticed that they have been taking money from my account.	cash_withdrawal_not_recognised
Hello, Just now i got to know withdrawal of money from of my account. As someone used my card to withdraw amount in any odd remote area. Since i have not been in that area, please freeze my card immediately.	cash_withdrawal_not_recognised
The app is showing mt withdrawals that aren't  mine.	cash_withdrawal_not_recognised
How do I report a cash withdrawal that wasn't me?	cash_withdrawal_not_recognised
Someone else used my card to withdraw cash from an ATM	cash_withdrawal_not_recognised
I have a cash withdrawal in my statement. Why is that?	cash_withdrawal_not_recognised
A cash withdrawal that I didn't authorize is shown on my account - can you please cancel my card as soon as possible?	cash_withdrawal_not_recognised
A cash withdrawal has been done that I didn't do.	cash_withdrawal_not_recognised
My wallet got stolen a couple hours ago and now I've seen there already is a withdrawal. Help this is absolutely urgent I don't want to loose more money	cash_withdrawal_not_recognised
A 500 pound cash withdrawal was just made from my account, but I didn't make it. I am pretty sure my card has been compromised - can you help me?	cash_withdrawal_not_recognised
My wallet was taken and I see that someone is using my card!   Please help me!	cash_withdrawal_not_recognised
help, I see money missing I didn't take out.	cash_withdrawal_not_recognised
There's a cash withdrawal I am certain I did not make	cash_withdrawal_not_recognised
There are funds in my app that I did not receive.	cash_withdrawal_not_recognised
There's a cash withdrawal on my account that I didn't make	cash_withdrawal_not_recognised
I saw on the app that a cash withdrawal was completed on my account; however, I did not complete it.	cash_withdrawal_not_recognised
What is this withdrawal as I do not remember making it.	cash_withdrawal_not_recognised
The app is showing a cash withdrawal that I didn't make.	cash_withdrawal_not_recognised
Cash I did not get showed up in my account	cash_withdrawal_not_recognised
What do I do when a charge has been made that I did not make?	cash_withdrawal_not_recognised
I see in the app some cash was withdrawn, but it's not mine.	cash_withdrawal_not_recognised
I just lost my wallet and I think someone is using my card to withdraw my money. Can you please cancel or freeze my card?!!	cash_withdrawal_not_recognised
There is a withdrawal on my account I didn't make.	cash_withdrawal_not_recognised
Hi, Could you please help me as someone has stolen my wallet few hours ago. And a withdrawal is made, please help immediately. As i don't want to suffer more.	cash_withdrawal_not_recognised
My identity has been stolen. I still have my physical card but there are charges I didn't make on my account. How do I cancel this card or dispute the charges?	cash_withdrawal_not_recognised
Someone has a copy of my card !! I definitely still have it here but someone just made a 500£ cash withdrawal, HELP!	cash_withdrawal_not_recognised
I am seeing in the App a some cash withdrawal that does not belong to me	cash_withdrawal_not_recognised
There are incorrect charges on my account, there was a WD that was made by someone else.  I still have my card though.	cash_withdrawal_not_recognised
Please help me, its urgent. Someone has withdrawn money from my account as few hours before my wallet has been. Now i want to stop withdrawal of more money.	cash_withdrawal_not_recognised
My app says I withdraw funds from my account through an ATM.	cash_withdrawal_not_recognised
A withdrawal is showing that I don't recognize	cash_withdrawal_not_recognised
My bank app said that I got cash from an ATM, but that's a mistake.	cash_withdrawal_not_recognised
What is this cash withdrawal I don't recognize?	cash_withdrawal_not_recognised
I see a cash withdrawal in the app that I did not do.	cash_withdrawal_not_recognised
Someone is using my card to purchase flights to New York it's not me because I'm not going to New York, please can you cancel the card and refund the money?	cash_withdrawal_not_recognised
I AM MISSING CASH FROM MY BANK ACCOUNT ACCORDING TO MY APP	cash_withdrawal_not_recognised
Why do I see a random withdrawal in my app?	cash_withdrawal_not_recognised
I'm in Austria right now, but I really need to change my PIN right now. Can I do this even though I'm in another country?	change_pin
Please tell me how to change my pin.	change_pin
Can I change my PIN without going to a bank?	change_pin
Can I change my PIN without being physically present?	change_pin
Can I change my PIN abroad?	change_pin
Can I change my PIN remotely?	change_pin
I want to change my PIN - do I need to be in a bank?	change_pin
Do I have to go to an actual bank to change my PIN?	change_pin
While on vacation in Spain I think someone saw my PIN and I now need to change it, can I do this at an ATM in Spain?	change_pin
What do I have to do to change my pin?	change_pin
Can I change my PIN at my local bank?	change_pin
Do I need to speak to a representative to change my pin?	change_pin
Am I allowed to change my PIN anywhere?	change_pin
Can I change my pin at ATMs?  If so, what ones?	change_pin
Can I change my pin number at a cash machine?	change_pin
How can I alteration my PIN?	change_pin
Your ATM pin can be changed at any VISA or MasterCard ATM with PIN services. Certain countries don't support ATM pin changes.	change_pin
In what way can I change my PIN and where do I need to be?	change_pin
Can you tell me where  can change my PIN?	change_pin
I want a new PIN please.	change_pin
I want to create a new pin.	change_pin
Can I change my PIN if I want to?	change_pin
Do I have to go to the bank to change my PIN?	change_pin
At what ATM can I change my PIN?	change_pin
Please help me set up a new PIN.	change_pin
Is it possible for me to change my PIN number?	change_pin
Is it possible to change my pin if i am out of the country?	change_pin
Can I change my pin at a cash machine?	change_pin
At what cash machines can I change my PIN?	change_pin
Can I pick a new PIN?	change_pin
I can't freeze my account as I need the card as I am traveling, how do I change my pin?	change_pin
I want to choose a new PIN.	change_pin
Change my pin?	change_pin
I think someone saw my PIN and I am on vacation in Spain, can I change it locally at an ATM?	change_pin
If i want to change my pin number can I directly from an ATM?	change_pin
Please help me change my PIN.	change_pin
How can I change my PIN even though I'm out of the country in Austria at the moment?	change_pin
Can I change my pin at an atm?	change_pin
Can I change my PIN without going to a bank branch?	change_pin
I would like to change the the PIN on my card.	change_pin
Can I reset my PIN?	change_pin
Tell me what ATMs allow me to change my PIN.	change_pin
Your card pin can be changed at any Visa or MasterCard ATM with Pin services, excluding countries such as Belgium, Luxembourg, Austria, Germany, Spain, and France.	change_pin
Which cash machines will allow me to change my PIN?	change_pin
Can I change my PIN?	change_pin
Is it possible to change my PIN?	change_pin
Can I change my PIN at any cash machines?	change_pin
Can my PIN changed remotely without visiting a bank?	change_pin
I want to change my pin number from an ATM. Is this possible?	change_pin
Can I get a new pin number at any ATM using my card?	change_pin
May I change my PIN?	change_pin
Where can I update my pin number?	change_pin
Are their certain cash machines where I can change my pin?	change_pin
How do I change my pin while traveling?	change_pin
I think someone is using my card without my permission!	compromised_card
There are transactions that I don't remember making, i think someone might have gotten my card details and is now using it.	compromised_card
I have transactions that I don't recognize - I think someone is using my card.	compromised_card
What should I do if I think someone stole my details and used my information to make some transactions?	compromised_card
There are fraudulent charges that I didn't make on my card. Can you please put in the safeguards necessary to stop this from happening anymore?	compromised_card
How do I stop fraud to my account?	compromised_card
I think someone has hacked my card!	compromised_card
am suspicious of my card's security	compromised_card
There are strange transactions on my account.  What should I do if I think someone stole my details?	compromised_card
I sees some suspicious spending on my credit card that I don't recall I had made. What should I do?	compromised_card
What should I do if I think that someone might be using me card?	compromised_card
I think someone stole my card number and brought stuff in different places that I have never been to. I need to suspend any further purchase on my credit card.	compromised_card
What to do if my card has been used without my permission?	compromised_card
I think someone else is using my card.	compromised_card
There are charges on my card that I haven't purchased.	compromised_card
Someone might be using my card that is not me.	compromised_card
i didnt make these transactions, i think my card details might be stolen	compromised_card
I am not sure but someone else might be using my card	compromised_card
What steps can I take if someone else is using my card?	compromised_card
I think that somebody is utilizing my card without my authorization!	compromised_card
card is being used by someone else	compromised_card
How do I report possible fraudulent activity on my account?	compromised_card
am afraid someone may have gained access to the info on my card.	compromised_card
Someone is making transactions on my account, I think they took my card information.	compromised_card
How can I tell if someone else is using my card?	compromised_card
Someone might have had access to my card.	compromised_card
Someone must have found my card details as I don't recognize these transactions.	compromised_card
Somebody used my card without my knowledge!	compromised_card
I suspect someone used my card.	compromised_card
i dont recognise some of these transactions, i think someone has my card details	compromised_card
How do I report fraud on my card?	compromised_card
What do I do if I believe to be a victim of credit card fraud?	compromised_card
How do I stop fraud to my card?	compromised_card
What can I do if my card details where stolen from my car? I think they used my card to buy gas.	compromised_card
I just got an email in confirming my purchase with my card. I login to the mobile app on the card and found out there are several purchase were made without me aware of it. Evidently someone had stole my card information and made these fraudulent purchase. I need the transaction to be reverse and have my card suspended.	compromised_card
My card must have used my card as there are some transactions that I haven't done myself..	compromised_card
What do I do if I detect fraudulent use on my car?	compromised_card
My wallet was stolen and all my credit cards were in there.  HELP?!!?	compromised_card
Are my contactless settings correct? I tried to use it today but it wasn't working.	contactless_not_working
Would reinstalling the app solve the problem?	contactless_not_working
My contactless stopped working today no matter where I try to use it. How do I get it to start working again?	contactless_not_working
I can't get a contactless payment to work.	contactless_not_working
Should i uninstall the app before i try it again?	contactless_not_working
My contactless stopped working today for no good reason. It's not working no matter where I try to use it. Can you please help me fix it?	contactless_not_working
Why is my contactless not working?	contactless_not_working
how to get new card?	contactless_not_working
My contactless is non-functional.	contactless_not_working
How do I troubleshoot my contactless?	contactless_not_working
I'm confused. My contactless is suddenly not working anywhere that I try to use it. How do I fix it?	contactless_not_working
How do I troubleshoot when contactless doesn't work?	contactless_not_working
Why wouldn't my contactless work for the metro?	contactless_not_working
My contactless payments don't work.	contactless_not_working
Any charges applicable for new card?	contactless_not_working
I am having issues using contactless payments, could my card be damaged?	contactless_not_working
Can I get a card that works in other countries like Africa and Indonesia?	country_support
How do I get a card in the EU?	country_support
Can you tell me the countries you operate in?	country_support
Which countries are supported	country_support
You provide support in what countries?	country_support
I don't live in the UK. Can I still get a card?	country_support
How many countries do you work in?	country_support
Is this card available to United States Residents?	country_support
Which countries do you support?	country_support
Do you support all countries?	country_support
I live in the UK. Can I get a card?	country_support
Which countries do you operate in	country_support
Is it possible to get one the your cards in the EU?	country_support
Please list the countries you support.	country_support
What are your supported countries?	country_support
are there any country restrictions?	country_support
I want a card, but I'm not in the UK- can I get one still?	country_support
Can you tell me the countries you provide support for.	country_support
Which countries are you in?	country_support
Do you have to be in the UK to get a card?	country_support
i want to get a card but i live in the US	country_support
How does a US resident go about acquiring a new card?	country_support
Are you only able to get a card if you're in the UK?	country_support
Can the card be mailed to Europe?	country_support
Can you tell me what countries you offer support for?	country_support
Are you available in my country?	country_support
If I don't live in the UK, can I still get a card?	country_support
I'm in the EU. Can I get one of your cards?	country_support
What countries can I use my account in?	country_support
Do you do business in the EU?	country_support
can I use it in any country?	country_support
Is there anywhere  In the  Eu  this card can not be delivered in	country_support
Do you support countries other than mine?	country_support
Is it possible to get a card outside the UK?	country_support
Which countries are represented?	country_support
May I get one of your cards?  I live in the EU.	country_support
Can I get a card even though I live in the US	country_support
Is this card available to Americans?	country_support
What countries do your accounts send and receive to?	country_support
I live in the US and I would like to get a card. How do I go about getting one?	country_support
Will my new card work outside of the EU?	country_support
Can I use it outside of Europe?	country_support
Which countries does your service work in?	country_support
I reside in the US, but I want a card.	country_support
Is this open to residents of all countries?	country_support
Can I get a card if I don't reside in the UK?	country_support
In which countries does your app work	country_support
Can I have a card even if I am not living in the UK?	country_support
Can I get support?	country_support
what countries can i use my card in	country_support
What countries are you located in?	country_support
Which countries are you available in?	country_support
I live in the EU.  Can I order one of your cards?	country_support
Do you provide cards to people not in the UK?	country_support
can usa residents get a card?	country_support
What countries do your services support?	country_support
What countries do your accounts support?	country_support
Can I get a card in the US?	country_support
