text	label
I needed to send my friends some money urgently.  I tried multiple times to transfer the money this morning, but the transfer keeps failing.  Can you tell me why the transfer is getting rejected?	failed_transfer
I've been trying to do a transfer multiple times and have failed? Is the system down?	failed_transfer
My transfer failed, why?	failed_transfer
Hey, I'm buying a flat and I need my mortgage to go though. However, every time I check I get an error message. Is there any way you can help me with this transfer.	failed_transfer
Is there a reason behind why my transfer did not work?	failed_transfer
My transfer didn't work how come?	failed_transfer
So, I am in the middle of purchasing a flat. I need the money for the first mortgage payment and it is not going through. I keep receiving an error. Can you find out what's going on and help me complete this transfer?	failed_transfer
I've been trying to make a transfer and it doesn't seem to be working. (5 times) What is wrong with your system?	failed_transfer
How is this transfer supposed to work? It's not working for me.	failed_transfer
The transfer I tried to make failed.	failed_transfer
Hi, can you tell me why my transfer keeps being rejected? I've been trying to send money to my friends this morning but failed every time and I have no idea why?	failed_transfer
I can't transfer any money from my account to my friend's account, it keeps rejecting it. Can you tell me why? I have enough funds in my account to transfer.	failed_transfer
The transger I tried to make failed.	failed_transfer
Why wont the other bank take my money?? Is it not good enough?? There's sufficient funds but I keep getting denied a standard transfer. Ive tried 5 times!	failed_transfer
What would cause a transfer failure?	failed_transfer
Can you tell my why my funds transfer did not work properly?	failed_transfer
Why was I not able to complete my transfer?	failed_transfer
I tried and tried, but I could not complete my transfer. Tell me what is wrong.	failed_transfer
Can you explain why my transfer was unsuccessful?	failed_transfer
Hello, I am buying a flat and need the inital payment for the mortgage to go through. It keeps showing up as error, what is going on? Can you please help me make this transfer?	failed_transfer
A mortgage payment I'm making is giving me an error message.  This is the first time I'm making this payment and want to know what's wrong.	failed_transfer
Why hasn't my transfer gone through	failed_transfer
Can you please assist me in completing a transfer? I'm trying and I keep getting an error. I'm trying to purchase a flat and pay the initial mortgage payment. All I keep getting is an error. Can you find out what's happening here?	failed_transfer
The transfer keeps failing , I tried to transfer some money to friends this morning but it keeps getting rejected for some reason, Would you please check the issue?	failed_transfer
Why do my transfers keep failing?	failed_transfer
Can you tell me why my transfer is failing and help resolve?	failed_transfer
Why are my transfers not going through.  I have tried over 4 times to get it to work.  This is just a simple transfer.  Is something else causing this in the system?  Is it broken?	failed_transfer
Been trying to transfer money this morning but keep getting rejected. I don't understand why this is happening.	failed_transfer
Can you please explain why my transfer failed?	failed_transfer
What is happening?  I have tried to transfer money 5x already.  Is the system down?  This shouldnt be happening as this is a basic transfer.	failed_transfer
I tried to do a transfer and it hasn't worked!	failed_transfer
Why has my payment not transferred?	failed_transfer
I don't think my transfer wen through. Why?	failed_transfer
Why can't I transfer my money into someone else's account? I should be able to do so right? Why does it keep rejecting my transfer? There's no reason, all my info is correct and the money is there.	failed_transfer
please help my transfer go through	failed_transfer
My transfer failed, why did that happen?	failed_transfer
Did  my transfer fail?	failed_transfer
I have made 5 attempts to make a very standard survey, yet I can't get it to work. What is the problem? Is there an issue related to your system?	failed_transfer
Is there a problem with your system being down or something? I have already tried 5 times to issue a standard transfer but I'm getting nowhere.	failed_transfer
Why did my transfer not work?	failed_transfer
What could possibly be the cause of my failed transfer?	failed_transfer
is the a reason why my transfer has failed?	failed_transfer
Hi, I am currently in the process of buying a flat and I am waiting for the mortgage to go through but it keeps showing up as an error.  Do you know what could be causing this and can you help me get the money over.	failed_transfer
When I tried to transfer funds to my friend today I was unable to do so, why?	failed_transfer
Why does it say my transfer failed?	failed_transfer
My transfer failed to process correctly. Is there a reason this would happen?	failed_transfer
Why can't my transfer complete?	failed_transfer
I have tried 5 times at this point to complete a transfer that's simply standard. What appears to be the problem? Is your system messed up?	failed_transfer
I tried to transfer money but it didn't go through	failed_transfer
I think youre system may be broken because I have tried transfer money 5x and it isnt working!  I'm not doing anything complicated it is what I usually do.	failed_transfer
Hello.  I ran into a problem with a transfer this morning.  I was trying to send money to some friends but when I tried to send it, the transfer failed.  I don't know what is causing the transfer to be rejected.  Please let me know what is causing the problem.  Thanks.	failed_transfer
After I attempted a transfer, it failed.	failed_transfer
I did a transfer earlier but see that it failed to go through.	failed_transfer
What may be the reason that my transfer did not go through?	failed_transfer
I couldnt transfer money from my account.	failed_transfer
Hi there, I've tried to make a transfer 5 different times and its not working. Is your system down or something?	failed_transfer
I need assistance completing a transfer. I'm trying to purchase a flat and need the money for the initial mortgage payment. I keep getting an error and the transfer is not going through. What is going on here?	failed_transfer
Why was my transaction not approved?	failed_transfer
My transfer failed when I tried.	failed_transfer
I've already tried 5 times to complete a transfer that's just standard. What's the deal? Is your system down at this time?	failed_transfer
The transfer keeps failing - I tried to transfer some money to friends this morning but it keeps getting rejected for some reason, I have no idea why	failed_transfer
Errors keep showing up every time I try to make this transfer and I am on a time crunch,  could you please help.	failed_transfer
Please list what fiat currencies are supported for both holding and exchanging.	fiat_currency_support
Can you change my currency to EUR?	fiat_currency_support
What country's money can I hold currency in?	fiat_currency_support
Can I have money in more than one currency in my account?	fiat_currency_support
what currencies do you accept?	fiat_currency_support
Are you okay with exchanges to EUR?	fiat_currency_support
Please tell me the types of currency I can hold.	fiat_currency_support
Are all European currencies available for holding and exchange?	fiat_currency_support
Can I have multiple currencies in my account?	fiat_currency_support
What types of foreign money can be used with this service.?	fiat_currency_support
I need to know which flat currencies are supported by you.	fiat_currency_support
What currencies can I hold?	fiat_currency_support
Can I hold more than one currency?	fiat_currency_support
What are eligible holding and exchange currencies?	fiat_currency_support
Is it possible to hold money in multiple currencies?	fiat_currency_support
In the exchange and holding, what fiat is allowed?	fiat_currency_support
Are all fiat currencies supported?	fiat_currency_support
What currencies do you offer?	fiat_currency_support
can I have multiple currencies?	fiat_currency_support
What are the fiat currencies used?	fiat_currency_support
Which currencies are allowed?	fiat_currency_support
What are my options for holding money in multiple currencies?	fiat_currency_support
Is my country's currency supported by your system?	fiat_currency_support
What types of fiduciary currencies are supported for tenure and exchange?	fiat_currency_support
Can my account have different types of currency in it.	fiat_currency_support
Do you support fiat currencies?	fiat_currency_support
Which fiat currencies do you currently support? Will this change in this future?	fiat_currency_support
Which fiat currencies can I use through this app?	fiat_currency_support
Is it okay to hold money in multiple currencies?	fiat_currency_support
Which fiat currencies are compatible for exchange and holding?	fiat_currency_support
What currencies can I have?	fiat_currency_support
I need to know what flat currencies you support for holding and exchange.	fiat_currency_support
I'm interested in using fiat currencies, which do you support?	fiat_currency_support
What fiat currencies can I use for holding and exchanging?	fiat_currency_support
What fiat money can I used in the exchange and holding?	fiat_currency_support
Can I have money of different country of origin.	fiat_currency_support
What currency is supported for exchanges and holding?	fiat_currency_support
Is it possible to hold money in different currencies?	fiat_currency_support
are multiple currencies acceptable?	fiat_currency_support
Which flat currencies can I use from you?	fiat_currency_support
Do you have a problem with EUR exchanges?	fiat_currency_support
Can you tell me the names of the fiat currencies that I can use at your institution?	fiat_currency_support
How can I solve my issue with holding multiple currencies?	fiat_currency_support
Are you able to make exchanges to EUR?	fiat_currency_support
Do you support other currencies?	fiat_currency_support
Can you tell me if I can hold money in several currencies?	fiat_currency_support
I need to hold money, what currencies can I use?	fiat_currency_support
What fiat currencies do you allow exchange with?	fiat_currency_support
Do you have EUR currency available for me?	fiat_currency_support
What other currencies can I hang onto?	fiat_currency_support
Do you offer services that hold money in different types of currency?	fiat_currency_support
What flat currencies do you use for holding and exchanges.	fiat_currency_support
What currencies do you support?	fiat_currency_support
Is my fiat currency supported for both hold and exchange?	fiat_currency_support
Can exchanged be made to EUR?	fiat_currency_support
Do you allow currency exchanges?	fiat_currency_support
I would like to know more about what a disposable virtual card is?	get_disposable_virtual_card
Can you tell me about these disposable virtual cards?	get_disposable_virtual_card
I want a virtual card that is disposable	get_disposable_virtual_card
How can I go about getting a disposable virtual card?	get_disposable_virtual_card
Is there a disposable virtual card option?	get_disposable_virtual_card
What systems do you have in place for my security when using my card for everyday purchases?	get_disposable_virtual_card
Can you tell me how to get a disposable virtual card?	get_disposable_virtual_card
I need a disposable virtual card.	get_disposable_virtual_card
What are these disposable virtual cards all about?	get_disposable_virtual_card
How do I create a disposable virtual card?	get_disposable_virtual_card
What can I do with a disposable virtual card?	get_disposable_virtual_card
I have heard about these disposable virtual cards but don't understand how they work.	get_disposable_virtual_card
I'm not sure how disposable virtual cards work. Please help.	get_disposable_virtual_card
Will you tell me how I am supposed to use the disposable cards?	get_disposable_virtual_card
I'm interested in learning more about disposable virtual cards.	get_disposable_virtual_card
How can I obtain a disposable virtual card?	get_disposable_virtual_card
How can I get a disposable virtual card?	get_disposable_virtual_card
Please explain how I use the disposable cards?	get_disposable_virtual_card
What are the uses for disposable cards?	get_disposable_virtual_card
What is the process to create a disposable virtual card?	get_disposable_virtual_card
How does a disposable virtual card work?	get_disposable_virtual_card
How do I order a disposable virtual card?	get_disposable_virtual_card
Are there virtual disposable cards?	get_disposable_virtual_card
Can you tell me what are disposable cards for?	get_disposable_virtual_card
How can disposable cards be used?	get_disposable_virtual_card
Can you point me in the right direction of where to go to roder a disposable virtual card, I can't seem to find it.	get_disposable_virtual_card
Can you tell me where I can order a disposable virtual card?	get_disposable_virtual_card
how do I get a disposable virtual card?	get_disposable_virtual_card
What are the benefits of a disposable card?	get_disposable_virtual_card
Who can purchase a disposable virtual card?	get_disposable_virtual_card
How would I use a disposable card?	get_disposable_virtual_card
How can I get disposable virtual cards?	get_disposable_virtual_card
How can I create a disposable virtual card?	get_disposable_virtual_card
Do I need a disposable card?	get_disposable_virtual_card
In what way can I use the disposable cards?	get_disposable_virtual_card
What do the disposable cards do?	get_disposable_virtual_card
Do you offer disposable virtual cards too?	get_disposable_virtual_card
Why would I need a disposable card?	get_disposable_virtual_card
Please tell me about disposable cards.	get_disposable_virtual_card
I want to make an online purchase but I don't want to use my credit card. Can you tell me how a disposable virtual card works and where I can apply for one?	get_disposable_virtual_card
Can I use a disposable virtual card for any purchase?	get_disposable_virtual_card
can i get a virtual card online	get_disposable_virtual_card
Where do I get a disposable virtual card?	get_disposable_virtual_card
What is the function of the disposable cards?	get_disposable_virtual_card
How do I request the PIN?	get_physical_card
Can you deliver the PIN separately?	get_physical_card
Where can I find my card PIN?	get_physical_card
wheres my pin	get_physical_card
How long does it take for me to get my pin	get_physical_card
I can't find the PIN.	get_physical_card
I need my PIN, where is it?	get_physical_card
do i have to wait for a physical card before i get my pin	get_physical_card
I signed up, but don't have a PIN. Where can I find it?	get_physical_card
i cannot find my card PIN	get_physical_card
I'm not sure what to do about the PIN, because I don't have one yet.	get_physical_card
Where is the PIN for my card located?	get_physical_card
Where is my pin? I don't have it yet	get_physical_card
Where can I locate my PIN at?	get_physical_card
What's my pin number?	get_physical_card
Show me where I can see the PIN?	get_physical_card
Do you deliver the PIN separately?	get_physical_card
I haven't been sent my new pin!	get_physical_card
Do I have a card PIN?	get_physical_card
can i go into my app to find my pin	get_physical_card
I cannot see the card PIN anywhere?	get_physical_card
Why have I not received my PIN	get_physical_card
I am yet to receive my pin.	get_physical_card
I don't have a PIN at this point.	get_physical_card
I didn't get a PIN yet. What gives?	get_physical_card
Can you tell me how to locate my PIN?	get_physical_card
i have yet to get my pin	get_physical_card
I am not able to see the card PIN anywhere?	get_physical_card
How do I get started when I get my card?	get_physical_card
Where is my PIN located?	get_physical_card
How long do I wait for my PIN	get_physical_card
How is the PIN delivered?	get_physical_card
The card PIN?	get_physical_card
can i create my own pin right away	get_physical_card
How do I get a PIN?	get_physical_card
Is the PIN separately delivered?	get_physical_card
How do I set my physical card PIN?	get_physical_card
Where is the PIN number found?	get_physical_card
Is the PIN sent in another message?	get_physical_card
What can you tell me about the card PIN?	get_physical_card
Where do i find my PIN?	get_physical_card
I haven't received the PIN yet.	get_physical_card
How do I set up my card PIN?	get_physical_card
Where can I find my PIN? I haven't gotten it yet.	get_physical_card
Where can I get my card PIN?	get_physical_card
In regards to the PIN of the card?	get_physical_card
Explain the card PIN to me.	get_physical_card
So, the card PIN?	get_physical_card
Can I have a spare card for this account please?	getting_spare_card
Can I have a third card?	getting_spare_card
May I order another card?	getting_spare_card
Is it free to send out more cards?	getting_spare_card
What steps do I need to get another card?	getting_spare_card
Do you charge extra for duplicate cards?	getting_spare_card
How do I get a spare card?	getting_spare_card
Can I have more than one card?	getting_spare_card
How much is it to send out additional cards?	getting_spare_card
How do I get another card	getting_spare_card
What's the limit on total number of cards I can have?	getting_spare_card
Does it cost extra to send out more than one card?	getting_spare_card
Will there be a charge for sending out more cards?	getting_spare_card
I need a new card.	getting_spare_card
I would like a second card.	getting_spare_card
I need two cards. Is this possible?	getting_spare_card
I would like to get some extra cards?	getting_spare_card
Can I have more physical cards?	getting_spare_card
I'd like to have extra cards. Will I have to pay for that?	getting_spare_card
Are extra charges added for sending out additional cards?	getting_spare_card
Can I get a second card for free?	getting_spare_card
How do I go about ordering another card?	getting_spare_card
I'm looking to get an additional card.	getting_spare_card
I would like to purchase another card.	getting_spare_card
If I need more than cards will I have to pay a fee to receive them?	getting_spare_card
Can I have a duplicate second card?	getting_spare_card
My daughter need a card from this account. Is that possible?	getting_spare_card
Is it possible to have a second card?	getting_spare_card
I'd like to order another card	getting_spare_card
Am I gonna be charged for sending out more cards?	getting_spare_card
How many active cards can I have?	getting_spare_card
I would like more physical cards	getting_spare_card
I need more physical cards than I have right now!	getting_spare_card
How do I order another card?	getting_spare_card
I am interested in giving a second card to my daughter, how can I make this happen?	getting_spare_card
I need another card	getting_spare_card
Do you charge for sending more cards?	getting_spare_card
Is it possible to get a second card for my daughter?	getting_spare_card
I want to get few more physical cards	getting_spare_card
Can I have a second card issued to another family member?	getting_spare_card
How can I get another card?	getting_spare_card
Would I be able to get a second card?	getting_spare_card
Am I permitted to have a spare card?	getting_spare_card
How can I create another card linked to this account?	getting_spare_card
I'd like to order an additional card	getting_spare_card
Are extra cards free?	getting_spare_card
Are there any fees to get additional cards?	getting_spare_card
Can you send me more cards for my account?	getting_spare_card
How much would an extra card cost?	getting_spare_card
I'd like to get another card	getting_spare_card
My daughter would like a card from my account?  Can I do this?	getting_spare_card
Can I give a second card for this account to my daughter?	getting_spare_card
How do I obtain a second card?	getting_spare_card
Will it cost me to get a second card?	getting_spare_card
Is there a fee for sending out more cards?	getting_spare_card
How do i request more physical cards?	getting_spare_card
Is it possible to purchase more physical cards with my account?	getting_spare_card
I would like some more physical cards, what is my limit?	getting_spare_card
I did not get my virtual card yet, Why?	getting_virtual_card
I've got to have one of those virtual cards.	getting_virtual_card
Why have I not yet received my virtual card?	getting_virtual_card
I haven't received my virtual card.	getting_virtual_card
How do I go about getting a virtual card?	getting_virtual_card
my virtual card has not came yet!	getting_virtual_card
I can't find the virtual card	getting_virtual_card
How can I obtain a virtual card?	getting_virtual_card
Where can i find the virtual card?	getting_virtual_card
I need my virtual card	getting_virtual_card
How to order a virtual card	getting_virtual_card
I'd rather not use my physical card, how can I get a virtual card?	getting_virtual_card
I ordered a virtual card but it hasn't come through yet	getting_virtual_card
Can i have a virtual card?	getting_virtual_card
How do I access the virtual card?	getting_virtual_card
I'd like like to know where I can order a virtual card?	getting_virtual_card
Please explain to me the process of getting a virtual card.	getting_virtual_card
Where do I order a virtual card?	getting_virtual_card
I want to get my hands on one of those virtual cards!	getting_virtual_card
Can you give me a virtual card?	getting_virtual_card
I haven't received my virtual card yet, do yo know why?	getting_virtual_card
I don't have a virtual card - how do I get one?	getting_virtual_card
Do I get to have one of those virtual cards I've heard about?	getting_virtual_card
How do I go about getting hold of a virtual card?	getting_virtual_card
I want to get a virtual card!	getting_virtual_card
What is the way to go about getting a virtual card?	getting_virtual_card
I need to order a new virtual card, how do I do that?	getting_virtual_card
I look but I see no virtual card. Why is that?	getting_virtual_card
I'd like more info on getting a virtual card.	getting_virtual_card
How can I sign up for a virtual card?	getting_virtual_card
How do I receive a virtual card?	getting_virtual_card
explain the virtual card	getting_virtual_card
where can i have a virtual card	getting_virtual_card
And do you have virtual cards instead of physical ones?	getting_virtual_card
I need to order a new card, can you please direct me to the virtual cards?	getting_virtual_card
How come I didn't get a virtual card yet?	getting_virtual_card
How do I get my virtual card?	getting_virtual_card
How do I get to the virtual cards?	getting_virtual_card
Where do I get a virtual card?	getting_virtual_card
how to i go about getting my virtual card	getting_virtual_card
How come I did not get a virtual card yet?	getting_virtual_card
i need a virtual card	getting_virtual_card
Where do i go to receive a virtual card	getting_virtual_card
Where can virtual cards be ordered?	getting_virtual_card
I believe that my card has been stolen!	lost_or_stolen_card
I want to block my card or deactivate it or something, it's been stolen and I don't want it misused. I want this handled right away.	lost_or_stolen_card
My wallet was stolen, along with my cards. How do I put a freeze on my cards and order a new one?	lost_or_stolen_card
Can you help me retrieve my card?	lost_or_stolen_card
How do I replace a stolen card?	lost_or_stolen_card
Please help me.  My card is missing.	lost_or_stolen_card
My card has been stolen. I reported it with the police, but I need to report it with you as well.	lost_or_stolen_card
I need to report a stolen card	lost_or_stolen_card
help, lost my card	lost_or_stolen_card
Someone stole my card!	lost_or_stolen_card
What are the steps I need to do if I have a stolen card?	lost_or_stolen_card
What do I do if my card was stolen.	lost_or_stolen_card
Help! I lost my card!	lost_or_stolen_card
My card is missing.	lost_or_stolen_card
How can I report that my card was stolen? I made a police report first.	lost_or_stolen_card
Help Me!  I lost my card.  What should I do?	lost_or_stolen_card
I left my card at a restaurant and now its missing.	lost_or_stolen_card
I lost my card n need a new one.	lost_or_stolen_card
i need help, i lost my card	lost_or_stolen_card
I can't find my card! Can you help?	lost_or_stolen_card
Can you tell me the status of my new card?	lost_or_stolen_card
I misplaced my card and I dont know where the last place is where I used the card last. Can you look at my account and tell me the last place I used the card?	lost_or_stolen_card
Need help with a stolen card.	lost_or_stolen_card
I lost my card. Can you help me?	lost_or_stolen_card
Who can I speak with regarding a lost card?	lost_or_stolen_card
What should I do?  My card has been stolen!	lost_or_stolen_card
I think that the card is stolen.  What are my next steps?	lost_or_stolen_card
How do I report my card as lost or stolen?	lost_or_stolen_card
My card was stolen	lost_or_stolen_card
Someone took my card without permission	lost_or_stolen_card
Help!  My card is stolen.	lost_or_stolen_card
I seem to have lost my card.	lost_or_stolen_card
What do I do if my card is stolen?	lost_or_stolen_card
My card has been lost / stolen	lost_or_stolen_card
I think my card is stolen!	lost_or_stolen_card
Hi, I am on vacation in Spain and someone stole my bag with my phone and wallet with cards and everything. Can you block it ASAP and then I want to order a new one also ASAP.	lost_or_stolen_card
My card has been stolen what do I do?	lost_or_stolen_card
I just replaced my phone so do I have to make a new account?	lost_or_stolen_phone
Hi, I lost my phone yesterday, what can I do to stop someone using my account on it?	lost_or_stolen_phone
